3,GO VENTRICULAR CARDIAC MUSCLE CELL MEMBRANE REPOLARIZATION,0.00010497,0.24573,0.2613,1,1
3,GO ADAPTIVE IMMUNE RESPONSE BASED ON SOMATIC RECOMBINATION OF IMMUNE RECEPTORS BUILT FROM IMMUNOGLOBULIN SUPERFAMILY DOMAINS,0.00011596,0.24512,0.22192,1,1
3,GO RESPONSE TO MACROPHAGE COLONY STIMULATING FACTOR,0.00033955,0.24511,0.26476,1,1
3,GO REGULATION OF PROTEIN EXIT FROM ENDOPLASMIC RETICULUM,3.9941e-08,0.24502,0.30204,1,1
3,GO PLASMA LIPOPROTEIN PARTICLE CLEARANCE,0.0094686,0.24489,0.14903,1,1
3,GO REGULATION OF NEUROTRANSMITTER UPTAKE,0.021053,0.24488,0.14723,1,1
3,GO DEFENSE RESPONSE TO OTHER ORGANISM,3.7605e-06,0.24487,0.20852,1,1
3,GO ETHER METABOLIC PROCESS,8.4262e-06,0.24466,0.23615,1,1
3,GO LABYRINTHINE LAYER DEVELOPMENT,7.3803e-06,0.24427,0.26567,1,1
3,GO CELLULAR RESPONSE TO PURINE CONTAINING COMPOUND,0.00076726,0.24421,0.26313,1,1
3,GO REGULATION OF GLYCOGEN METABOLIC PROCESS,1.1375e-05,0.24395,0.22713,1,1
3,GO REGULATION OF ENDOTHELIAL CELL DIFFERENTIATION,0.00080175,0.24391,0.19863,1,1
3,GO REGULATION OF CARDIAC MUSCLE CELL ACTION POTENTIAL,0.0005211,0.24362,0.26633,1,1
3,GO RESPONSE TO INTERLEUKIN 2,1.5865e-05,0.24361,0.23882,1,1
3,GO LIPOPOLYSACCHARIDE MEDIATED SIGNALING PATHWAY,0.00026858,0.24329,0.20589,1,1
3,GO ADAPTIVE IMMUNE RESPONSE,2.5424e-05,0.24322,0.23324,1,1
3,GO REGULATION OF MACROPHAGE DIFFERENTIATION,0.0034243,0.24312,0.202,1,1
3,GO CELLULAR RESPONSE TO REACTIVE NITROGEN SPECIES,1.0557e-05,0.24279,0.2197,1,1
3,GO DEFENSE RESPONSE TO GRAM POSITIVE BACTERIUM,7.8911e-05,0.24276,0.19494,1,1
3,GO REGULATION OF HEART RATE BY CARDIAC CONDUCTION,6.0079e-05,0.24258,0.27502,1,1
3,GO RESPONSE TO PROTOZOAN,0.00040235,0.24256,0.20731,1,1
3,GO REGULATION OF RESPONSE TO CYTOKINE STIMULUS,8.1361e-07,0.24249,0.24819,1,1
3,GO POSITIVE REGULATION OF VASCULAR ASSOCIATED SMOOTH MUSCLE CELL PROLIFERATION,0.00076726,0.24212,0.20162,1,1
3,GO LOW DENSITY LIPOPROTEIN PARTICLE REMODELING,0.00054518,0.2419,0.28227,1,1
3,GO REGULATION OF CYTOKINE PRODUCTION INVOLVED IN IMMUNE RESPONSE,0.00022208,0.24168,0.21401,1,1
3,GO CERAMIDE METABOLIC PROCESS,4.8198e-07,0.24168,0.22569,1,1
3,GO DEFENSE RESPONSE TO BACTERIUM,4.1552e-07,0.24129,0.22591,1,1
3,GO REGULATION OF RECEPTOR BINDING,0.0099244,0.24126,0.19736,1,1
3,GO RESPONSE TO REDOX STATE,0.00073415,0.24099,0.21469,1,1
3,GO POSITIVE REGULATION OF CELL SUBSTRATE ADHESION,0.00099681,0.24062,0.19893,1,1
3,GO CERAMIDE BIOSYNTHETIC PROCESS,5.9498e-07,0.24045,0.23021,1,1
3,GO POSITIVE REGULATION OF INTERLEUKIN 6 PRODUCTION,1.1806e-05,0.24039,0.23053,1,1
3,GO NEGATIVE REGULATION OF WOUND HEALING,0.00031907,0.24031,0.2104,1,1
3,GO RESPONSE TO THYROID HORMONE,0.0023321,0.24025,0.22888,1,1
3,GO NUCLEOTIDE SALVAGE,0.0050904,0.23993,0.16568,1,1
3,GO NEGATIVE REGULATION OF SMOOTH MUSCLE CELL MIGRATION,0.00074504,0.23986,0.20164,1,1
3,GO REGULATION OF PHOSPHOLIPID BIOSYNTHETIC PROCESS,0.00029511,0.23978,0.23813,1,1
3,GO POSITIVE REGULATION OF ENDOTHELIAL CELL DIFFERENTIATION,0.0022701,0.23973,0.20385,1,1
3,GO TYPE 2 IMMUNE RESPONSE,0.0013443,0.23972,0.25946,1,1
3,GO NEGATIVE REGULATION OF MUSCLE HYPERTROPHY,0.002631,0.23964,0.19833,1,1
3,GO REGULATION OF TYPE I INTERFERON MEDIATED SIGNALING PATHWAY,7.4873e-07,0.23938,0.24555,1,1
3,GO MULTICELLULAR ORGANISMAL RESPONSE TO STRESS,2.5868e-06,0.23907,0.21568,1,1
3,GO REGULATION OF ENDOPLASMIC RETICULUM UNFOLDED PROTEIN RESPONSE,1.3056e-06,0.23899,0.24376,1,1
3,GO LEUKOCYTE PROLIFERATION,2.3661e-05,0.23888,0.19964,1,1
3,GO NEGATIVE REGULATION OF LYMPHOCYTE APOPTOTIC PROCESS,0.00086244,0.2388,0.19515,1,1
3,GO POSITIVE REGULATION OF ADAPTIVE IMMUNE RESPONSE,0.00040857,0.23848,0.20915,1,1
3,GO REGULATION OF MYOTUBE DIFFERENTIATION,6.4592e-06,0.23836,0.22349,1,1
3,GO GLYCOSYLCERAMIDE METABOLIC PROCESS,0.00014129,0.23836,0.2467,1,1
3,GO AMYLOID BETA CLEARANCE,0.0011836,0.23834,0.18197,1,1
3,GO LEUKOCYTE CELL CELL ADHESION,0.00025617,0.23832,0.17073,1,1
3,GO MYELOID LEUKOCYTE MEDIATED IMMUNITY,2.342e-06,0.23829,0.22751,1,1
3,GO T CELL PROLIFERATION,8.5858e-05,0.23811,0.19412,1,1
3,GO TYPE I INTERFERON PRODUCTION,2.7804e-05,0.23802,0.20589,1,1
3,GO CELLULAR RESPONSE TO THYROID HORMONE STIMULUS,0.001071,0.23776,0.27854,1,1
3,GO ZYMOGEN INHIBITION,0.00032408,0.23737,0.24101,1,1
3,GO REGULATION OF B CELL MEDIATED IMMUNITY,4.9694e-05,0.2373,0.21172,1,1
3,GO SMOOTH MUSCLE CELL MIGRATION,0.00029052,0.23726,0.22772,1,1
3,GO TRIGLYCERIDE BIOSYNTHETIC PROCESS,8.5867e-06,0.23708,0.25625,1,1
3,GO AMYLOID PRECURSOR PROTEIN METABOLIC PROCESS,0.00027716,0.23689,0.18945,1,1
3,GO RESPONSE TO MINERALOCORTICOID,0.00026858,0.23686,0.19676,1,1
3,GO REGULATION OF LYMPHOCYTE MEDIATED IMMUNITY,3.5022e-05,0.23684,0.20176,1,1
3,GO CYTOKINE PRODUCTION INVOLVED IN INFLAMMATORY RESPONSE,0.00029052,0.23664,0.18616,1,1
3,GO CELL CELL JUNCTION ASSEMBLY,3.2146e-06,0.23655,0.21893,1,1
3,GO MYELOID LEUKOCYTE ACTIVATION,1.7693e-06,0.23651,0.22354,1,1
3,GO POSITIVE REGULATION OF CALCIUM ION DEPENDENT EXOCYTOSIS,0.0016806,0.23617,0.32721,1,1
3,GO INTERLEUKIN 1 PRODUCTION,0.00063314,0.23616,0.19057,1,1
3,GO GASTRULATION WITH MOUTH FORMING SECOND,3.0395e-05,0.23606,0.26295,1,1
3,GO POSITIVE REGULATION OF T CELL PROLIFERATION,0.0005211,0.2359,0.18889,1,1
3,GO MOVEMENT IN HOST ENVIRONMENT,9.6562e-05,0.23586,0.2065,1,1
3,GO POSITIVE REGULATION OF CELL CELL ADHESION,0.00024819,0.23584,0.17376,1,1
3,GO REGULATION OF GRANULOCYTE CHEMOTAXIS,6.7105e-06,0.23577,0.21915,1,1
3,GO REGULATION OF HORMONE METABOLIC PROCESS,0.0011341,0.23522,0.22982,1,1
3,GO LONG CHAIN FATTY ACYL COA METABOLIC PROCESS,6.4341e-05,0.23518,0.25087,1,1
3,GO NEGATIVE REGULATION OF BLOOD PRESSURE,1.0958e-05,0.23495,0.22328,1,1
3,GO CELLULAR BIOGENIC AMINE METABOLIC PROCESS,3.2894e-09,0.23488,0.2535,1,1
3,GO MYELOID LEUKOCYTE CYTOKINE PRODUCTION,3.5022e-05,0.23433,0.26092,1,1
3,GO WATER HOMEOSTASIS,1.1316e-06,0.23429,0.25954,1,1
3,GO NEGATIVE REGULATION OF CELL ACTIVATION,6.3249e-05,0.23428,0.20076,1,1
3,GO REGULATION OF NECROTIC CELL DEATH,3.8347e-06,0.23423,0.24707,1,1
3,GO POSITIVE REGULATION OF ALPHA BETA T CELL ACTIVATION,0.0054872,0.23421,0.14508,1,1
3,GO POSITIVE REGULATION OF INTERLEUKIN 10 PRODUCTION,7.3803e-06,0.23419,0.23422,1,1
3,GO NEUROTRANSMITTER CATABOLIC PROCESS,0.00080175,0.23407,0.24898,1,1
3,GO MEMBRANE LIPID METABOLIC PROCESS,1.9465e-08,0.23402,0.23958,1,1
3,GO AMINO SUGAR CATABOLIC PROCESS,6.1119e-05,0.23401,0.22774,1,1
3,GO POSITIVE REGULATION OF BROWN FAT CELL DIFFERENTIATION,0.033948,0.23398,0.17099,1,1
3,GO REGULATION OF DEFENSE RESPONSE TO VIRUS,0.00033955,0.23385,0.18926,1,1
3,GO TUMOR NECROSIS FACTOR MEDIATED SIGNALING PATHWAY,1.0004e-06,0.23348,0.23013,1,1
3,GO REGULATION OF SYNAPTIC TRANSMISSION DOPAMINERGIC,0.00026024,0.23307,0.25537,1,1
3,GO LEUKOCYTE MEDIATED IMMUNITY,1.9175e-06,0.23276,0.2251,1,1
3,GO POSITIVE REGULATION OF ATP METABOLIC PROCESS,0.00017457,0.2327,0.22336,1,1
3,GO POSITIVE REGULATION OF T CELL CYTOKINE PRODUCTION,0.0022701,0.23251,0.17138,1,1
3,GO REGULATION OF TYPE 2 IMMUNE RESPONSE,0.0039481,0.23227,0.24943,1,1
3,GO RESPONSE TO VIRUS,3.6924e-05,0.23198,0.20285,1,1
3,GO CELLULAR CARBOHYDRATE BIOSYNTHETIC PROCESS,3.1004e-08,0.23186,0.24211,1,1
3,GO REGULATION OF GLYCOPROTEIN METABOLIC PROCESS,1.1806e-05,0.23184,0.23861,1,1
3,GO CELLULAR RESPONSE TO EXOGENOUS DSRNA,0.00049053,0.23183,0.20906,1,1
3,GO AROMATIC AMINO ACID FAMILY METABOLIC PROCESS,6.4592e-06,0.23153,0.19625,1,1
3,GO PHOSPHOLIPID TRANSPORT,1.5037e-07,0.23133,0.24994,1,1
3,GO REGULATION OF TOLL LIKE RECEPTOR SIGNALING PATHWAY,1.0361e-05,0.23095,0.22136,1,1
3,GO NAD BIOSYNTHESIS VIA NICOTINAMIDE RIBOSIDE SALVAGE PATHWAY,5.5127e-05,0.23093,0.32169,1,1
3,GO POSITIVE REGULATION OF IMMUNE EFFECTOR PROCESS,4.5558e-05,0.23079,0.18662,1,1
3,GO HEART TRABECULA FORMATION,0.0024281,0.23071,0.23586,1,1
3,GO NEGATIVE REGULATION OF LEUKOCYTE CELL CELL ADHESION,1.1165e-05,0.23062,0.242,1,1
3,GO REGULATION OF MYELOID LEUKOCYTE MEDIATED IMMUNITY,0.00026024,0.23062,0.20604,1,1
3,GO KERATINOCYTE DIFFERENTIATION,2.6914e-06,0.23039,0.23749,1,1
3,GO DIGESTIVE SYSTEM PROCESS,2.2958e-06,0.23038,0.22065,1,1
3,GO LIPOPROTEIN CATABOLIC PROCESS,0.00076726,0.23022,0.25651,1,1
3,GO LYTIC VACUOLE ORGANIZATION,3.4553e-09,0.23016,0.27709,1,1
3,GO REGULATION OF FATTY ACID BIOSYNTHETIC PROCESS,3.8161e-07,0.23007,0.26833,1,1
3,GO REGULATION OF RECEPTOR CATABOLIC PROCESS,0.0023637,0.22982,0.24209,1,1
3,GO REGULATION OF LAMELLIPODIUM MORPHOGENESIS,0.0047198,0.2296,0.29559,1,1
3,GO NEGATIVE REGULATION OF FIBROBLAST GROWTH FACTOR RECEPTOR SIGNALING PATHWAY,0.034636,0.22948,0.28892,1,1
3,GO POSITIVE REGULATION OF TISSUE REMODELING,0.0001803,0.22946,0.25092,1,1
3,GO TOLL LIKE RECEPTOR SIGNALING PATHWAY,1.8793e-06,0.22903,0.22475,1,1
3,GO REGULATION OF SYSTEMIC ARTERIAL BLOOD PRESSURE,2.913e-06,0.22898,0.23997,1,1
3,GO NEGATIVE REGULATION OF CYTOKINE PRODUCTION,0.00010852,0.22894,0.20088,1,1
3,GO POSITIVE REGULATION OF SODIUM ION TRANSMEMBRANE TRANSPORTER ACTIVITY,8.3013e-05,0.22881,0.27936,1,1
3,GO REGULATION OF AMYLOID BETA CLEARANCE,0.010895,0.22864,0.21329,1,1
3,GO REGULATION OF IRE1 MEDIATED UNFOLDED PROTEIN RESPONSE,9.6129e-06,0.22864,0.23939,1,1
3,GO STEROID METABOLIC PROCESS,9.404e-07,0.22852,0.22288,1,1
3,GO REGULATION OF HEART RATE,5.6487e-06,0.22849,0.21882,1,1
3,GO MEMBRANE DEPOLARIZATION,4.4807e-06,0.22843,0.24352,1,1
3,GO RESPONSE TO CORTICOSTERONE,0.00070238,0.22817,0.21117,1,1
3,GO REGULATION OF INNATE IMMUNE RESPONSE,2.5868e-06,0.22802,0.2016,1,1
3,GO REGULATION OF GLUCOSE METABOLIC PROCESS,8.8282e-08,0.22778,0.22878,1,1
3,GO REGULATION OF MUSCLE HYPERTROPHY,0.00015331,0.22767,0.18593,1,1
3,GO POSITIVE REGULATION OF VIRAL RELEASE FROM HOST CELL,0.0013255,0.22756,0.18414,1,1
3,GO BARBED END ACTIN FILAMENT CAPPING,0.0021505,0.2275,0.25308,1,1
3,GO FUCOSYLATION,0.00016629,0.22743,0.19901,1,1
3,GO ORGANIC HYDROXY COMPOUND TRANSPORT,5.2445e-07,0.22727,0.21512,1,1
3,GO EPITHELIAL CELL FATE COMMITMENT,0.014494,0.22714,0.1694,1,1
3,GO CYTOKINE METABOLIC PROCESS,2.011e-05,0.22661,0.22591,1,1
3,GO RESPONSE TO INSECTICIDE,0.0025277,0.22659,0.25077,1,1
3,GO PHOSPHATIDYLCHOLINE METABOLIC PROCESS,7.7166e-08,0.22634,0.23562,1,1
3,GO REGULATION OF PROSTAGLANDIN SECRETION,2.4371e-06,0.2262,0.25744,1,1
3,GO POSITIVE REGULATION OF LEUKOCYTE CELL CELL ADHESION,0.00084997,0.22591,0.15646,1,1
3,GO MEMBRANE REPOLARIZATION DURING VENTRICULAR CARDIAC MUSCLE CELL ACTION POTENTIAL,0.00014129,0.22584,0.27104,1,1
3,GO LIPID LOCALIZATION,4.4285e-07,0.22575,0.21084,1,1
3,GO NEGATIVE REGULATION OF ANIMAL ORGAN MORPHOGENESIS,0.0020367,0.22549,0.16176,1,1
3,GO REGULATION OF NATURAL KILLER CELL ACTIVATION,0.00037257,0.22505,0.19479,1,1
3,GO POLYSACCHARIDE BIOSYNTHETIC PROCESS,1.8723e-07,0.22493,0.24429,1,1
3,GO REGULATION OF WOUND HEALING,6.9711e-06,0.22466,0.25698,1,1
3,GO IMMUNE EFFECTOR PROCESS,4.4807e-06,0.22446,0.21305,1,1
3,GO INTERLEUKIN 6 MEDIATED SIGNALING PATHWAY,0.00042777,0.22445,0.23852,1,1
3,GO PLATELET DEGRANULATION,9.3381e-05,0.22443,0.24482,1,1
3,GO TUMOR NECROSIS FACTOR BIOSYNTHETIC PROCESS,8.5858e-05,0.22439,0.22256,1,1
3,GO NEGATIVE REGULATION OF DEFENSE RESPONSE,0.0001803,0.22436,0.18377,1,1
3,GO NUCLEOBASE CONTAINING SMALL MOLECULE CATABOLIC PROCESS,1.9175e-06,0.22435,0.21917,1,1
3,GO L ASCORBIC ACID METABOLIC PROCESS,0.00061456,0.22411,0.25674,1,1
3,GO RESPONSE TO GROWTH HORMONE,7.2414e-06,0.22411,0.27133,1,1
3,GO REGULATION OF FATTY ACID TRANSPORT,2.4861e-06,0.22409,0.26441,1,1
3,GO NEGATIVE REGULATION OF LYMPHOCYTE ACTIVATION,3.4409e-05,0.22382,0.219,1,1
3,GO REGULATION OF MEMBRANE REPOLARIZATION,4.8839e-05,0.22363,0.22695,1,1
3,GO RESPONSE TO CAFFEINE,0.00091404,0.22357,0.17298,1,1
3,GO OLIGOPEPTIDE TRANSPORT,0.0027381,0.22351,0.19619,1,1
3,GO POSITIVE REGULATION OF VOLTAGE GATED POTASSIUM CHANNEL ACTIVITY,0.007921,0.22303,0.22892,1,1
3,GO REGULATION OF CELLULAR CARBOHYDRATE METABOLIC PROCESS,5.3562e-07,0.22297,0.20633,1,1
3,GO HUMORAL IMMUNE RESPONSE,2.7452e-06,0.22296,0.21912,1,1
3,GO REGULATION OF GLIAL CELL APOPTOTIC PROCESS,0.0044864,0.22277,0.26423,1,1
3,GO POSITIVE REGULATION OF LYMPHOCYTE MEDIATED IMMUNITY,2.8305e-05,0.22263,0.2121,1,1
3,GO CALCIUM ION REGULATED EXOCYTOSIS,0.00010323,0.22261,0.27332,1,1
3,GO NECROTIC CELL DEATH,1.9175e-06,0.2226,0.24329,1,1
3,GO POSITIVE REGULATION OF HEART CONTRACTION,1.3325e-06,0.2226,0.26819,1,1
3,GO PROTEIN HYDROXYLATION,0.001568,0.22257,0.21446,1,1
3,GO CELL ACTIVATION INVOLVED IN IMMUNE RESPONSE,3.6877e-06,0.22207,0.21847,1,1
3,GO PHENOL CONTAINING COMPOUND METABOLIC PROCESS,5.6487e-06,0.22194,0.1965,1,1
3,GO ALANINE TRANSPORT,0.0019819,0.22166,0.18479,1,1
3,GO CYTOPLASM ORGANIZATION,0.00046165,0.22164,0.22002,1,1
3,GO FATTY ACID DERIVATIVE METABOLIC PROCESS,2.206e-06,0.22159,0.21911,1,1
3,GO NEGATIVE REGULATION OF CELL ADHESION MEDIATED BY INTEGRIN,0.00020178,0.22149,0.30217,1,1
3,GO VASCULAR WOUND HEALING,0.00016361,0.22131,0.29661,1,1
3,GO LEUKOCYTE MIGRATION,7.5217e-06,0.22121,0.20746,1,1
3,GO REGULATION OF LIPID BIOSYNTHETIC PROCESS,5.8856e-08,0.2211,0.24094,1,1
3,GO TRANSFORMING GROWTH FACTOR BETA PRODUCTION,0.00019541,0.22106,0.21008,1,1
3,GO REGULATION OF HUMORAL IMMUNE RESPONSE,0.00023294,0.22095,0.25277,1,1
3,GO LINOLEIC ACID METABOLIC PROCESS,0.0016806,0.22095,0.21277,1,1
3,GO REGULATION OF IMMUNE EFFECTOR PROCESS,2.6828e-05,0.22092,0.20817,1,1
3,GO T HELPER CELL LINEAGE COMMITMENT,0.0019023,0.22088,0.16636,1,1
3,GO PLATELET ACTIVATION,0.00011406,0.22078,0.19797,1,1
3,GO CARDIAC MUSCLE CELL MEMBRANE REPOLARIZATION,0.00013232,0.2207,0.24058,1,1
3,GO REGULATION OF T CELL CYTOKINE PRODUCTION,0.004156,0.22051,0.17448,1,1
3,GO VENTRICULAR CARDIAC MUSCLE CELL ACTION POTENTIAL,0.00019541,0.22047,0.26851,1,1
3,GO POSITIVE REGULATION OF REACTIVE OXYGEN SPECIES BIOSYNTHETIC PROCESS,2.8814e-05,0.22043,0.23798,1,1
3,GO INTRINSIC APOPTOTIC SIGNALING PATHWAY IN RESPONSE TO ENDOPLASMIC RETICULUM STRESS,1.3468e-07,0.2201,0.27824,1,1
3,GO POSITIVE REGULATION OF NON CANONICAL WNT SIGNALING PATHWAY,0.0059116,0.22005,0.21434,1,1
3,GO ICOSANOID BIOSYNTHETIC PROCESS,0.00024045,0.21991,0.20062,1,1
3,GO NEGATIVE REGULATION OF PRODUCTION OF MOLECULAR MEDIATOR OF IMMUNE RESPONSE,0.000286,0.21971,0.22649,1,1
3,GO AMINOGLYCAN BIOSYNTHETIC PROCESS,3.2631e-05,0.21934,0.22268,1,1
3,GO DIOL BIOSYNTHETIC PROCESS,8.1138e-06,0.21928,0.28255,1,1
3,GO RESPONSE TO ARSENIC CONTAINING SUBSTANCE,0.00013673,0.21883,0.22247,1,1
3,GO INTERFERON ALPHA PRODUCTION,5.8698e-06,0.21882,0.24911,1,1
3,GO PROTEIN TARGETING TO LYSOSOME,0.00044103,0.21872,0.26155,1,1
3,GO POSITIVE REGULATION OF MUSCLE CELL APOPTOTIC PROCESS,0.0014624,0.21857,0.18582,1,1
3,GO ICOSANOID METABOLIC PROCESS,9.2585e-06,0.21835,0.2503,1,1
3,GO DEFENSE RESPONSE,2.342e-06,0.21824,0.19904,1,1
3,GO REGULATION OF ACTION POTENTIAL,0.00033955,0.21818,0.21286,1,1
3,GO REGULATION OF LYMPHOCYTE APOPTOTIC PROCESS,0.00019541,0.21816,0.20376,1,1
3,GO MANNOSYLATION,1.3325e-06,0.21807,0.24139,1,1
3,GO POSITIVE REGULATION OF TYROSINE PHOSPHORYLATION OF STAT PROTEIN,0.00013673,0.21807,0.22837,1,1
3,GO PROTEIN CONTAINING COMPLEX REMODELING,0.00055343,0.21798,0.22871,1,1
3,GO ORGANOPHOSPHATE ESTER TRANSPORT,1.2143e-08,0.2179,0.23821,1,1
3,GO POLYSACCHARIDE METABOLIC PROCESS,5.2445e-07,0.21786,0.21451,1,1
3,GO POSITIVE REGULATION OF MYELOID LEUKOCYTE MEDIATED IMMUNITY,0.00024045,0.21778,0.21432,1,1
3,GO POSITIVE REGULATION OF OXIDATIVE STRESS INDUCED CELL DEATH,0.00029976,0.21778,0.1816,1,1
3,GO INTEGRIN ACTIVATION,3.4098e-06,0.21744,0.264,1,1
3,GO REGULATION OF POSITIVE CHEMOTAXIS,3.5022e-05,0.21738,0.23843,1,1
3,GO LEUKOCYTE CHEMOTAXIS,2.7804e-05,0.21726,0.18397,1,1
3,GO NEGATIVE REGULATION OF NOTCH SIGNALING PATHWAY,0.00017741,0.2172,0.27659,1,1
3,GO CELLULAR RESPONSE TO STEROL DEPLETION,1.3948e-05,0.21702,0.25921,1,1
3,GO INNER EAR RECEPTOR CELL STEREOCILIUM ORGANIZATION,2.0853e-05,0.21693,0.21793,1,1
3,GO ENDOPLASMIC RETICULUM MANNOSE TRIMMING,4.2487e-05,0.21671,0.2406,1,1
3,GO ARACHIDONIC ACID METABOLIC PROCESS,5.8698e-06,0.21665,0.24926,1,1
3,GO PROTEIN O LINKED MANNOSYLATION,0.0005056,0.21659,0.21041,1,1
3,GO NEGATIVE REGULATION OF IMMUNE SYSTEM PROCESS,0.00012594,0.21652,0.17176,1,1
3,GO NEGATIVE REGULATION OF TUMOR NECROSIS FACTOR SUPERFAMILY CYTOKINE PRODUCTION,0.0024941,0.2165,0.16698,1,1
3,GO ACTIVATION OF CYSTEINE TYPE ENDOPEPTIDASE ACTIVITY INVOLVED IN APOPTOTIC PROCESS,3.6877e-06,0.21642,0.19893,1,1
3,GO NEGATIVE REGULATION OF ENDOPLASMIC RETICULUM UNFOLDED PROTEIN RESPONSE,0.0001862,0.21642,0.1997,1,1
3,GO REGULATION OF PEPTIDASE ACTIVITY,4.5684e-06,0.2163,0.21686,1,1
3,GO STEROL METABOLIC PROCESS,1.5052e-06,0.21609,0.20957,1,1
3,GO POSITIVE REGULATION OF CELL ACTIVATION,0.00037257,0.21607,0.15105,1,1
3,GO PLATELET AGGREGATION,6.8888e-05,0.21562,0.23952,1,1
3,GO REGULATION OF PRODUCTION OF MOLECULAR MEDIATOR OF IMMUNE RESPONSE,4.7999e-05,0.21509,0.20525,1,1
3,GO NEGATIVE REGULATION OF T CELL DIFFERENTIATION,0.0042095,0.21508,0.18899,1,1
3,GO REGULATION OF HORMONE BIOSYNTHETIC PROCESS,0.012227,0.21505,0.23151,1,1
3,GO NEGATIVE REGULATION OF IMMUNE EFFECTOR PROCESS,0.00095459,0.21504,0.197,1,1
3,GO BILE ACID BIOSYNTHETIC PROCESS,1.5865e-05,0.21503,0.2099,1,1
3,GO POSITIVE REGULATION OF CELLULAR RESPONSE TO INSULIN STIMULUS,0.001483,0.21498,0.24247,1,1
3,GO AMYLOID BETA METABOLIC PROCESS,0.00012594,0.21492,0.20919,1,1
3,GO LEUKOCYTE ADHESION TO VASCULAR ENDOTHELIAL CELL,3.758e-05,0.21488,0.20251,1,1
3,GO COPPER ION TRANSPORT,0.00032916,0.21481,0.21742,1,1
3,GO RESPONSE TO INTERLEUKIN 6,6.3249e-05,0.21474,0.2121,1,1
3,GO ENERGY HOMEOSTASIS,8.7316e-05,0.21453,0.22124,1,1
3,GO DISACCHARIDE METABOLIC PROCESS,4.8839e-05,0.21426,0.29481,1,1
3,GO LIVER MORPHOGENESIS,2.0478e-05,0.21418,0.33244,1,1
3,GO CYTOKINE PRODUCTION,4.1751e-05,0.21392,0.187,1,1
3,GO SKIN DEVELOPMENT,4.7999e-05,0.21356,0.18914,1,1
3,GO PROTEIN LOCALIZATION TO CELL CELL JUNCTION,0.001955,0.21335,0.23552,1,1
3,GO EPIDERMIS DEVELOPMENT,3.1494e-05,0.21324,0.18705,1,1
3,GO NEGATIVE REGULATION OF INFLAMMATORY RESPONSE,0.00023294,0.21283,0.16027,1,1
3,GO POSITIVE REGULATION OF LIPID BIOSYNTHETIC PROCESS,2.206e-06,0.21274,0.25746,1,1
3,GO REGULATION OF AMINO ACID TRANSPORT,0.00055343,0.21274,0.2025,1,1
3,GO SECRETION BY TISSUE,0.00023294,0.21272,0.19649,1,1
3,GO POSITIVE REGULATION OF REACTIVE OXYGEN SPECIES METABOLIC PROCESS,2.6828e-05,0.21254,0.23949,1,1
3,GO B CELL RECEPTOR SIGNALING PATHWAY,3.5646e-05,0.21241,0.24932,1,1
3,GO POSITIVE REGULATION OF LYMPHOCYTE ACTIVATION,0.00049053,0.21233,0.15274,1,1
3,GO GOLGI TO ENDOSOME TRANSPORT,6.545e-05,0.21208,0.21337,1,1
3,GO KERATAN SULFATE BIOSYNTHETIC PROCESS,3.758e-05,0.21206,0.22336,1,1
3,GO NEUROEPITHELIAL CELL DIFFERENTIATION,0.00026438,0.21185,0.25524,1,1
3,GO SNARE COMPLEX ASSEMBLY,0.00044103,0.21175,0.20269,1,1
3,GO POSITIVE REGULATION OF NOTCH SIGNALING PATHWAY,1.0169e-05,0.21171,0.24954,1,1
3,GO RADIAL GLIAL CELL DIFFERENTIATION,0.0071918,0.2116,0.22945,1,1
3,GO NUCLEOTIDE TRANSPORT,2.0364e-06,0.21146,0.19951,1,1
3,GO HETEROTYPIC CELL CELL ADHESION,0.0043737,0.21111,0.16922,1,1
3,GO GLYCOPROTEIN BIOSYNTHETIC PROCESS,3.5038e-07,0.21108,0.21407,1,1
3,GO DEFENSE RESPONSE TO GRAM NEGATIVE BACTERIUM,5.332e-06,0.21094,0.21666,1,1
3,GO NEGATIVE REGULATION OF MAP KINASE ACTIVITY,3.4409e-05,0.21081,0.22966,1,1
3,GO LYMPHOCYTE APOPTOTIC PROCESS,6.6578e-05,0.21074,0.19341,1,1
3,GO EPIDERMAL CELL DIFFERENTIATION,4.7488e-06,0.21057,0.22777,1,1
3,GO POSITIVE REGULATION OF COLD INDUCED THERMOGENESIS,5.4701e-07,0.21051,0.21124,1,1
3,GO POSITIVE REGULATION OF MAST CELL ACTIVATION,1.5576e-05,0.2104,0.29516,1,1
3,GO PHOSPHATIDYLETHANOLAMINE ACYL CHAIN REMODELING,0.00010323,0.2104,0.21108,1,1
3,GO CELL CHEMOTAXIS,3.094e-05,0.21032,0.18851,1,1
3,GO GRANULOCYTE CHEMOTAXIS,0.00014362,0.21023,0.16292,1,1
3,GO MECHANORECEPTOR DIFFERENTIATION,8.7502e-06,0.21012,0.20697,1,1
3,GO UNSATURATED FATTY ACID METABOLIC PROCESS,3.2057e-05,0.21006,0.21215,1,1
3,GO B CELL ACTIVATION,2.1621e-05,0.20995,0.17732,1,1
3,GO AUDITORY RECEPTOR CELL MORPHOGENESIS,0.00073415,0.2096,0.18805,1,1
3,GO BILE ACID METABOLIC PROCESS,1.7071e-05,0.2095,0.23172,1,1
3,GO ENDOCRINE PROCESS,1.3948e-05,0.20938,0.20344,1,1
3,GO CELL CELL ADHESION,0.00040235,0.20934,0.15687,1,1
3,GO REGULATION OF RESPONSE TO INTERFERON GAMMA,2.9332e-05,0.20906,0.28081,1,1
3,GO MHC CLASS II BIOSYNTHETIC PROCESS,0.00013899,0.2088,0.19778,1,1
3,GO MEDIUM CHAIN FATTY ACID METABOLIC PROCESS,3.8246e-05,0.20865,0.27316,1,1
3,GO POSITIVE REGULATION OF CYTOKINE SECRETION,5.7582e-06,0.20811,0.20355,1,1
3,GO CELLULAR RESPONSE TO FATTY ACID,0.00027284,0.2081,0.20053,1,1
3,GO NEGATIVE REGULATION OF TRANSCRIPTION FROM RNA POLYMERASE II PROMOTER IN RESPONSE TO STRESS,0.0030436,0.20796,0.17694,1,1
3,GO VENTRICULAR SEPTUM MORPHOGENESIS,0.0093576,0.2079,0.16527,1,1
3,GO CARBOHYDRATE TRANSPORT,2.0429e-07,0.2079,0.19868,1,1
3,GO POSITIVE REGULATION OF RECEPTOR SIGNALING PATHWAY VIA STAT,0.00059648,0.20786,0.18195,1,1
3,GO NEGATIVE REGULATION OF INTERLEUKIN 6 PRODUCTION,0.00010852,0.20781,0.18253,1,1
3,GO RESPONSE TO INACTIVITY,0.0026663,0.20771,0.22619,1,1
3,GO AMELOGENESIS,0.01585,0.20765,0.17926,1,1
3,GO PROTEIN CATABOLIC PROCESS IN THE VACUOLE,0.00021857,0.20765,0.20188,1,1
3,GO REGULATION OF AMYLOID PRECURSOR PROTEIN CATABOLIC PROCESS,0.00063314,0.20755,0.20741,1,1
3,GO SHORT CHAIN FATTY ACID METABOLIC PROCESS,0.0049019,0.20741,0.17763,1,1
3,GO POSITIVE REGULATION OF CATECHOLAMINE SECRETION,0.0016575,0.20739,0.23504,1,1
3,GO NUCLEOTIDE BINDING DOMAIN LEUCINE RICH REPEAT CONTAINING RECEPTOR SIGNALING PATHWAY,9.2585e-06,0.20729,0.20902,1,1
3,GO SENSORY PERCEPTION OF CHEMICAL STIMULUS,9.2321e-08,0.20728,0.21505,1,1
3,GO MEMBRANE PROTEIN PROTEOLYSIS,0.00069207,0.2071,0.20482,1,1
3,GO SPHINGOID METABOLIC PROCESS,7.8911e-05,0.20706,0.24222,1,1
3,GO STEROL TRANSPORT,8.7316e-05,0.20696,0.19743,1,1
3,GO PROSTAGLANDIN TRANSPORT,0.0005133,0.20692,0.19806,1,1
3,GO T CELL DIFFERENTIATION INVOLVED IN IMMUNE RESPONSE,0.0051547,0.20687,0.13402,1,1
3,GO REGULATION OF ACUTE INFLAMMATORY RESPONSE,8.8796e-05,0.20663,0.20676,1,1
3,GO POSITIVE REGULATION OF ANION TRANSPORT,1.6158e-05,0.20658,0.20611,1,1
3,GO POSITIVE REGULATION OF IMMUNOGLOBULIN PRODUCTION,0.00012594,0.2065,0.19999,1,1
3,GO REGULATION OF SYNCYTIUM FORMATION BY PLASMA MEMBRANE FUSION,9.6562e-05,0.206,0.25475,1,1
3,GO SIGNAL PEPTIDE PROCESSING,5.9834e-06,0.20591,0.27617,1,1
3,GO NEGATIVE REGULATION OF LIPID STORAGE,4.0314e-05,0.20585,0.2372,1,1
3,GO PHOSPHATIDYLETHANOLAMINE METABOLIC PROCESS,1.6761e-05,0.20585,0.20322,1,1
3,GO POSITIVE REGULATION OF BLOOD PRESSURE,0.00018923,0.20573,0.17401,1,1
3,GO REGULATION OF INFLAMMATORY RESPONSE TO ANTIGENIC STIMULUS,0.0050904,0.20563,0.16729,1,1
3,GO REGULATION OF LEUKOCYTE ADHESION TO VASCULAR ENDOTHELIAL CELL,0.00091404,0.20561,0.1979,1,1
3,GO REGULATION OF ACTIN NUCLEATION,0.0005056,0.20529,0.20486,1,1
3,GO POSITIVE REGULATION OF LYMPHOCYTE APOPTOTIC PROCESS,0.002631,0.20529,0.18995,1,1
3,GO REGULATION OF T CELL ACTIVATION,0.00052901,0.20515,0.15462,1,1
3,GO TRANSCYTOSIS,0.00099681,0.20512,0.17304,1,1
3,GO NERVE DEVELOPMENT,0.0005211,0.2051,0.21458,1,1
3,GO CYTOKINE PRODUCTION INVOLVED IN IMMUNE RESPONSE,0.00012186,0.20509,0.20472,1,1
3,GO POSITIVE REGULATION OF TYPE I INTERFERON PRODUCTION,1.4472e-05,0.20502,0.1923,1,1
3,GO POSITIVE REGULATION OF ATP BIOSYNTHETIC PROCESS,0.00019541,0.20488,0.30284,1,1
3,GO SKELETAL MUSCLE ADAPTATION,0.00084997,0.20485,0.19882,1,1
3,GO CD4 POSITIVE ALPHA BETA T CELL ACTIVATION,0.00043435,0.20471,0.17377,1,1
3,GO I KAPPAB KINASE NF KAPPAB SIGNALING,1.3196e-05,0.20464,0.20592,1,1
3,GO EXTRACELLULAR VESICLE BIOGENESIS,1.6994e-06,0.20456,0.23889,1,1
3,GO REGULATION OF ALPHA BETA T CELL ACTIVATION,0.0024609,0.20454,0.1475,1,1
3,GO RESPONSE TO MECHANICAL STIMULUS,2.342e-06,0.20439,0.22244,1,1
3,GO STEROID BIOSYNTHETIC PROCESS,2.856e-06,0.20434,0.19387,1,1
3,GO CELLULAR RESPONSE TO STEROL,3.8246e-05,0.20432,0.22692,1,1
3,GO RESPONSE TO METAL ION,2.2286e-07,0.2042,0.18903,1,1
3,GO ORGANELLE MEMBRANE FUSION,2.0853e-05,0.20415,0.18346,1,1
3,GO POSITIVE REGULATION OF GLUCONEOGENESIS,0.0013826,0.20407,0.19096,1,1
3,GO RESPONSE TO TUMOR NECROSIS FACTOR,5.1304e-06,0.20398,0.2041,1,1
3,GO ANATOMICAL STRUCTURE ARRANGEMENT,0.032607,0.20387,0.16486,1,1
3,GO RELEASE OF CYTOCHROME C FROM MITOCHONDRIA,4.2444e-07,0.20384,0.21736,1,1
3,GO AMINOGLYCAN METABOLIC PROCESS,9.6562e-05,0.20378,0.18918,1,1
3,GO MONOVALENT INORGANIC CATION HOMEOSTASIS,9.8716e-08,0.2037,0.19276,1,1
3,GO ACROSOME REACTION,0.0058389,0.20346,0.1438,1,1
3,GO SODIUM ION IMPORT ACROSS PLASMA MEMBRANE,0.0038977,0.20323,0.15626,1,1
3,GO GLYCEROPHOSPHOLIPID CATABOLIC PROCESS,3.0395e-05,0.20312,0.19518,1,1
3,GO SPHINGOLIPID BIOSYNTHETIC PROCESS,4.5684e-06,0.20291,0.20643,1,1
3,GO REGULATION OF RESPONSE TO BIOTIC STIMULUS,3.0302e-06,0.20267,0.20016,1,1
3,GO NEUTRAL LIPID BIOSYNTHETIC PROCESS,4.6359e-05,0.20261,0.21263,1,1
3,GO ACTION POTENTIAL,1.2716e-05,0.20257,0.19794,1,1
3,GO POSITIVE REGULATION OF TUMOR NECROSIS FACTOR SUPERFAMILY CYTOKINE PRODUCTION,5.8049e-05,0.20196,0.19491,1,1
3,GO LYMPHOCYTE HOMEOSTASIS,0.00025617,0.20194,0.15117,1,1
3,GO CELL CELL JUNCTION ORGANIZATION,0.00013451,0.20189,0.19125,1,1
3,GO MEMBRANE FUSION,6.2169e-06,0.2018,0.18614,1,1
3,GO POSITIVE REGULATION OF NF KAPPAB TRANSCRIPTION FACTOR ACTIVITY,3.5022e-05,0.20174,0.18218,1,1
3,GO DIET INDUCED THERMOGENESIS,3.094e-05,0.20151,0.22877,1,1
3,GO PURINE NUCLEOTIDE TRANSPORT,1.0169e-05,0.20126,0.19691,1,1
3,GO STEROID HORMONE BIOSYNTHETIC PROCESS,0.0078263,0.20095,0.17046,1,1
3,GO AMYLOID BETA FORMATION,0.00090088,0.20092,0.19761,1,1
3,GO VASCULAR ENDOTHELIAL GROWTH FACTOR SIGNALING PATHWAY,0.00044103,0.20087,0.22459,1,1
3,GO PURINE CONTAINING COMPOUND SALVAGE,0.023919,0.20077,0.12386,1,1
3,GO REGULATION OF ACUTE INFLAMMATORY RESPONSE TO ANTIGENIC STIMULUS,0.000662,0.20065,0.20774,1,1
3,GO PLACENTA BLOOD VESSEL DEVELOPMENT,0.0020929,0.20058,0.16646,1,1
3,GO GLOMERULUS DEVELOPMENT,0.002702,0.20057,0.19317,1,1
3,GO PATTERN RECOGNITION RECEPTOR SIGNALING PATHWAY,9.2585e-06,0.20044,0.19126,1,1
3,GO REGULATION OF HEPATOCYTE PROLIFERATION,0.0011341,0.2002,0.35572,1,1
