1,GO REGULATION OF CHEMOTAXIS,0.00046872,0.15534,0.15987,1,1
1,GO NUCLEOSIDE SALVAGE,0.0053519,0.15531,0.17184,1,1
1,GO REGULATION OF APOPTOTIC SIGNALING PATHWAY,4.9361e-06,0.15529,0.15786,1,1
1,GO RESPONSE TO ENDOPLASMIC RETICULUM STRESS,2.4528e-05,0.15525,0.16182,1,1
1,GO LONG CHAIN FATTY ACID METABOLIC PROCESS,0.00029052,0.15516,0.16077,1,1
1,GO NEGATIVE REGULATION OF DNA REPAIR,0.0020367,0.15486,0.12007,1,1
1,GO ANATOMICAL STRUCTURE FORMATION INVOLVED IN MORPHOGENESIS,9.03e-05,0.15481,0.16693,1,1
1,GO CORONARY VASCULATURE MORPHOGENESIS,0.043025,0.1546,0.1654,1,1
1,GO REGULATION OF MEGAKARYOCYTE DIFFERENTIATION,0.00015331,0.15441,0.16685,1,1
1,GO SYNAPTONEMAL COMPLEX ORGANIZATION,0.034636,0.15435,0.14042,1,1
1,GO RETROGRADE VESICLE MEDIATED TRANSPORT GOLGI TO ENDOPLASMIC RETICULUM,5.1446e-05,0.15422,0.14368,1,1
1,GO REACTIVE OXYGEN SPECIES METABOLIC PROCESS,7.5217e-06,0.15414,0.1895,1,1
1,GO GOLGI RIBBON FORMATION,0.00054518,0.15388,0.19323,1,1
1,GO POSITIVE REGULATION OF RECEPTOR BIOSYNTHETIC PROCESS,7.7586e-05,0.15374,0.1916,1,1
1,GO ESTABLISHMENT OF PIGMENT GRANULE LOCALIZATION,0.031953,0.15369,0.11894,1,1
1,GO EMBRYONIC EYE MORPHOGENESIS,0.0014624,0.15349,0.20061,1,1
1,GO LEFT RIGHT PATTERN FORMATION,0.0041031,0.15345,0.19152,1,1
1,GO TRANSCRIPTION INITIATION FROM RNA POLYMERASE II PROMOTER,2.5359e-06,0.15332,0.14757,1,1
1,GO NEGATIVE REGULATION OF OSSIFICATION,0.00080175,0.15331,0.18106,1,1
1,GO PLASMA MEMBRANE TUBULATION,0.00091404,0.15315,0.19772,1,1
1,GO RNA INTERFERENCE,0.0062877,0.15295,0.12677,1,1
1,GO NEGATIVE REGULATION OF PEPTIDYL SERINE PHOSPHORYLATION,0.001955,0.1529,0.18067,1,1
1,GO OSTEOBLAST DIFFERENTIATION,1.6457e-05,0.15286,0.21101,1,1
1,GO PROTEIN LOCALIZATION TO VACUOLE,0.0039481,0.15274,0.13233,1,1
1,GO RESPONSE TO NUTRIENT,0.00041488,0.15265,0.163,1,1
1,GO POST TRANSLATIONAL PROTEIN MODIFICATION,8.4805e-07,0.1526,0.17549,1,1
1,GO REGULATION OF NEURON PROJECTION REGENERATION,0.035336,0.15255,0.13098,1,1
1,GO IRON SULFUR CLUSTER ASSEMBLY,0.0013255,0.15232,0.15057,1,1
1,GO ENDOTHELIAL CELL CHEMOTAXIS,0.0011836,0.1523,0.2704,1,1
1,GO AMYLOID PRECURSOR PROTEIN METABOLIC PROCESS,0.0013443,0.15229,0.15286,1,1
1,GO CARNITINE SHUTTLE,0.0025617,0.15228,0.16854,1,1
1,GO POSITIVE REGULATION OF CELL DEATH,5.4184e-05,0.15224,0.14668,1,1
1,GO ENDOTHELIAL CELL PROLIFERATION,0.00071283,0.15222,0.18248,1,1
1,GO REGULATION OF LIPID METABOLIC PROCESS,8.4424e-05,0.15202,0.1543,1,1
1,GO POSITIVE REGULATION OF JNK CASCADE,0.001704,0.15196,0.13907,1,1
1,GO POSITIVE REGULATION OF EPITHELIAL CELL DIFFERENTIATION,0.020828,0.15194,0.12048,1,1
1,GO TUBE FORMATION,0.00049802,0.15193,0.15922,1,1
1,GO POSITIVE REGULATION OF TELOMERASE ACTIVITY,0.0017517,0.15159,0.15701,1,1
1,GO NEGATIVE REGULATION OF ENDOCYTOSIS,0.0020367,0.15155,0.1505,1,1
1,GO MITOCHONDRIAL CALCIUM ION TRANSMEMBRANE TRANSPORT,0.0026663,0.1515,0.14886,1,1
1,GO RIBONUCLEOSIDE MONOPHOSPHATE METABOLIC PROCESS,0.00059648,0.15123,0.14396,1,1
1,GO EPITHELIAL TUBE MORPHOGENESIS,0.00044781,0.151,0.1541,1,1
1,GO RNA CATABOLIC PROCESS,1.3599e-06,0.15071,0.15551,1,1
1,GO MESENCHYME DEVELOPMENT,0.00031414,0.15062,0.16701,1,1
1,GO REGULATION OF CELL DEATH,7.6657e-06,0.15062,0.14587,1,1
1,GO VESICLE MEDIATED TRANSPORT BETWEEN ENDOSOMAL COMPARTMENTS,0.00013673,0.15058,0.20264,1,1
1,GO CELLULAR RESPONSE TO OXYGEN RADICAL,0.0010408,0.15057,0.11232,1,1
1,GO SULFUR COMPOUND METABOLIC PROCESS,1.6321e-06,0.1505,0.16439,1,1
1,GO POSITIVE REGULATION OF SUPRAMOLECULAR FIBER ORGANIZATION,1.0958e-05,0.1505,0.17637,1,1
1,GO NEGATIVE REGULATION OF RYANODINE SENSITIVE CALCIUM RELEASE CHANNEL ACTIVITY,0.0095807,0.15016,0.1632,1,1
1,GO FATTY ACID TRANSMEMBRANE TRANSPORT,0.0024281,0.15014,0.16132,1,1
1,GO ESTABLISHMENT OF PROTEIN LOCALIZATION TO VACUOLE,0.0089251,0.14971,0.12903,1,1
1,GO POSTTRANSCRIPTIONAL REGULATION OF GENE EXPRESSION,2.0879e-07,0.14965,0.15984,1,1
1,GO PROTEIN MODIFICATION BY SMALL PROTEIN REMOVAL,1.1034e-07,0.14952,0.16414,1,1
1,GO REGULATION OF PROTEIN EXPORT FROM NUCLEUS,7.105e-06,0.14931,0.22949,1,1
1,GO VIRAL BUDDING,0.00073415,0.14915,0.13804,1,1
1,GO REGULATION OF PHOSPHOLIPID METABOLIC PROCESS,0.00012388,0.14908,0.18783,1,1
1,GO REGULATION OF TRANSCRIPTION FROM RNA POLYMERASE II PROMOTER IN RESPONSE TO OXIDATIVE STRESS,0.0093576,0.14876,0.16659,1,1
1,GO CELL CYCLE G1 S PHASE TRANSITION,9.1829e-05,0.14873,0.12673,1,1
1,GO RESPONSE TO TOPOLOGICALLY INCORRECT PROTEIN,2.0853e-05,0.14868,0.18188,1,1
1,GO SPLEEN DEVELOPMENT,0.014494,0.14849,0.11052,1,1
1,GO POSITIVE REGULATION OF PROTEIN LOCALIZATION TO CELL SURFACE,0.0013826,0.14841,0.13168,1,1
1,GO STRESS ACTIVATED PROTEIN KINASE SIGNALING CASCADE,1.6761e-05,0.14835,0.16124,1,1
1,GO NEGATIVE REGULATION OF NF KAPPAB TRANSCRIPTION FACTOR ACTIVITY,2.8001e-06,0.14832,0.15627,1,1
1,GO ENDOCRINE PROCESS,0.00029052,0.1483,0.17137,1,1
1,GO FATTY ACID METABOLIC PROCESS,4.3997e-05,0.14825,0.14873,1,1
1,GO RNA SURVEILLANCE,0.0070192,0.14793,0.10942,1,1
1,GO POSITIVE REGULATION OF STEROID METABOLIC PROCESS,0.064418,0.14788,0.11579,1,1
1,GO REGULATION OF AUTOPHAGY OF MITOCHONDRION IN RESPONSE TO MITOCHONDRIAL DEPOLARIZATION,0.0039992,0.14786,0.16056,1,1
1,GO POLYAMINE METABOLIC PROCESS,0.0035146,0.1476,0.13839,1,1
1,GO POSITIVE REGULATION OF ENDOCYTOSIS,0.00049802,0.14756,0.17283,1,1
1,GO NEGATIVE REGULATION OF NUCLEOCYTOPLASMIC TRANSPORT,0.0032501,0.14755,0.18702,1,1
1,GO RIBONUCLEOPROTEIN COMPLEX BIOGENESIS,0.00045468,0.14751,0.14197,1,1
1,GO CELLULAR RESPONSE TO KETONE,0.0057669,0.14745,0.12282,1,1
1,GO REGULATION OF CELLULAR RESPONSE TO GROWTH FACTOR STIMULUS,0.00076726,0.14706,0.16563,1,1
1,GO REGULATION OF URINE VOLUME,1.7385e-05,0.14706,0.21667,1,1
1,GO HISTONE DEACETYLATION,0.0010408,0.14689,0.11574,1,1
1,GO REGULATION OF CELLULAR RESPONSE TO TRANSFORMING GROWTH FACTOR BETA STIMULUS,0.00049053,0.14665,0.18809,1,1
1,GO PURINE DEOXYRIBONUCLEOTIDE METABOLIC PROCESS,0.0038977,0.14662,0.19016,1,1
1,GO CELLULAR NITROGEN COMPOUND CATABOLIC PROCESS,3.4296e-07,0.14659,0.1408,1,1
1,GO TRANSMEMBRANE RECEPTOR PROTEIN TYROSINE KINASE SIGNALING PATHWAY,0.00049802,0.14658,0.13912,1,1
1,GO REGULATION OF PROTEIN BINDING,0.00013016,0.14658,0.14573,1,1
1,GO MAMMARY GLAND DEVELOPMENT,0.0084096,0.14656,0.13296,1,1
1,GO CELL DEATH IN RESPONSE TO OXIDATIVE STRESS,6.0079e-05,0.14635,0.15023,1,1
1,GO MULTIVESICULAR BODY SORTING PATHWAY,0.00023667,0.14608,0.14922,1,1
1,GO PROTEIN POLYUBIQUITINATION,1.3056e-06,0.14606,0.15061,1,1
1,GO MODULATION BY VIRUS OF HOST CELLULAR PROCESS,6.6578e-05,0.14604,0.18727,1,1
1,GO NEGATIVE REGULATION OF CELL CYCLE ARREST,0.0067673,0.14583,0.1437,1,1
1,GO POSITIVE REGULATION OF URINE VOLUME,0.00015583,0.1458,0.26058,1,1
1,GO CELLULAR RESPONSE TO ALCOHOL,0.0028118,0.14579,0.15543,1,1
1,GO POSITIVE REGULATION OF STRIATED MUSCLE CELL DIFFERENTIATION,0.00035024,0.14577,0.16437,1,1
1,GO DERMATAN SULFATE PROTEOGLYCAN METABOLIC PROCESS,0.019312,0.14564,0.22165,1,1
1,GO ESTABLISHMENT OF PROTEIN LOCALIZATION TO CHROMOSOME,0.012227,0.14558,0.11219,1,1
1,GO CARDIAC CHAMBER DEVELOPMENT,0.0084096,0.14557,0.13326,1,1
1,GO SUPEROXIDE METABOLIC PROCESS,0.0011836,0.14554,0.14185,1,1
1,GO REGULATION OF NON MOTILE CILIUM ASSEMBLY,0.0044864,0.1455,0.15462,1,1
1,GO NEGATIVE REGULATION OF MAPK CASCADE,0.00024819,0.1454,0.15672,1,1
1,GO NEGATIVE REGULATION OF INTRACELLULAR SIGNAL TRANSDUCTION,2.2416e-05,0.14535,0.15595,1,1
1,GO NEGATIVE REGULATION OF BLOOD CIRCULATION,0.0023957,0.1453,0.18021,1,1
1,GO SKELETAL SYSTEM DEVELOPMENT,0.0011341,0.14514,0.14567,1,1
1,GO REGULATION OF HEART MORPHOGENESIS,0.014172,0.14514,0.17428,1,1
1,GO MAINTENANCE OF PROTEIN LOCATION,1.6994e-06,0.14509,0.17038,1,1
1,GO NEPHRON DEVELOPMENT,0.001955,0.14509,0.17662,1,1
1,GO UV PROTECTION,0.046921,0.14492,0.15018,1,1
1,GO MALE SEX DIFFERENTIATION,0.0010408,0.14481,0.14777,1,1
1,GO OSSIFICATION,0.00032916,0.14463,0.16591,1,1
1,GO VACUOLE ORGANIZATION,3.9613e-05,0.14463,0.15315,1,1
1,GO ACTIVATION OF JNKK ACTIVITY,0.0022396,0.14451,0.1826,1,1
1,GO REGULATION OF OSSIFICATION,0.00099681,0.14444,0.17213,1,1
1,GO EPITHELIAL TUBE FORMATION,0.00057029,0.14444,0.16226,1,1
1,GO REGULATION OF MUSCLE ORGAN DEVELOPMENT,0.00059648,0.14439,0.14808,1,1
1,GO CELLULAR RESPONSE TO TOPOLOGICALLY INCORRECT PROTEIN,8.7316e-05,0.14404,0.16677,1,1
1,GO HISTONE MONOUBIQUITINATION,0.0137,0.14404,0.093632,1,1
1,GO MITOCHONDRIAL TRANSCRIPTION,0.038637,0.14397,0.089756,1,1
1,GO REGULATION OF ENDOPLASMIC RETICULUM UNFOLDED PROTEIN RESPONSE,0.0033799,0.14359,0.15277,1,1
1,GO CELLULAR LIPID CATABOLIC PROCESS,0.0005133,0.14352,0.13509,1,1
1,GO COPII COATED VESICLE BUDDING,9.086e-06,0.14345,0.1644,1,1
1,GO SECONDARY METABOLITE BIOSYNTHETIC PROCESS,0.0054192,0.14336,0.13855,1,1
1,GO REGULATION OF VACUOLE ORGANIZATION,6.1119e-05,0.14336,0.17871,1,1
1,GO PROTEIN SUMOYLATION,0.00011033,0.1433,0.13088,1,1
1,GO KILLING OF CELLS IN OTHER ORGANISM INVOLVED IN SYMBIOTIC INTERACTION,0.014658,0.14328,0.11517,1,1
1,GO REGULATION OF MRNA 3 END PROCESSING,0.0001179,0.14321,0.15733,1,1
1,GO ASTROCYTE DIFFERENTIATION,0.0013255,0.14319,0.16268,1,1
1,GO EMBRYONIC HEMOPOIESIS,0.043444,0.14301,0.12922,1,1
1,GO KETONE BIOSYNTHETIC PROCESS,0.00082553,0.14293,0.15185,1,1
1,GO REGULATION OF DOPAMINERGIC NEURON DIFFERENTIATION,0.032278,0.14293,0.15045,1,1
1,GO NUCLEOSIDE METABOLIC PROCESS,1.1588e-05,0.14284,0.15893,1,1
1,GO NEGATIVE REGULATION OF CELL POPULATION PROLIFERATION,0.0028492,0.14284,0.12295,1,1
1,GO CELL MOTILITY,0.00092737,0.14281,0.13492,1,1
1,GO KIDNEY MESENCHYME DEVELOPMENT,0.012367,0.14259,0.17343,1,1
1,GO POSITIVE REGULATION OF MACROAUTOPHAGY,9.086e-06,0.14254,0.18286,1,1
1,GO REGULATION OF EXOSOMAL SECRETION,0.00087508,0.14248,0.19167,1,1
1,GO RESPONSE TO UV,7.3803e-06,0.14247,0.16753,1,1
1,GO ORGANIC ACID CATABOLIC PROCESS,0.0012177,0.14221,0.11864,1,1
1,GO REGULATION OF CELLULAR AMINE METABOLIC PROCESS,9.03e-05,0.14215,0.15568,1,1
1,GO PYRIMIDINE CONTAINING COMPOUND METABOLIC PROCESS,1.9393e-05,0.14194,0.12912,1,1
1,GO PHOSPHATIDYLCHOLINE METABOLIC PROCESS,0.014494,0.14192,0.11281,1,1
1,GO MITOCHONDRIAL GENE EXPRESSION,0.0051547,0.14184,0.1059,1,1
1,GO NEGATIVE REGULATION OF PROTEIN LOCALIZATION TO MEMBRANE,0.010645,0.14172,0.15429,1,1
1,GO RIBOSOME ASSEMBLY,0.0037985,0.14164,0.14729,1,1
1,GO ER NUCLEUS SIGNALING PATHWAY,0.015329,0.14157,0.11442,1,1
1,GO PROTEIN O LINKED GLYCOSYLATION,0.009139,0.14157,0.12173,1,1
1,GO JNK CASCADE,0.0007786,0.14153,0.12968,1,1
1,GO CARDIAC CHAMBER MORPHOGENESIS,0.028852,0.14152,0.12603,1,1
1,GO REGULATION OF JUN KINASE ACTIVITY,0.0039992,0.14139,0.13712,1,1
1,GO INTRACELLULAR ESTROGEN RECEPTOR SIGNALING PATHWAY,0.0012005,0.1413,0.15279,1,1
1,GO PROTEIN IMPORT,3.4773e-06,0.14118,0.15128,1,1
1,GO NEGATIVE REGULATION OF ORGAN GROWTH,0.0014022,0.1411,0.15515,1,1
1,GO POSITIVE REGULATION OF SMOOTH MUSCLE CELL APOPTOTIC PROCESS,0.021973,0.14107,0.15658,1,1
1,GO POSITIVE REGULATION OF ERBB SIGNALING PATHWAY,0.0054872,0.14105,0.15212,1,1
1,GO REGULATION OF STRESS ACTIVATED PROTEIN KINASE SIGNALING CASCADE,5.4184e-05,0.14098,0.15496,1,1
1,GO TUBE DEVELOPMENT,7.7586e-05,0.14093,0.17595,1,1
1,GO SARCOMERE ORGANIZATION,0.017315,0.14087,0.13191,1,1
1,GO S ADENOSYLMETHIONINE METABOLIC PROCESS,0.004964,0.14079,0.10893,1,1
1,GO NEGATIVE REGULATION OF SMOOTH MUSCLE CELL MIGRATION,0.0090315,0.14079,0.16719,1,1
1,GO POSITIVE REGULATION OF MUSCLE CELL DIFFERENTIATION,0.0019285,0.14056,0.13343,1,1
1,GO PROTEIN MATURATION,3.0395e-05,0.14039,0.13927,1,1
1,GO NUCLEAR MIGRATION,0.064418,0.14029,0.12295,1,1
1,GO ORGANIC CYCLIC COMPOUND CATABOLIC PROCESS,1.3056e-06,0.14005,0.12759,1,1
1,GO SPERM EGG RECOGNITION,0.00026858,0.14005,0.12922,1,1
1,GO NEGATIVE REGULATION OF HYDROLASE ACTIVITY,0.0005618,0.14004,0.13204,1,1
1,GO CANONICAL WNT SIGNALING PATHWAY,0.00019541,0.13999,0.15151,1,1
1,GO PROTEIN LOCALIZATION TO GOLGI APPARATUS,0.0018006,0.13991,0.14564,1,1
1,GO PEPTIDE BIOSYNTHETIC PROCESS,4.9694e-05,0.13991,0.1245,1,1
1,GO PROTEIN HOMOTETRAMERIZATION,1.1789e-06,0.13975,0.1703,1,1
1,GO FAT CELL DIFFERENTIATION,0.00044103,0.13971,0.15647,1,1
1,GO REGULATION OF FAT CELL DIFFERENTIATION,0.0011503,0.13936,0.16675,1,1
1,GO NUCLEAR TRANSCRIBED MRNA CATABOLIC PROCESS EXONUCLEOLYTIC 3 5,0.05063,0.13935,0.091152,1,1
1,GO MESENCHYMAL CELL DIFFERENTIATION,0.0022095,0.13929,0.15557,1,1
1,GO LIPID LOCALIZATION,0.00049802,0.13925,0.13802,1,1
1,GO ENDOCYTIC RECYCLING,0.0043737,0.1391,0.13054,1,1
1,GO APICAL JUNCTION ASSEMBLY,0.011949,0.13904,0.15372,1,1
1,GO REGULATION OF CELLULAR CATABOLIC PROCESS,1.7534e-07,0.13881,0.1501,1,1
1,GO HEMATOPOIETIC STEM CELL PROLIFERATION,0.0061347,0.13856,0.17582,1,1
1,GO REPRODUCTIVE SYSTEM DEVELOPMENT,0.00044781,0.13835,0.14565,1,1
1,GO REGULATION OF LIGASE ACTIVITY,0.0095807,0.13815,0.13505,1,1
1,GO RESPONSE TO OXYGEN RADICAL,0.00064263,0.13808,0.11972,1,1
1,GO POSITIVE REGULATION OF INSULIN SECRETION INVOLVED IN CELLULAR RESPONSE TO GLUCOSE STIMULUS,0.012087,0.13802,0.10203,1,1
1,GO RESPONSE TO STEROL,0.0074579,0.13786,0.15451,1,1
1,GO POSITIVE REGULATION OF CELL CYCLE G2 M PHASE TRANSITION,0.01251,0.13781,0.093407,1,1
1,GO ESTABLISHMENT OF RNA LOCALIZATION,3.9613e-05,0.13774,0.14362,1,1
1,GO PURINE NUCLEOSIDE TRIPHOSPHATE METABOLIC PROCESS,5.4184e-05,0.13758,0.14693,1,1
1,GO RUFFLE ORGANIZATION,7.6283e-05,0.13756,0.16232,1,1
1,GO MIDBODY ABSCISSION,0.00061456,0.13731,0.18569,1,1
1,GO POSITIVE REGULATION OF MITOPHAGY,0.0010259,0.13729,0.18052,1,1
1,GO NUCLEIC ACID PHOSPHODIESTER BOND HYDROLYSIS,1.5014e-05,0.13719,0.11652,1,1
1,GO POSITIVE REGULATION OF DNA TEMPLATED TRANSCRIPTION INITIATION,8.3013e-05,0.13716,0.15443,1,1
1,GO INTRINSIC APOPTOTIC SIGNALING PATHWAY IN RESPONSE TO OXIDATIVE STRESS,0.00042128,0.13713,0.13969,1,1
1,GO AGING,1.3442e-05,0.13712,0.14496,1,1
1,GO PEROXISOME PROLIFERATOR ACTIVATED RECEPTOR SIGNALING PATHWAY,0.0033799,0.13711,0.18616,1,1
1,GO REGULATION OF MUSCLE HYPERTROPHY,0.0083098,0.13701,0.13346,1,1
1,GO POSITIVE REGULATION OF SIGNAL TRANSDUCTION BY P53 CLASS MEDIATOR,0.0027381,0.13699,0.17035,1,1
1,GO POSITIVE REGULATION OF MAPK CASCADE,2.4972e-05,0.13699,0.1665,1,1
1,GO ENDOSOME ORGANIZATION,2.8814e-05,0.13691,0.15472,1,1
1,GO DNA UNWINDING INVOLVED IN DNA REPLICATION,0.014658,0.13664,0.06473,1,1
1,GO NEGATIVE REGULATION OF CALCIUM ION TRANSPORT INTO CYTOSOL,0.019312,0.13655,0.11389,1,1
1,GO REGULATION OF SMOOTH MUSCLE CELL DIFFERENTIATION,0.003166,0.13645,0.17593,1,1
1,GO TRNA TRANSPORT,0.0005211,0.13634,0.14121,1,1
1,GO REGULATION OF EXECUTION PHASE OF APOPTOSIS,4.5684e-06,0.13629,0.13559,1,1
1,GO VACUOLAR ACIDIFICATION,0.003166,0.13627,0.13012,1,1
1,GO IMPORT INTO NUCLEUS,1.4207e-05,0.13626,0.14808,1,1
1,GO NEGATIVE REGULATION OF PROTEIN KINASE B SIGNALING,0.00018923,0.13621,0.1769,1,1
1,GO REGULATION OF CELLULAR AMIDE METABOLIC PROCESS,3.2146e-06,0.13606,0.14341,1,1
1,GO REGULATION OF WNT SIGNALING PATHWAY,0.00095459,0.13584,0.13145,1,1
1,GO POSITIVE REGULATION OF CYTOSKELETON ORGANIZATION,3.5022e-05,0.13582,0.14857,1,1
1,GO NUCLEAR EXPORT,2.2824e-05,0.13575,0.14224,1,1
1,GO NEGATIVE REGULATION OF MULTICELLULAR ORGANISM GROWTH,0.063258,0.13572,0.18626,1,1
1,GO POSITIVE REGULATION OF PROTEIN CATABOLIC PROCESS,2.4861e-06,0.13566,0.16485,1,1
1,GO GOLGI VESICLE TRANSPORT,1.0004e-06,0.13537,0.15358,1,1
1,GO REGULATION OF RNA EXPORT FROM NUCLEUS,0.00094089,0.13528,0.18452,1,1
1,GO MAINTENANCE OF LOCATION,2.5424e-05,0.13526,0.15132,1,1
1,GO ENDOPLASMIC RETICULUM ORGANIZATION,0.00042777,0.13523,0.12242,1,1
1,GO REGULATION OF ANDROGEN RECEPTOR SIGNALING PATHWAY,0.011949,0.13519,0.11993,1,1
1,GO REGULATION OF CARTILAGE DEVELOPMENT,0.017315,0.13511,0.13751,1,1
1,GO ORGANELLE INHERITANCE,0.0075485,0.13505,0.096881,1,1
1,GO DRUG CATABOLIC PROCESS,0.040187,0.13498,0.12188,1,1
1,GO REGULATION OF DNA TEMPLATED TRANSCRIPTION INITIATION,0.0041031,0.13497,0.11592,1,1
1,GO MUSCLE ADAPTATION,0.0054192,0.13474,0.12421,1,1
1,GO FATTY ACID CATABOLIC PROCESS,0.0052197,0.13462,0.11591,1,1
1,GO ESTABLISHMENT OF TISSUE POLARITY,2.2015e-05,0.13458,0.16449,1,1
1,GO REGULATION OF TRIGLYCERIDE BIOSYNTHETIC PROCESS,0.022686,0.13441,0.12476,1,1
1,GO NODAL SIGNALING PATHWAY,0.0094686,0.1344,0.11435,1,1
1,GO GLYCOSYL COMPOUND METABOLIC PROCESS,9.9803e-06,0.13432,0.15796,1,1
1,GO RNA LOCALIZATION,7.5001e-05,0.1343,0.13921,1,1
1,GO GLOBAL GENOME NUCLEOTIDE EXCISION REPAIR,0.0001862,0.13407,0.1382,1,1
1,GO TRNA WOBBLE BASE MODIFICATION,0.011678,0.13403,0.11378,1,1
1,GO POSITIVE REGULATION OF UBIQUITIN PROTEIN LIGASE ACTIVITY,0.0012005,0.1339,0.16088,1,1
1,GO RESPONSE TO KETONE,0.0010865,0.13388,0.13531,1,1
1,GO NEGATIVE REGULATION OF CELLULAR AMIDE METABOLIC PROCESS,8.1623e-05,0.13378,0.13444,1,1
1,GO RESPONSE TO GROWTH FACTOR,0.0013255,0.13333,0.13076,1,1
1,GO PROTEIN AUTOPHOSPHORYLATION,0.00022565,0.13311,0.15192,1,1
1,GO POSITIVE REGULATION OF PHOSPHORUS METABOLIC PROCESS,0.00015583,0.13289,0.13213,1,1
1,GO POSITIVE REGULATION OF PROTEIN CONTAINING COMPLEX ASSEMBLY,6.9711e-06,0.13261,0.146,1,1
1,GO VASCULAR ENDOTHELIAL GROWTH FACTOR RECEPTOR SIGNALING PATHWAY,0.00036686,0.13256,0.18116,1,1
1,GO CELLULAR MACROMOLECULE CATABOLIC PROCESS,8.6579e-07,0.13247,0.12485,1,1
1,GO POSITIVE REGULATION OF APOPTOTIC SIGNALING PATHWAY,0.00090088,0.13226,0.13886,1,1
1,GO MRNA TRANSPORT,9.819e-05,0.13222,0.13389,1,1
1,GO XENOBIOTIC TRANSPORT,0.0030436,0.13203,0.15573,1,1
1,GO MITOTIC NUCLEAR ENVELOPE DISASSEMBLY,0.029754,0.13174,0.11489,1,1
1,GO PROTEIN AUTO ADP RIBOSYLATION,0.058787,0.13169,0.1586,1,1
1,GO REGULATION OF IRE1 MEDIATED UNFOLDED PROTEIN RESPONSE,0.055609,0.13155,0.10269,1,1
1,GO REGULATION OF MULTI ORGANISM PROCESS,0.0002443,0.13143,0.12524,1,1
1,GO FOLIC ACID METABOLIC PROCESS,0.020828,0.13123,0.11277,1,1
1,GO VIRAL LATENCY,0.051595,0.13114,0.069907,1,1
1,GO POSITIVE REGULATION OF CELLULAR PROTEIN CATABOLIC PROCESS,2.9332e-05,0.13107,0.15104,1,1
1,GO RNA POLYADENYLATION,0.0059852,0.13097,0.10992,1,1
1,GO REGULATION OF HYDROLASE ACTIVITY,0.00019541,0.13097,0.13119,1,1
1,GO POSITIVE REGULATION OF EXTRINSIC APOPTOTIC SIGNALING PATHWAY IN ABSENCE OF LIGAND,0.030368,0.13093,0.13648,1,1
1,GO POSITIVE REGULATION OF HYDROLASE ACTIVITY,9.6562e-05,0.13093,0.13894,1,1
1,GO ORGAN GROWTH,0.00016361,0.13078,0.18105,1,1
1,GO REGULATION OF INTRACELLULAR ESTROGEN RECEPTOR SIGNALING PATHWAY,0.022928,0.13057,0.1261,1,1
1,GO LONG CHAIN FATTY ACID TRANSPORT,0.0011021,0.13057,0.12563,1,1
1,GO NUCLEOSIDE MONOPHOSPHATE BIOSYNTHETIC PROCESS,0.0031247,0.13035,0.13611,1,1
1,GO POSITIVE REGULATION OF OXIDOREDUCTASE ACTIVITY,0.001071,0.12984,0.15255,1,1
1,GO NEGATIVE REGULATION OF CANONICAL WNT SIGNALING PATHWAY,8.1138e-06,0.12973,0.17252,1,1
1,GO POSITIVE REGULATION OF PROTEIN METABOLIC PROCESS,4.3946e-06,0.12959,0.14751,1,1
1,GO POSITIVE REGULATION OF CATABOLIC PROCESS,2.4861e-06,0.12958,0.16084,1,1
1,GO LYSOSOMAL TRANSPORT,0.00038422,0.12956,0.1506,1,1
1,GO NUCLEAR TRANSCRIBED MRNA CATABOLIC PROCESS,0.0044298,0.12953,0.10879,1,1
1,GO REGULATION OF PROTEIN TYROSINE KINASE ACTIVITY,0.00032408,0.12941,0.16643,1,1
1,GO MAINTENANCE OF PROTEIN LOCATION IN CELL,3.6924e-05,0.12922,0.15203,1,1
1,GO MITOTIC CELL CYCLE ARREST,0.013093,0.12922,0.13953,1,1
1,GO SIGNAL TRANSDUCTION BY PROTEIN PHOSPHORYLATION,6.545e-05,0.12917,0.14368,1,1
1,GO ANDROGEN RECEPTOR SIGNALING PATHWAY,0.0049019,0.12911,0.13197,1,1
1,GO ANION HOMEOSTASIS,0.0022095,0.12898,0.14931,1,1
1,GO HEART MORPHOGENESIS,0.0021215,0.12893,0.14298,1,1
1,GO REGULATION OF PROTEASOMAL PROTEIN CATABOLIC PROCESS,1.8363e-05,0.12879,0.12494,1,1
1,GO POSITIVE REGULATION OF DNA TEMPLATED TRANSCRIPTION ELONGATION,0.009139,0.12875,0.11636,1,1
1,GO PEPTIDYL METHIONINE MODIFICATION,0.0137,0.12831,0.13153,1,1
1,GO VACUOLAR TRANSPORT,0.00024045,0.12817,0.13575,1,1
1,GO MITOTIC RECOMBINATION,0.052575,0.12803,0.10214,1,1
1,GO PROTEIN STABILIZATION,0.00015331,0.12798,0.12778,1,1
1,GO P BODY ASSEMBLY,0.01251,0.12798,0.098926,1,1
1,GO POSITIVE REGULATION OF MITOTIC SISTER CHROMATID SEGREGATION,0.018693,0.12795,0.099865,1,1
1,GO RESPONSE TO HEAT,4.4771e-05,0.1278,0.15003,1,1
1,GO REGULATION OF CELL CYCLE PHASE TRANSITION,6.9711e-06,0.12774,0.12269,1,1
1,GO CALCIUM MEDIATED SIGNALING USING INTRACELLULAR CALCIUM SOURCE,0.021053,0.12772,0.10371,1,1
1,GO CHAPERONE MEDIATED PROTEIN FOLDING,0.0037016,0.12727,0.15861,1,1
1,GO NEGATIVE REGULATION OF CELLULAR CATABOLIC PROCESS,2.5884e-05,0.12721,0.12571,1,1
1,GO CARBOHYDRATE DERIVATIVE TRANSPORT,0.037509,0.12718,0.091377,1,1
1,GO REGULATION OF CATABOLIC PROCESS,6.6066e-07,0.1271,0.13818,1,1
1,GO PROTEOLYSIS,7.6657e-06,0.12703,0.13293,1,1
1,GO PEPTIDE METABOLIC PROCESS,6.0991e-06,0.12696,0.12468,1,1
1,GO PIGMENTATION,0.019104,0.12693,0.10011,1,1
1,GO MITOCHONDRIAL TRANSMEMBRANE TRANSPORT,0.0030038,0.12678,0.10125,1,1
1,GO UV DAMAGE EXCISION REPAIR,0.017894,0.12672,0.1024,1,1
1,GO BLASTOCYST GROWTH,0.0005133,0.12668,0.19104,1,1
1,GO CELLULAR RESPONSE TO REACTIVE NITROGEN SPECIES,0.045591,0.12616,0.10257,1,1
1,GO PHOSPHATIDYLETHANOLAMINE BIOSYNTHETIC PROCESS,0.05063,0.12609,0.10027,1,1
1,GO REGULATION OF PLATELET DERIVED GROWTH FACTOR RECEPTOR SIGNALING PATHWAY,0.012367,0.12607,0.14383,1,1
1,GO KIDNEY EPITHELIUM DEVELOPMENT,0.012798,0.12606,0.15015,1,1
1,GO SUPRAMOLECULAR FIBER ORGANIZATION,0.00016629,0.12604,0.14644,1,1
1,GO SULFUR AMINO ACID METABOLIC PROCESS,0.0042095,0.12602,0.10752,1,1
1,GO CELLULAR RESPONSE TO FATTY ACID,0.024687,0.12595,0.12673,1,1
1,GO REGULATION OF TELOMERE MAINTENANCE,0.0017277,0.1259,0.11065,1,1
1,GO CYTOPLASMIC SEQUESTERING OF PROTEIN,0.00016098,0.12588,0.15803,1,1
1,GO ENZYME LINKED RECEPTOR PROTEIN SIGNALING PATHWAY,0.0012527,0.12577,0.1295,1,1
1,GO APOPTOTIC PROCESS,4.1026e-05,0.12575,0.12697,1,1
1,GO TRANSCRIPTION BY RNA POLYMERASE I,0.0037985,0.12574,0.12385,1,1
1,GO MICROTUBULE CYTOSKELETON ORGANIZATION INVOLVED IN MITOSIS,0.045591,0.1256,0.064426,1,1
1,GO PHOSPHATIDYLINOSITOL METABOLIC PROCESS,0.0001803,0.12548,0.13669,1,1
1,GO POSITIVE REGULATION OF SEQUESTERING OF CALCIUM ION,0.043866,0.12538,0.10338,1,1
1,GO RNA PHOSPHODIESTER BOND HYDROLYSIS EXONUCLEOLYTIC,0.0023009,0.12533,0.10066,1,1
1,GO BINDING OF SPERM TO ZONA PELLUCIDA,0.0057669,0.12512,0.087522,1,1
1,GO NEGATIVE REGULATION OF MULTICELLULAR ORGANISMAL PROCESS,0.00073415,0.12507,0.12809,1,1
1,GO CELLULAR RESPONSE TO RADIATION,4.2271e-06,0.12499,0.15332,1,1
1,GO CYTOCHROME COMPLEX ASSEMBLY,0.0061347,0.12487,0.13288,1,1
1,GO HYDROGEN PEROXIDE METABOLIC PROCESS,0.043025,0.12464,0.094404,1,1
1,GO REGULATION OF CELLULAR RESPONSE TO INSULIN STIMULUS,0.0037498,0.12456,0.13128,1,1
1,GO ANIMAL ORGAN FORMATION,0.016027,0.12451,0.12616,1,1
1,GO MITOCHONDRIAL TRANSLATION,0.0084096,0.12425,0.10428,1,1
1,GO MONOCARBOXYLIC ACID BIOSYNTHETIC PROCESS,0.0022095,0.12404,0.11469,1,1
1,GO GLYCEROLIPID BIOSYNTHETIC PROCESS,0.00024045,0.12403,0.13367,1,1
1,GO CELLULAR RESPONSE TO ATP,0.0037498,0.12396,0.11204,1,1
1,GO CELLULAR AMINO ACID METABOLIC PROCESS,0.00067188,0.12387,0.1034,1,1
1,GO PROTEIN QUALITY CONTROL FOR MISFOLDED OR INCOMPLETELY SYNTHESIZED PROTEINS,0.00035024,0.12386,0.12967,1,1
1,GO LIPID CATABOLIC PROCESS,0.00040235,0.12386,0.12645,1,1
1,GO RESPONSE TO NITRIC OXIDE,0.015329,0.12384,0.090347,1,1
1,GO REGULATION OF CELLULAR PROTEIN CATABOLIC PROCESS,5.8698e-06,0.12381,0.13227,1,1
1,GO DNA METHYLATION OR DEMETHYLATION,0.0058389,0.12372,0.096952,1,1
1,GO POSITIVE REGULATION OF PROTEIN DEPHOSPHORYLATION,0.0022095,0.12343,0.12193,1,1
1,GO RNA 3 END PROCESSING,0.00087508,0.12326,0.10571,1,1
1,GO RECEPTOR METABOLIC PROCESS,0.0023957,0.12311,0.11608,1,1
1,GO POSITIVE REGULATION OF HUMORAL IMMUNE RESPONSE,0.001568,0.1229,0.13555,1,1
1,GO DE NOVO PROTEIN FOLDING,0.03429,0.12282,0.097142,1,1
1,GO REGULATION OF PROTEIN LOCALIZATION TO MEMBRANE,0.0033361,0.1228,0.11463,1,1
1,GO NCRNA 3 END PROCESSING,0.0078263,0.12273,0.12734,1,1
1,GO DNA TEMPLATED TRANSCRIPTION INITIATION,7.8124e-06,0.12256,0.13185,1,1
1,GO NUCLEUS LOCALIZATION,0.036772,0.12252,0.12878,1,1
1,GO NEGATIVE REGULATION OF PROTEIN METABOLIC PROCESS,4.8839e-05,0.1225,0.13227,1,1
1,GO CELLULAR RESPONSE TO EXTERNAL STIMULUS,0.00049802,0.12247,0.14285,1,1
1,GO AMINO SUGAR BIOSYNTHETIC PROCESS,0.00063314,0.12236,0.16729,1,1
1,GO NEGATIVE REGULATION OF FAT CELL DIFFERENTIATION,0.0010113,0.12229,0.17305,1,1
1,GO OUTFLOW TRACT MORPHOGENESIS,0.013856,0.12221,0.17385,1,1
1,GO ESTROGEN METABOLIC PROCESS,0.001483,0.12207,0.14864,1,1
1,GO REGULATION OF DOUBLE STRAND BREAK REPAIR,0.0015249,0.12206,0.097672,1,1
1,GO VENTRICULAR SEPTUM DEVELOPMENT,0.029754,0.12124,0.13417,1,1
1,GO NUCLEOTIDE EXCISION REPAIR PREINCISION COMPLEX STABILIZATION,0.0037016,0.12121,0.11216,1,1
1,GO NUCLEOBASE CONTAINING COMPOUND TRANSPORT,0.00013899,0.12117,0.11053,1,1
1,GO CELLULAR RESPONSE TO PEPTIDE HORMONE STIMULUS,0.0039481,0.12093,0.10498,1,1
1,GO POSITIVE REGULATION OF TELOMERE MAINTENANCE,0.00031907,0.12063,0.11191,1,1
1,GO POSITIVE REGULATION OF CATALYTIC ACTIVITY,0.00018323,0.12056,0.12307,1,1
1,GO POSITIVE REGULATION OF CALCIUM MEDIATED SIGNALING,0.00068191,0.12054,0.12486,1,1
1,GO CELLULAR COMPONENT DISASSEMBLY,6.7105e-06,0.12047,0.11518,1,1
1,GO POSITIVE REGULATION OF STRESS ACTIVATED PROTEIN KINASE SIGNALING CASCADE,0.0013443,0.12045,0.13564,1,1
1,GO RNA SPLICING VIA ENDONUCLEOLYTIC CLEAVAGE AND LIGATION,0.059879,0.12044,0.069132,1,1
1,GO PROTEIN N LINKED GLYCOSYLATION,6.6578e-05,0.12034,0.15505,1,1
1,GO POSITIVE REGULATION OF PEPTIDYL SERINE PHOSPHORYLATION,0.00016629,0.12011,0.14519,1,1
1,GO CELLULAR PROTEIN CATABOLIC PROCESS,7.105e-06,0.12007,0.12734,1,1
1,GO MAINTENANCE OF LOCATION IN CELL,0.00030449,0.11999,0.13135,1,1
1,GO POSITIVE REGULATION OF AUTOPHAGY OF MITOCHONDRION,0.0033361,0.11998,0.14445,1,1
1,GO POSITIVE REGULATION OF DOUBLE STRAND BREAK REPAIR VIA HOMOLOGOUS RECOMBINATION,0.0022095,0.11997,0.12968,1,1
1,GO REGULATION OF RNA BINDING,0.0027747,0.11988,0.13244,1,1
1,GO ENDOPLASMIC RETICULUM TO GOLGI VESICLE MEDIATED TRANSPORT,2.6352e-05,0.11969,0.13178,1,1
1,GO DNA DAMAGE RESPONSE SIGNAL TRANSDUCTION BY P53 CLASS MEDIATOR,0.0037498,0.11954,0.11371,1,1
1,GO TRICARBOXYLIC ACID METABOLIC PROCESS,0.039406,0.11945,0.11447,1,1
