5,GO POSITIVE REGULATION OF MESONEPHROS DEVELOPMENT,7.5001e-05,0.39807,0.3636,1,1
5,GO NEGATIVE REGULATION OF ADENYLATE CYCLASE ACTIVITY,5.1351e-07,0.39722,0.40078,1,1
5,GO INHIBITORY POSTSYNAPTIC POTENTIAL,2.0776e-06,0.39564,0.40351,1,1
5,GO REGULATION OF DOPAMINE RECEPTOR SIGNALING PATHWAY,7.8911e-05,0.39458,0.3447,1,1
5,GO NEUROTRANSMITTER RECEPTOR LOCALIZATION TO POSTSYNAPTIC SPECIALIZATION MEMBRANE,4.31e-06,0.394,0.3252,1,1
5,GO REGULATION OF RECEPTOR CLUSTERING,0.00013673,0.39197,0.34367,1,1
5,GO NEGATIVE REGULATION OF LYASE ACTIVITY,4.2444e-07,0.39185,0.40106,1,1
5,GO POSITIVE REGULATION OF CILIUM ASSEMBLY,1.9136e-07,0.38949,0.35679,1,1
5,GO PROSTATE GLAND MORPHOGENESIS,0.00047589,0.38861,0.32219,1,1
5,GO MICROTUBULE ANCHORING AT CENTROSOME,9.3415e-09,0.38858,0.36812,1,1
5,GO CENTRAL NERVOUS SYSTEM PROJECTION NEURON AXONOGENESIS,2.5359e-06,0.388,0.39027,1,1
5,GO PRESYNAPTIC MODULATION OF CHEMICAL SYNAPTIC TRANSMISSION,0.0001803,0.38785,0.33976,1,1
5,GO CRANIAL NERVE MORPHOGENESIS,4.4807e-06,0.38759,0.3406,1,1
5,GO HEART VALVE FORMATION,2.6386e-06,0.38702,0.46307,1,1
5,GO POSITIVE REGULATION OF BROWN FAT CELL DIFFERENTIATION,4.3997e-05,0.38428,0.38162,1,1
5,GO ACROSOME ASSEMBLY,1.5027e-08,0.38359,0.35484,1,1
5,GO NEGATIVE REGULATION OF MEMBRANE POTENTIAL,3.152e-06,0.38286,0.35646,1,1
5,GO RESPONSE TO ACETYLCHOLINE,3.4796e-08,0.38083,0.39164,1,1
5,GO REGULATION OF EXCITATORY SYNAPSE ASSEMBLY,2.2958e-06,0.38057,0.41452,1,1
5,GO REGULATION OF MICROTUBULE DEPOLYMERIZATION,1.5293e-05,0.38029,0.31087,1,1
5,GO PARENTAL BEHAVIOR,1.8363e-05,0.37753,0.42789,1,1
5,GO NEURON FATE COMMITMENT,6.5906e-08,0.37658,0.39136,1,1
5,GO NEGATIVE REGULATION OF CATECHOLAMINE SECRETION,1.6994e-06,0.3753,0.48998,1,1
5,GO TONGUE MORPHOGENESIS,2.1234e-05,0.37502,0.38662,1,1
5,GO CRANIAL NERVE DEVELOPMENT,2.1624e-06,0.37464,0.31616,1,1
5,GO NEGATIVE REGULATION OF EPIDERMIS DEVELOPMENT,0.0021215,0.37389,0.2779,1,1
5,GO ESTABLISHMENT OF PLANAR POLARITY INVOLVED IN NEURAL TUBE CLOSURE,0.00014129,0.37223,0.29001,1,1
5,GO DORSAL VENTRAL NEURAL TUBE PATTERNING,1.7154e-07,0.37147,0.3442,1,1
5,GO CENTRIOLE CENTRIOLE COHESION,1.725e-09,0.3694,0.38992,1,1
5,GO NEGATIVE REGULATION OF FATTY ACID OXIDATION,4.1751e-05,0.36895,0.33593,1,1
5,GO CEREBELLAR PURKINJE CELL LAYER MORPHOGENESIS,1.1086e-06,0.36809,0.36745,1,1
5,GO CEREBELLAR CORTEX FORMATION,5.9116e-09,0.36773,0.36883,1,1
5,GO CORONARY VASCULATURE MORPHOGENESIS,4.2487e-05,0.36752,0.3422,1,1
5,GO SEMINIFEROUS TUBULE DEVELOPMENT,3.9822e-07,0.36539,0.41412,1,1
5,GO NERVE DEVELOPMENT,7.333e-07,0.3651,0.35218,1,1
5,GO POSITIVE REGULATION OF GLYCOLYTIC PROCESS,1.0791e-07,0.36463,0.4168,1,1
5,GO AUTONOMIC NERVOUS SYSTEM DEVELOPMENT,5.1351e-07,0.36338,0.32738,1,1
5,GO NEUROTRANSMITTER GATED ION CHANNEL CLUSTERING,0.0010408,0.3607,0.31734,1,1
5,GO REGULATION OF PRESYNAPSE ORGANIZATION,1.4472e-05,0.36047,0.3274,1,1
5,GO STABILIZATION OF MEMBRANE POTENTIAL,0.00091404,0.36004,0.3489,1,1
5,GO POSITIVE REGULATION OF SYNAPTIC TRANSMISSION GLUTAMATERGIC,8.3066e-07,0.35788,0.38465,1,1
5,GO HISTONE H3 K36 METHYLATION,7.8778e-10,0.35622,0.38381,1,1
5,GO SYNAPTIC VESICLE DOCKING,0.00091404,0.35618,0.31304,1,1
5,GO EPITHELIAL CELL PROLIFERATION INVOLVED IN LUNG MORPHOGENESIS,0.00054518,0.35582,0.28128,1,1
5,GO ATRIAL SEPTUM MORPHOGENESIS,1.7706e-05,0.3548,0.3905,1,1
5,GO TONGUE DEVELOPMENT,1.5014e-05,0.35436,0.33152,1,1
5,GO DIVALENT METAL ION EXPORT,3.2146e-06,0.35423,0.38268,1,1
5,GO HISTONE H3 K9 METHYLATION,4.7501e-09,0.3533,0.33368,1,1
5,GO MAST CELL MIGRATION,0.00015838,0.35311,0.38489,1,1
5,GO DETECTION OF TEMPERATURE STIMULUS,7.1274e-05,0.35025,0.35729,1,1
5,GO NEGATIVE REGULATION OF DENDRITE DEVELOPMENT,7.5217e-06,0.34939,0.29605,1,1
5,GO REGULATION OF TRANSMISSION OF NERVE IMPULSE,9.404e-07,0.34932,0.33219,1,1
5,GO LONG TERM SYNAPTIC DEPRESSION,1.2604e-07,0.34921,0.36825,1,1
5,GO HISTONE H3 K27 METHYLATION,6.4699e-07,0.34892,0.27534,1,1
5,GO PROTEIN LOCALIZATION TO AXON,8.3013e-05,0.34852,0.3955,1,1
5,GO LENS MORPHOGENESIS IN CAMERA TYPE EYE,2.8262e-08,0.34784,0.40658,1,1
5,GO TELENCEPHALON GLIAL CELL MIGRATION,3.7605e-06,0.34687,0.30785,1,1
5,GO FOREBRAIN REGIONALIZATION,8.4415e-08,0.34644,0.41171,1,1
5,GO BASIC AMINO ACID TRANSMEMBRANE TRANSPORT,0.015501,0.34548,0.1893,1,1
5,GO POSITIVE REGULATION OF NEUROBLAST PROLIFERATION,1.9558e-07,0.34499,0.35436,1,1
5,GO NEGATIVE REGULATION OF INTRACELLULAR ESTROGEN RECEPTOR SIGNALING PATHWAY,4.3355e-07,0.34487,0.42736,1,1
5,GO SPINAL CORD DEVELOPMENT,6.6581e-11,0.34477,0.37199,1,1
5,GO EMBRYONIC BRAIN DEVELOPMENT,3.4098e-06,0.34472,0.25387,1,1
5,GO SEX DETERMINATION,1.8318e-07,0.34425,0.32353,1,1
5,GO NEGATIVE REGULATION OF EPIDERMAL CELL DIFFERENTIATION,0.0093576,0.34412,0.24271,1,1
5,GO REGULATION OF LONG TERM NEURONAL SYNAPTIC PLASTICITY,6.2175e-05,0.34409,0.30254,1,1
5,GO NEGATIVE REGULATION OF HISTONE H3 K9 METHYLATION,5.6245e-08,0.34093,0.33106,1,1
5,GO NEGATIVE REGULATION OF VOLTAGE GATED CALCIUM CHANNEL ACTIVITY,3.6162e-06,0.34028,0.30483,1,1
5,GO REGULATION OF BROWN FAT CELL DIFFERENTIATION,8.6579e-07,0.34006,0.33793,1,1
5,GO RESPONSE TO AUDITORY STIMULUS,1.7385e-05,0.33994,0.39004,1,1
5,GO MECHANOSENSORY BEHAVIOR,0.0013633,0.33992,0.37824,1,1
5,GO MODULATION OF EXCITATORY POSTSYNAPTIC POTENTIAL,6.8885e-07,0.33965,0.40118,1,1
5,GO RECEPTOR CLUSTERING,2.7668e-07,0.33857,0.30652,1,1
5,GO NEGATIVE REGULATION OF ACTIVIN RECEPTOR SIGNALING PATHWAY,0.0003557,0.33816,0.30029,1,1
5,GO ATRIAL SEPTUM DEVELOPMENT,3.1494e-05,0.33788,0.31003,1,1
5,GO NEURON CELLULAR HOMEOSTASIS,9.1829e-05,0.33747,0.29559,1,1
5,GO ECTODERMAL PLACODE DEVELOPMENT,2.0776e-06,0.33643,0.40408,1,1
5,GO CARDIAC RIGHT VENTRICLE MORPHOGENESIS,0.00010497,0.33635,0.31994,1,1
5,GO CARDIAC MYOFIBRIL ASSEMBLY,1.6457e-05,0.33562,0.28292,1,1
5,GO SYNAPTIC VESICLE MATURATION,0.00015083,0.33518,0.35477,1,1
5,GO RECEPTOR LOCALIZATION TO SYNAPSE,5.8262e-07,0.33498,0.34047,1,1
5,GO ESTABLISHMENT OF PLANAR POLARITY OF EMBRYONIC EPITHELIUM,0.00020178,0.33492,0.2664,1,1
5,GO REGULATION OF SYNAPSE ASSEMBLY,3.4773e-06,0.3346,0.28421,1,1
5,GO LATERAL SPROUTING FROM AN EPITHELIUM,0.001568,0.33392,0.35193,1,1
5,GO MICROTUBULE ANCHORING AT MICROTUBULE ORGANIZING CENTER,5.1356e-08,0.33365,0.3169,1,1
5,GO RESPONSE TO L GLUTAMATE,2.8814e-05,0.33364,0.32598,1,1
5,GO CATECHOLAMINE UPTAKE INVOLVED IN SYNAPTIC TRANSMISSION,0.00065224,0.33263,0.27594,1,1
5,GO BRAIN MORPHOGENESIS,1.6514e-08,0.33209,0.32096,1,1
5,GO CENTRAL NERVOUS SYSTEM NEURON DEVELOPMENT,2.7668e-07,0.33156,0.30948,1,1
5,GO CEREBELLAR CORTEX DEVELOPMENT,6.586e-10,0.33139,0.35559,1,1
5,GO NEGATIVE REGULATION OF AXONOGENESIS,2.011e-05,0.32998,0.27665,1,1
5,GO LEFT RIGHT AXIS SPECIFICATION,6.4341e-05,0.32961,0.29537,1,1
5,GO PROTEIN LOCALIZATION TO POSTSYNAPSE,1.7693e-06,0.32926,0.30082,1,1
5,GO NUCLEAR MIGRATION,2.7668e-07,0.32895,0.32585,1,1
5,GO REGULATION OF POSTSYNAPSE ORGANIZATION,4.2784e-08,0.32876,0.33932,1,1
5,GO GAMMA AMINOBUTYRIC ACID SECRETION,0.00029511,0.32875,0.2672,1,1
5,GO STARTLE RESPONSE,8.5867e-06,0.32843,0.35474,1,1
5,GO NEGATIVE REGULATION OF PRI MIRNA TRANSCRIPTION BY RNA POLYMERASE II,8.1138e-06,0.3282,0.34682,1,1
5,GO ACTIN FILAMENT BASED TRANSPORT,2.3784e-07,0.32757,0.34358,1,1
5,GO NEURON PROJECTION GUIDANCE,5.8856e-08,0.32725,0.31696,1,1
5,GO ASTRAL MICROTUBULE ORGANIZATION,4.4749e-10,0.32723,0.37866,1,1
5,GO EMBRYONIC FORELIMB MORPHOGENESIS,4.8198e-07,0.3263,0.3236,1,1
5,GO POSITIVE REGULATION OF STEM CELL PROLIFERATION,6.0565e-09,0.32489,0.29411,1,1
5,GO AXONEMAL DYNEIN COMPLEX ASSEMBLY,7.105e-06,0.32483,0.35901,1,1
5,GO NEURON PROJECTION ARBORIZATION,7.333e-07,0.32457,0.35071,1,1
5,GO NEGATIVE REGULATION OF MACROPHAGE ACTIVATION,4.0314e-05,0.32439,0.28555,1,1
5,GO DETECTION OF STIMULUS INVOLVED IN SENSORY PERCEPTION OF PAIN,7.8911e-05,0.3236,0.31523,1,1
5,GO NEGATIVE REGULATION OF PEPTIDE HORMONE SECRETION,1.5372e-07,0.3228,0.30919,1,1
5,GO CENTRAL NERVOUS SYSTEM NEURON AXONOGENESIS,1.734e-06,0.32273,0.29957,1,1
5,GO PROTEIN LOCALIZATION TO NON MOTILE CILIUM,0.00010152,0.32205,0.29222,1,1
5,GO CELL JUNCTION MAINTENANCE,1.5037e-07,0.32197,0.35252,1,1
5,GO GLUTAMATE RECEPTOR SIGNALING PATHWAY,1.3599e-06,0.32168,0.31875,1,1
5,GO NOREPINEPHRINE SECRETION,1.1165e-05,0.32118,0.32006,1,1
5,GO TELENCEPHALON REGIONALIZATION,1.3693e-05,0.32081,0.37468,1,1
5,GO NEUROBLAST PROLIFERATION,1.3671e-08,0.32031,0.33712,1,1
5,GO NUCLEUS LOCALIZATION,3.1479e-07,0.31934,0.30731,1,1
5,GO GANGLION DEVELOPMENT,0.00015583,0.31919,0.3286,1,1
5,GO NEGATIVE REGULATION OF DNA DEPENDENT DNA REPLICATION,4.719e-07,0.31903,0.30661,1,1
5,GO REGULATION OF MESONEPHROS DEVELOPMENT,0.00039622,0.31805,0.27719,1,1
5,GO POSTSYNAPTIC MODULATION OF CHEMICAL SYNAPTIC TRANSMISSION,0.00021857,0.31805,0.27673,1,1
5,GO ESTROUS CYCLE,2.3239e-05,0.3179,0.27135,1,1
5,GO MODIFICATION OF POSTSYNAPTIC ACTIN CYTOSKELETON,0.00013232,0.31754,0.29676,1,1
5,GO CELL DIFFERENTIATION IN SPINAL CORD,2.7676e-09,0.31744,0.35054,1,1
5,GO NEURON MIGRATION,6.3569e-09,0.31715,0.35493,1,1
5,GO REGULATION OF SYNAPTIC TRANSMISSION GLUTAMATERGIC,4.4285e-07,0.31688,0.34296,1,1
5,GO MYELIN MAINTENANCE,0.0014022,0.31622,0.27738,1,1
5,GO ATRIOVENTRICULAR VALVE DEVELOPMENT,6.5837e-06,0.31591,0.32848,1,1
5,GO MICROTUBULE NUCLEATION BY MICROTUBULE ORGANIZING CENTER,2.3891e-06,0.31582,0.32277,1,1
5,GO GAMMA AMINOBUTYRIC ACID SIGNALING PATHWAY,0.00011406,0.31572,0.28023,1,1
5,GO METENCEPHALON DEVELOPMENT,1.1533e-09,0.31458,0.33858,1,1
5,GO DORSAL SPINAL CORD DEVELOPMENT,3.5794e-07,0.31441,0.37845,1,1
5,GO MRNA SPLICE SITE SELECTION,3.5427e-10,0.31428,0.36948,1,1
5,GO INHIBITORY SYNAPSE ASSEMBLY,1.5014e-05,0.3141,0.39487,1,1
5,GO POST EMBRYONIC ANIMAL ORGAN DEVELOPMENT,0.00090088,0.314,0.23147,1,1
5,GO COCHLEA MORPHOGENESIS,2.5424e-05,0.31396,0.30522,1,1
5,GO CHONDROCYTE DIFFERENTIATION INVOLVED IN ENDOCHONDRAL BONE MORPHOGENESIS,5.4184e-05,0.31394,0.33,1,1
5,GO NEGATIVE REGULATION OF VASCULAR PERMEABILITY,7.6283e-05,0.31312,0.28783,1,1
5,GO POSITIVE REGULATION OF AMINO ACID TRANSPORT,0.00027716,0.31298,0.27779,1,1
5,GO NEURAL TUBE PATTERNING,5.1356e-08,0.3128,0.29194,1,1
5,GO REGULATION OF HISTONE H3 K9 METHYLATION,3.055e-09,0.31244,0.32803,1,1
5,GO NEURON RECOGNITION,1.2482e-05,0.31064,0.30197,1,1
5,GO CEREBRAL CORTEX NEURON DIFFERENTIATION,2.0364e-06,0.31051,0.41721,1,1
5,GO NEGATIVE REGULATION OF MICROTUBULE POLYMERIZATION,0.0048405,0.30992,0.29411,1,1
5,GO CELL FATE SPECIFICATION,1.1579e-08,0.30964,0.31123,1,1
5,GO PROTEIN LOCALIZATION TO CILIARY MEMBRANE,7.2497e-05,0.3096,0.30191,1,1
5,GO POSITIVE REGULATION OF VASCULAR ENDOTHELIAL GROWTH FACTOR RECEPTOR SIGNALING PATHWAY,8.7316e-05,0.3087,0.27108,1,1
5,GO PROTEIN TRANSPORT ALONG MICROTUBULE,2.3467e-08,0.30857,0.30513,1,1
5,GO DENDRITIC SPINE MORPHOGENESIS,2.0879e-07,0.30831,0.32458,1,1
5,GO CENTRAL NERVOUS SYSTEM NEURON DIFFERENTIATION,2.2697e-09,0.30754,0.31449,1,1
5,GO DORSAL VENTRAL AXIS SPECIFICATION,3.8246e-05,0.30749,0.30578,1,1
5,GO REGULATION OF SKELETAL MUSCLE CELL DIFFERENTIATION,8.7502e-06,0.30697,0.31999,1,1
5,GO POSITIVE REGULATION OF EXCITATORY POSTSYNAPTIC POTENTIAL,3.4409e-05,0.30596,0.34865,1,1
5,GO AXONAL FASCICULATION,0.00038422,0.3059,0.27616,1,1
5,GO REGULATION OF AXONOGENESIS,2.1338e-07,0.30589,0.30259,1,1
5,GO REGULATION OF DENDRITIC SPINE MORPHOGENESIS,6.895e-08,0.30564,0.34422,1,1
5,GO NON MOTILE CILIUM ASSEMBLY,6.3359e-07,0.30491,0.26684,1,1
5,GO NEUROTRANSMITTER RECEPTOR INTERNALIZATION,2.4972e-05,0.30487,0.2818,1,1
5,GO CHROMATIN MEDIATED MAINTENANCE OF TRANSCRIPTION,2.3467e-08,0.30478,0.32357,1,1
5,GO GANGLIOSIDE BIOSYNTHETIC PROCESS,0.0001179,0.30459,0.28551,1,1
5,GO POSITIVE REGULATION OF GLYCOGEN METABOLIC PROCESS,1.1282e-07,0.30407,0.36022,1,1
5,GO REGULATION OF POSTSYNAPTIC MEMBRANE NEUROTRANSMITTER RECEPTOR LEVELS,1.9558e-07,0.30404,0.28556,1,1
5,GO REGULATION OF ADENYLATE CYCLASE ACTIVITY,4.4807e-06,0.30401,0.30952,1,1
5,GO NEGATIVE REGULATION OF NERVOUS SYSTEM PROCESS,5.2538e-08,0.30361,0.31566,1,1
5,GO SYNAPTIC TRANSMISSION GLUTAMATERGIC,9.5999e-07,0.30306,0.322,1,1
5,GO NEGATIVE REGULATION OF DNA RECOMBINATION,4.5684e-06,0.30291,0.24642,1,1
5,GO HISTONE H3 K9 MODIFICATION,3.6293e-09,0.30284,0.30251,1,1
5,GO HIPPO SIGNALING,2.0478e-05,0.30267,0.27655,1,1
5,GO PROTEIN DEMETHYLATION,8.6937e-09,0.30205,0.30505,1,1
5,GO REGULATION OF DENDRITE MORPHOGENESIS,1.0036e-08,0.30166,0.31322,1,1
5,GO OLIGODENDROCYTE DEVELOPMENT,2.7312e-05,0.30104,0.23962,1,1
5,GO METANEPHROS MORPHOGENESIS,7.7586e-05,0.30083,0.25709,1,1
5,GO THYROID GLAND DEVELOPMENT,1.6654e-06,0.30078,0.30346,1,1
5,GO POSTSYNAPSE ORGANIZATION,7.5266e-09,0.3006,0.33732,1,1
5,GO EMBRYONIC BODY MORPHOGENESIS,5.0323e-06,0.30032,0.31824,1,1
5,GO CELL PROLIFERATION IN FOREBRAIN,1.9044e-05,0.2999,0.28403,1,1
5,GO CELLULAR COMPONENT MAINTENANCE,8.2543e-08,0.2998,0.28885,1,1
5,GO PROTEIN LOCALIZATION TO CILIUM,3.4796e-08,0.29967,0.31032,1,1
5,GO MODIFICATION OF POSTSYNAPTIC STRUCTURE,9.6562e-05,0.29962,0.28952,1,1
5,GO REGULATION OF DENDRITIC SPINE DEVELOPMENT,3.9035e-08,0.29932,0.31666,1,1
5,GO REGULATION OF AMPA RECEPTOR ACTIVITY,9.6562e-05,0.29883,0.34419,1,1
5,GO DNA DEPENDENT DNA REPLICATION MAINTENANCE OF FIDELITY,1.6782e-07,0.29848,0.28358,1,1
5,GO DENTATE GYRUS DEVELOPMENT,0.00019541,0.29809,0.36341,1,1
5,GO EPITHELIAL CELL MATURATION,3.5461e-06,0.29774,0.29839,1,1
5,GO POSITIVE REGULATION OF CAMP MEDIATED SIGNALING,0.00011218,0.29719,0.28841,1,1
5,GO PHOTORECEPTOR CELL MAINTENANCE,3.247e-08,0.29698,0.27879,1,1
5,GO SIALYLATION,4.3997e-05,0.29622,0.31484,1,1
5,GO POSITIVE REGULATION OF DOUBLE STRAND BREAK REPAIR VIA NONHOMOLOGOUS END JOINING,0.00037257,0.29557,0.22055,1,1
5,GO HINDBRAIN DEVELOPMENT,1.069e-09,0.29544,0.29742,1,1
5,GO RESPONSE TO POTASSIUM ION,4.3236e-05,0.2954,0.32159,1,1
5,GO AXON DEVELOPMENT,1.0791e-07,0.29538,0.28371,1,1
5,GO REGULATION OF CILIUM ASSEMBLY,1.2733e-08,0.29535,0.27764,1,1
5,GO REGULATION OF SHORT TERM NEURONAL SYNAPTIC PLASTICITY,0.0071051,0.29534,0.29065,1,1
5,GO EXCITATORY SYNAPSE ASSEMBLY,2.3891e-06,0.29525,0.37346,1,1
5,GO COLLECTING DUCT DEVELOPMENT,6.8396e-06,0.29472,0.37369,1,1
5,GO REGULATION OF ACTIVIN RECEPTOR SIGNALING PATHWAY,2.913e-06,0.29461,0.25389,1,1
5,GO PROTEIN LOCALIZATION TO MICROTUBULE ORGANIZING CENTER,5.2538e-08,0.29433,0.25967,1,1
5,GO DENDRITE MORPHOGENESIS,1.3039e-08,0.29355,0.31995,1,1
5,GO SYNAPSE ORGANIZATION,9.4407e-08,0.29326,0.2898,1,1
5,GO CELL MORPHOGENESIS INVOLVED IN NEURON DIFFERENTIATION,4.3774e-08,0.29284,0.28788,1,1
5,GO POSTSYNAPTIC SIGNAL TRANSDUCTION,1.7154e-07,0.29245,0.30605,1,1
5,GO MYOBLAST MIGRATION,0.0065235,0.29233,0.21996,1,1
5,GO DETECTION OF TEMPERATURE STIMULUS INVOLVED IN SENSORY PERCEPTION,0.0002117,0.29192,0.318,1,1
5,GO SPERMATID NUCLEUS DIFFERENTIATION,3.1004e-08,0.29189,0.29006,1,1
5,GO REGULATION OF SYNAPSE STRUCTURE OR ACTIVITY,6.2993e-08,0.29175,0.2948,1,1
5,GO PERIPHERAL NERVOUS SYSTEM DEVELOPMENT,1.2032e-06,0.29154,0.2411,1,1
5,GO URETER DEVELOPMENT,0.00048316,0.29148,0.35015,1,1
5,GO NEURON MATURATION,2.538e-07,0.29096,0.28949,1,1
5,GO REGULATION OF PROTEIN KINASE C SIGNALING,0.001422,0.29089,0.29713,1,1
5,GO POSITIVE REGULATION OF SKELETAL MUSCLE TISSUE DEVELOPMENT,6.2175e-05,0.29078,0.26258,1,1
5,GO EMBRYONIC SKELETAL SYSTEM MORPHOGENESIS,1.5994e-06,0.29039,0.28872,1,1
5,GO NEUROTRANSMITTER RECEPTOR TRANSPORT,1.3325e-06,0.29028,0.30955,1,1
5,GO PROGRAMMED CELL DEATH INVOLVED IN CELL DEVELOPMENT,1.0861e-06,0.29018,0.37621,1,1
5,GO REGULATION OF MORPHOGENESIS OF A BRANCHING STRUCTURE,7.1274e-05,0.29001,0.24175,1,1
5,GO REGULATION OF POSTSYNAPTIC CYTOSOLIC CALCIUM ION CONCENTRATION,0.00049802,0.28996,0.35476,1,1
5,GO SYNAPSE ASSEMBLY,2.5934e-07,0.28992,0.30785,1,1
5,GO PRESYNAPSE ORGANIZATION,7.5217e-06,0.2898,0.28374,1,1
5,GO INTRACILIARY TRANSPORT,1.3769e-07,0.28939,0.31926,1,1
5,GO VENTRAL SPINAL CORD DEVELOPMENT,1.4677e-08,0.28875,0.31176,1,1
5,GO LEARNING,5.1356e-08,0.28868,0.28993,1,1
5,GO CHLORIDE ION HOMEOSTASIS,0.00016901,0.28859,0.2775,1,1
5,GO POSITIVE REGULATION OF DENDRITIC SPINE DEVELOPMENT,8.2864e-09,0.28848,0.3449,1,1
5,GO REGULATION OF CENTRIOLE REPLICATION,1.3878e-06,0.28786,0.28493,1,1
5,GO POST ANAL TAIL MORPHOGENESIS,6.7105e-06,0.28776,0.27104,1,1
5,GO AXONEME ASSEMBLY,3.0811e-07,0.28709,0.33481,1,1
5,GO NEPHRON TUBULE FORMATION,8.1623e-05,0.28706,0.29228,1,1
5,GO POSITIVE REGULATION OF VASCULAR ENDOTHELIAL CELL PROLIFERATION,0.0003557,0.28702,0.2616,1,1
5,GO ADULT HEART DEVELOPMENT,0.00036686,0.28653,0.235,1,1
5,GO PENILE ERECTION,0.00039622,0.28632,0.26081,1,1
5,GO RETINA LAYER FORMATION,0.00014839,0.28625,0.31194,1,1
5,GO CELLULAR POTASSIUM ION HOMEOSTASIS,4.31e-06,0.2861,0.30175,1,1
5,GO SEROTONIN TRANSPORT,0.0010259,0.28593,0.22565,1,1
5,GO NEURAL CREST FORMATION,0.00031414,0.28547,0.26257,1,1
5,GO POSITIVE REGULATION OF MORPHOGENESIS OF AN EPITHELIUM,5.2344e-05,0.28461,0.27596,1,1
5,GO OUTER DYNEIN ARM ASSEMBLY,7.6283e-05,0.28447,0.32725,1,1
5,GO CALCIUM INDEPENDENT CELL CELL ADHESION VIA PLASMA MEMBRANE CELL ADHESION MOLECULES,0.01016,0.28415,0.22865,1,1
5,GO REGULATION OF CELL MORPHOGENESIS INVOLVED IN DIFFERENTIATION,1.9989e-07,0.28393,0.2679,1,1
5,GO SPINAL CORD MOTOR NEURON DIFFERENTIATION,1.1858e-08,0.28373,0.30298,1,1
5,GO NEGATIVE REGULATION OF NEURON PROJECTION REGENERATION,0.0021798,0.28342,0.27922,1,1
5,GO REGULATION OF INCLUSION BODY ASSEMBLY,0.0044864,0.28281,0.24526,1,1
5,GO PROTEIN LOCALIZATION TO SYNAPSE,1.9563e-06,0.28267,0.29486,1,1
5,GO PROSTATE GLANDULAR ACINUS DEVELOPMENT,0.0023637,0.28189,0.29508,1,1
5,GO MICROTUBULE ANCHORING,5.1351e-07,0.28084,0.2577,1,1
5,GO POTASSIUM ION HOMEOSTASIS,7.0337e-07,0.27996,0.29052,1,1
5,GO POSITIVE REGULATION OF DENDRITE MORPHOGENESIS,9.7991e-09,0.27992,0.31555,1,1
5,GO POSITIVE REGULATION OF NEURAL PRECURSOR CELL PROLIFERATION,7.0017e-09,0.27977,0.30585,1,1
5,GO UTERINE SMOOTH MUSCLE CONTRACTION,0.00026438,0.27957,0.26139,1,1
5,GO EMBRYONIC DIGESTIVE TRACT MORPHOGENESIS,5.4356e-06,0.27938,0.28464,1,1
5,GO RESPONSE TO VITAMIN A,0.00035024,0.27936,0.23363,1,1
5,GO ESTABLISHMENT OF PROTEIN LOCALIZATION TO POSTSYNAPTIC MEMBRANE,1.7385e-05,0.2792,0.32555,1,1
5,GO ACTIN CROSSLINK FORMATION,2.8271e-07,0.27842,0.35384,1,1
5,GO RETROGRADE AXONAL TRANSPORT,1.3878e-06,0.27771,0.30504,1,1
5,GO G PROTEIN COUPLED ACETYLCHOLINE RECEPTOR SIGNALING PATHWAY,8.5858e-05,0.27721,0.27052,1,1
5,GO REGULATION OF MICROTUBULE POLYMERIZATION OR DEPOLYMERIZATION,5.0323e-06,0.27714,0.25041,1,1
5,GO METANEPHRIC NEPHRON MORPHOGENESIS,0.00094089,0.27697,0.18325,1,1
5,GO NEGATIVE REGULATION OF TORC1 SIGNALING,1.536e-06,0.27589,0.33461,1,1
5,GO PANCREAS DEVELOPMENT,1.9558e-07,0.27574,0.30638,1,1
5,GO POSITIVE REGULATION OF AXONOGENESIS,1.1316e-06,0.27529,0.29182,1,1
5,GO MICROTUBULE BUNDLE FORMATION,1.9014e-08,0.27525,0.29584,1,1
5,GO REGULATION OF DOUBLE STRAND BREAK REPAIR VIA NONHOMOLOGOUS END JOINING,1.0361e-05,0.27505,0.22107,1,1
5,GO NEGATIVE REGULATION OF GLYCOLYTIC PROCESS,0.044292,0.27471,0.18222,1,1
5,GO RESPONSE TO ELECTRICAL STIMULUS,2.0853e-05,0.27464,0.25998,1,1
5,GO DENDRITIC SPINE DEVELOPMENT,7.5451e-08,0.27458,0.29499,1,1
5,GO REGULATION OF POSTSYNAPTIC MEMBRANE POTENTIAL,2.1624e-06,0.27451,0.30092,1,1
5,GO RESPONSE TO NICOTINE,9.4407e-08,0.27401,0.30638,1,1
5,GO INTRACILIARY RETROGRADE TRANSPORT,4.0657e-06,0.27391,0.34288,1,1
5,GO TUBE FORMATION,3.5038e-07,0.27322,0.22845,1,1
5,GO ADENYLATE CYCLASE INHIBITING G PROTEIN COUPLED RECEPTOR SIGNALING PATHWAY,2.4837e-07,0.27295,0.27346,1,1
5,GO MODIFICATION OF SYNAPTIC STRUCTURE,0.00019229,0.27258,0.2376,1,1
5,GO MESENCHYMAL CELL PROLIFERATION,0.00038422,0.27244,0.25134,1,1
5,GO LABYRINTHINE LAYER BLOOD VESSEL DEVELOPMENT,0.00019229,0.27238,0.21794,1,1
5,GO PROTEIN POLYGLUTAMYLATION,9.0235e-07,0.27222,0.29375,1,1
5,GO ADULT BEHAVIOR,2.0881e-08,0.27218,0.30588,1,1
5,GO CYTOPLASMIC MICROTUBULE ORGANIZATION,2.9078e-09,0.27215,0.29627,1,1
5,GO REGULATION OF EXTENT OF CELL GROWTH,5.5864e-07,0.27206,0.29152,1,1
5,GO MORPHOGENESIS OF EMBRYONIC EPITHELIUM,1.5994e-06,0.27155,0.22311,1,1
5,GO REGULATION OF NEURAL PRECURSOR CELL PROLIFERATION,5.9116e-09,0.27093,0.29483,1,1
5,GO MAMMARY GLAND DUCT MORPHOGENESIS,0.0010558,0.27091,0.21596,1,1
5,GO NEGATIVE REGULATION OF CELL MORPHOGENESIS INVOLVED IN DIFFERENTIATION,2.0478e-05,0.27019,0.24344,1,1
5,GO REGULATION OF SMOOTHENED SIGNALING PATHWAY,1.7693e-06,0.27011,0.24767,1,1
5,GO NEGATIVE REGULATION OF NEURAL PRECURSOR CELL PROLIFERATION,4.6578e-06,0.26983,0.29676,1,1
5,GO MITOTIC G2 DNA DAMAGE CHECKPOINT,1.475e-06,0.26977,0.2459,1,1
5,GO REGULATION OF HIPPO SIGNALING,0.001704,0.26957,0.22085,1,1
5,GO NEPHRON MORPHOGENESIS,3.3214e-05,0.26921,0.20947,1,1
5,GO REGULATION OF NERVOUS SYSTEM PROCESS,4.1815e-08,0.26917,0.30725,1,1
5,GO REGULATION OF STEM CELL PROLIFERATION,1.5713e-07,0.26882,0.27186,1,1
5,GO POSITIVE REGULATION OF OLIGODENDROCYTE DIFFERENTIATION,2.4528e-05,0.26788,0.25521,1,1
5,GO MESONEPHRIC TUBULE MORPHOGENESIS,0.00015331,0.26781,0.20648,1,1
5,GO VESICLE MEDIATED TRANSPORT IN SYNAPSE,3.1479e-07,0.26773,0.29236,1,1
5,GO CARDIAC ATRIUM DEVELOPMENT,1.9749e-05,0.26764,0.26172,1,1
5,GO REGULATION OF SYNAPTIC PLASTICITY,1.734e-06,0.26746,0.26622,1,1
5,GO CELL PART MORPHOGENESIS,4.9069e-08,0.26739,0.27364,1,1
5,GO POSITIVE REGULATION OF NERVOUS SYSTEM PROCESS,1.2792e-06,0.26732,0.29736,1,1
5,GO POSITIVE REGULATION OF CELLULAR RESPONSE TO INSULIN STIMULUS,0.00022208,0.26723,0.22041,1,1
5,GO NEGATIVE REGULATION OF RECEPTOR INTERNALIZATION,5.9056e-05,0.26709,0.26933,1,1
5,GO CILIARY BASAL BODY PLASMA MEMBRANE DOCKING,3.3228e-08,0.26707,0.25075,1,1
5,GO INTRACILIARY TRANSPORT INVOLVED IN CILIUM ASSEMBLY,2.0879e-07,0.26699,0.31595,1,1
5,GO REGULATION OF COLLATERAL SPROUTING,0.00035024,0.26653,0.28539,1,1
5,GO NEURAL PRECURSOR CELL PROLIFERATION,3.2094e-09,0.26614,0.27858,1,1
5,GO REGULATION OF NON CANONICAL WNT SIGNALING PATHWAY,0.0071051,0.26604,0.17607,1,1
5,GO ENDOCARDIUM DEVELOPMENT,7.8911e-05,0.26588,0.24831,1,1
5,GO POSITIVE REGULATION OF SYNAPSE ASSEMBLY,4.7999e-05,0.26543,0.26536,1,1
5,GO REGULATION OF DENDRITE DEVELOPMENT,2.0398e-08,0.26526,0.28718,1,1
5,GO DENDRITE SELF AVOIDANCE,0.00098255,0.26465,0.22548,1,1
5,GO HISTONE H3 K9 TRIMETHYLATION,9.1205e-09,0.26437,0.29243,1,1
5,GO NEGATIVE REGULATION OF AXON EXTENSION,7.8124e-06,0.26437,0.28092,1,1
5,GO MICROTUBULE ORGANIZING CENTER LOCALIZATION,1.3999e-08,0.26426,0.29844,1,1
5,GO POSITIVE REGULATION OF DENDRITE DEVELOPMENT,5.4967e-09,0.26412,0.30185,1,1
5,GO MITOCHONDRION DISTRIBUTION,3.2146e-06,0.26404,0.25603,1,1
5,GO DIENCEPHALON DEVELOPMENT,7.9617e-06,0.26387,0.26233,1,1
5,GO REGULATION OF TRANS SYNAPTIC SIGNALING,6.7411e-08,0.26335,0.28472,1,1
5,GO REGULATION OF SYNAPTIC VESICLE EXOCYTOSIS,2.1234e-05,0.26306,0.29019,1,1
5,GO REGULATION OF SYNAPTIC VESICLE CYCLE,7.2414e-06,0.26305,0.29231,1,1
5,GO CHEMICAL SYNAPTIC TRANSMISSION POSTSYNAPTIC,1.0424e-06,0.26302,0.30324,1,1
5,GO REGULATION OF NEURON DIFFERENTIATION,6.5906e-08,0.26278,0.25458,1,1
5,GO APPENDAGE MORPHOGENESIS,6.6066e-07,0.26275,0.2575,1,1
5,GO HINDBRAIN MORPHOGENESIS,1.3039e-08,0.26262,0.27215,1,1
5,GO POSITIVE REGULATION OF SMOOTHENED SIGNALING PATHWAY,4.1751e-05,0.2624,0.2478,1,1
5,GO CEREBRAL CORTEX RADIALLY ORIENTED CELL MIGRATION,2.1624e-06,0.2624,0.27621,1,1
5,GO REGULATION OF LONG TERM SYNAPTIC POTENTIATION,0.00032916,0.26199,0.21431,1,1
5,GO REGULATION OF CYCLASE ACTIVITY,5.9834e-06,0.26148,0.24994,1,1
5,GO SYNAPTIC TRANSMISSION CHOLINERGIC,1.3196e-05,0.26131,0.23498,1,1
5,GO REGULATION OF NEURON PROJECTION DEVELOPMENT,6.3359e-07,0.26117,0.24274,1,1
5,GO APICAL PROTEIN LOCALIZATION,1.3878e-06,0.26077,0.30876,1,1
5,GO MICROTUBULE POLYMERIZATION,9.9803e-06,0.26037,0.23441,1,1
5,GO OVARIAN FOLLICLE DEVELOPMENT,3.0156e-07,0.26027,0.29746,1,1
5,GO EMBRYONIC SKELETAL SYSTEM DEVELOPMENT,3.0905e-06,0.26009,0.25472,1,1
5,GO NEUROMUSCULAR JUNCTION DEVELOPMENT,9.3381e-05,0.2599,0.23566,1,1
5,GO HINDLIMB MORPHOGENESIS,0.00040235,0.25974,0.22629,1,1
5,GO EMBRYONIC CAMERA TYPE EYE DEVELOPMENT,1.064e-06,0.25952,0.25894,1,1
5,GO SYNAPTIC SIGNALING,1.5713e-07,0.25905,0.26413,1,1
5,GO POSITIVE REGULATION OF SYNAPTIC TRANSMISSION,1.5994e-06,0.25864,0.26801,1,1
5,GO GENETIC IMPRINTING,3.152e-06,0.25863,0.25362,1,1
5,GO GAMMA AMINOBUTYRIC ACID TRANSPORT,0.000662,0.25849,0.22457,1,1
5,GO NEGATIVE REGULATION OF CILIUM ASSEMBLY,8.0712e-08,0.25845,0.29547,1,1
5,GO SMOOTHENED SIGNALING PATHWAY,1.5753e-08,0.25801,0.25433,1,1
5,GO PROXIMAL DISTAL PATTERN FORMATION,0.00021857,0.25795,0.25199,1,1
5,GO POSITIVE REGULATION OF NEURON DIFFERENTIATION,7.2129e-08,0.25758,0.25323,1,1
5,GO POSITIVE REGULATION OF CHROMATIN BINDING,1.4207e-05,0.25675,0.2807,1,1
5,GO FOREBRAIN CELL MIGRATION,2.8001e-06,0.25571,0.26354,1,1
5,GO MICROTUBULE POLYMERIZATION OR DEPOLYMERIZATION,8.6579e-07,0.25559,0.2476,1,1
5,GO REGULATION OF MICROTUBULE BINDING,0.00030928,0.25548,0.25085,1,1
5,GO LOCALIZATION WITHIN MEMBRANE,3.9102e-06,0.25523,0.23021,1,1
5,GO CILIUM ORGANIZATION,2.3853e-09,0.25494,0.26285,1,1
5,GO COLUMNAR CUBOIDAL EPITHELIAL CELL DIFFERENTIATION,1.5865e-05,0.25489,0.22142,1,1
5,GO EMBRYONIC DIGIT MORPHOGENESIS,1.3693e-05,0.25423,0.21155,1,1
5,GO EMBRYONIC APPENDAGE MORPHOGENESIS,2.3891e-06,0.25403,0.24039,1,1
5,GO PROTEIN LOCALIZATION TO KINETOCHORE,9.086e-06,0.25394,0.23728,1,1
5,GO NOREPINEPHRINE TRANSPORT,9.3381e-05,0.25389,0.27306,1,1
5,GO POSITIVE REGULATION OF DEVELOPMENTAL GROWTH,2.2775e-07,0.25381,0.23077,1,1
5,GO DENDRITE DEVELOPMENT,1.3999e-08,0.2538,0.28751,1,1
5,GO ACTIVATION OF PROTEIN KINASE A ACTIVITY,2.9859e-05,0.25377,0.27488,1,1
5,GO NEURON PROJECTION ORGANIZATION,1.1086e-06,0.25363,0.27884,1,1
5,GO EPITHELIAL CELL MORPHOGENESIS,0.0069343,0.25352,0.24214,1,1
5,GO MESONEPHROS DEVELOPMENT,0.00044781,0.25349,0.19151,1,1
5,GO HISTONE H2A MONOUBIQUITINATION,3.7195e-09,0.25347,0.28253,1,1
5,GO POSITIVE REGULATION OF COLLATERAL SPROUTING,0.00054518,0.25329,0.29453,1,1
5,GO POSITIVE REGULATION OF AXON EXTENSION,1.2482e-05,0.25297,0.25862,1,1
5,GO VENTRICULAR SEPTUM MORPHOGENESIS,0.0018006,0.25288,0.20498,1,1
