1,GO LAMELLIPODIUM ORGANIZATION,0.0046564,0.11799,0.18098,1,1
1,GO REGULATION OF MUSCLE HYPERTROPHY,0.04854,0.11798,0.13077,1,1
1,GO TRANSCRIPTION PREINITIATION COMPLEX ASSEMBLY,0.0054795,0.11787,0.11109,1,1
1,GO ACTOMYOSIN STRUCTURE ORGANIZATION,0.026586,0.11757,0.15628,1,1
1,GO AUTOPHAGY OF MITOCHONDRION,0.00012964,0.11735,0.15591,1,1
1,GO REGULATION OF DNA REPLICATION,0.0031536,0.11709,0.11091,1,1
1,GO CHROMOSOME SEPARATION,0.011047,0.11668,0.133,1,1
1,GO ENERGY DERIVATION BY OXIDATION OF ORGANIC COMPOUNDS,0.011904,0.11617,0.087073,1,1
1,GO RETROGRADE TRANSPORT ENDOSOME TO GOLGI,5.2139e-05,0.11605,0.14524,1,1
1,GO REGULATION OF ATPASE ACTIVITY,0.0057817,0.11598,0.11393,1,1
1,GO REGULATION OF REPRODUCTIVE PROCESS,0.012508,0.11446,0.082696,1,1
1,GO REGULATION OF PROTEIN LOCALIZATION TO MEMBRANE,0.0073363,0.11443,0.12396,1,1
1,GO REGULATION OF AUTOPHAGY,6.0504e-05,0.11411,0.13573,1,1
1,GO ORGANONITROGEN COMPOUND BIOSYNTHETIC PROCESS,0.00010845,0.11372,0.122,1,1
1,GO POSITIVE REGULATION OF TRANSFERASE ACTIVITY,0.00021909,0.11368,0.12092,1,1
1,GO FC RECEPTOR MEDIATED STIMULATORY SIGNALING PATHWAY,0.019283,0.1135,0.1069,1,1
1,GO EMBRYONIC MORPHOGENESIS,0.0054795,0.11333,0.11892,1,1
1,GO APOPTOTIC DNA FRAGMENTATION,0.0010206,0.11315,0.11398,1,1
1,GO GENERATION OF PRECURSOR METABOLITES AND ENERGY,0.0045306,0.11299,0.088532,1,1
1,GO ORGANELLE FISSION,0.0039469,0.11284,0.091543,1,1
1,GO SPINDLE ORGANIZATION,0.0047853,0.11271,0.11735,1,1
1,GO CARDIAC CHAMBER MORPHOGENESIS,0.05161,0.11243,0.14607,1,1
1,GO REGULATION OF SMALL MOLECULE METABOLIC PROCESS,0.0040578,0.11225,0.088591,1,1
1,GO REGULATION OF DNA BINDING TRANSCRIPTION FACTOR ACTIVITY,0.001228,0.11223,0.13113,1,1
1,GO NEGATIVE REGULATION OF PHOSPHORYLATION,0.017969,0.11216,0.10068,1,1
1,GO MACROAUTOPHAGY,1.349e-05,0.11204,0.1404,1,1
1,GO POSITIVE REGULATION OF CHEMOTAXIS,0.033894,0.11183,0.13326,1,1
1,GO POSITIVE REGULATION OF PROTEIN DEPHOSPHORYLATION,0.0010859,0.11173,0.16527,1,1
1,GO FEMALE GAMETE GENERATION,0.0032441,0.11153,0.098412,1,1
1,GO INTRINSIC APOPTOTIC SIGNALING PATHWAY,0.02268,0.11145,0.10073,1,1
1,GO REGULATION OF TRANSFERASE ACTIVITY,0.00052342,0.11135,0.10608,1,1
1,GO MITOTIC CELL CYCLE,0.0018173,0.11133,0.10611,1,1
1,GO MITOTIC G2 M TRANSITION CHECKPOINT,0.013139,0.11055,0.1361,1,1
1,GO REGULATION OF FATTY ACID BETA OXIDATION,0.02068,0.11039,0.1415,1,1
1,GO POSITIVE REGULATION OF UBIQUITIN DEPENDENT PROTEIN CATABOLIC PROCESS,0.00081984,0.11018,0.13918,1,1
1,GO ESTABLISHMENT OR MAINTENANCE OF CELL POLARITY,0.0022332,0.11003,0.11418,1,1
1,GO METAPHASE PLATE CONGRESSION,0.047551,0.11002,0.10185,1,1
1,GO ALCOHOL METABOLIC PROCESS,0.023741,0.10979,0.074936,1,1
1,GO IN UTERO EMBRYONIC DEVELOPMENT,0.0030654,0.10974,0.10612,1,1
1,GO NEGATIVE REGULATION OF CHROMOSOME SEGREGATION,0.013139,0.10969,0.13352,1,1
1,GO NEUTROPHIL CHEMOTAXIS,0.050569,0.10966,0.19158,1,1
1,GO PIGMENT GRANULE ORGANIZATION,0.017969,0.10963,0.1815,1,1
1,GO POSITIVE REGULATION OF CALCIUM MEDIATED SIGNALING,0.030383,0.10947,0.10946,1,1
1,GO REGULATION OF CELL CYCLE PROCESS,0.001872,0.10946,0.096889,1,1
1,GO CHROMOSOME CONDENSATION,0.0042883,0.10909,0.1303,1,1
1,GO REGULATION OF PROTEIN MODIFICATION PROCESS,0.0013872,0.10813,0.10278,1,1
1,GO CELLULAR RESPONSE TO DNA DAMAGE STIMULUS,3.1888e-05,0.10751,0.11115,1,1
1,GO LEUKOCYTE CHEMOTAXIS,0.050569,0.10668,0.14072,1,1
1,GO INTRACELLULAR PROTEIN TRANSPORT,2.3418e-05,0.10621,0.10747,1,1
1,GO PROTEIN CONTAINING COMPLEX SUBUNIT ORGANIZATION,0.00013917,0.10604,0.087885,1,1
1,GO REGULATION OF ATP METABOLIC PROCESS,0.029068,0.10572,0.088847,1,1
1,GO REGULATION OF CELLULAR PROTEIN LOCALIZATION,0.0011549,0.10407,0.10852,1,1
1,GO MUSCLE ORGAN DEVELOPMENT,0.0014738,0.1039,0.13318,1,1
1,GO NUCLEAR TRANSCRIBED MRNA CATABOLIC PROCESS DEADENYLATION DEPENDENT DECAY,0.0011549,0.10375,0.11415,1,1
1,GO MIRNA METABOLIC PROCESS,0.0085714,0.10365,0.13932,1,1
1,GO CELL CYCLE G1 S PHASE TRANSITION,0.03245,0.10354,0.097241,1,1
1,GO MITOTIC CELL CYCLE CHECKPOINT,0.011047,0.10287,0.10008,1,1
1,GO NEGATIVE REGULATION OF CELLULAR PROTEIN CATABOLIC PROCESS,0.0007696,0.10224,0.088563,1,1
1,GO PROTEIN TETRAMERIZATION,0.0025817,0.10143,0.11286,1,1
1,GO SNRNA TRANSCRIPTION,0.001986,0.10116,0.10652,1,1
1,GO POSITIVE REGULATION OF ORGANELLE ASSEMBLY,0.012203,0.10063,0.12057,1,1
1,GO CELLULAR LIPID METABOLIC PROCESS,0.024846,0.10034,0.063311,1,1
1,GO NEGATIVE REGULATION OF BINDING,0.025414,0.10024,0.096378,1,1
1,GO NEGATIVE REGULATION OF EPITHELIAL CELL PROLIFERATION,0.0075304,0.10021,0.17427,1,1
1,GO NUCLEOSIDE PHOSPHATE BIOSYNTHETIC PROCESS,0.027188,0.10013,0.078171,1,1
1,GO TUBE FORMATION,0.034637,0.099443,0.11719,1,1
1,GO PEPTIDYL THREONINE MODIFICATION,0.043763,0.09936,0.080727,1,1
1,GO ACTIN POLYMERIZATION OR DEPOLYMERIZATION,0.0066042,0.098738,0.10349,1,1
1,GO NCRNA TRANSCRIPTION,0.022165,0.098729,0.091303,1,1
1,GO NEGATIVE REGULATION OF PROTEIN MODIFICATION PROCESS,0.0097392,0.098269,0.086968,1,1
1,GO REGULATION OF ANATOMICAL STRUCTURE MORPHOGENESIS,0.0028957,0.097498,0.11183,1,1
1,GO CELL CYCLE PROCESS,0.0022332,0.097231,0.08863,1,1
1,GO RAS PROTEIN SIGNAL TRANSDUCTION,0.01282,0.096579,0.10427,1,1
1,GO POSITIVE REGULATION OF CATALYTIC ACTIVITY,0.0012662,0.09651,0.10311,1,1
1,GO REGULATION OF DNA METABOLIC PROCESS,0.00021167,0.096419,0.11056,1,1
1,GO NEGATIVE REGULATION OF CELLULAR CATABOLIC PROCESS,0.00028792,0.096304,0.1058,1,1
1,GO MUSCLE STRUCTURE DEVELOPMENT,0.00084609,0.096052,0.1549,1,1
1,GO IRON ION TRANSPORT,0.004408,0.095384,0.099605,1,1
1,GO NEGATIVE REGULATION OF ANIMAL ORGAN MORPHOGENESIS,0.049546,0.095163,0.18687,1,1
1,GO POSITIVE REGULATION OF ORGANELLE ORGANIZATION,0.0053338,0.095001,0.083618,1,1
1,GO MACROMOLECULE DEACYLATION,0.014486,0.094987,0.075986,1,1
1,GO ANATOMICAL STRUCTURE HOMEOSTASIS,0.012508,0.094728,0.073052,1,1
1,GO REGULATION OF CELL CYCLE,0.0050528,0.094704,0.075655,1,1
1,GO DNA SYNTHESIS INVOLVED IN DNA REPAIR,0.037747,0.094133,0.079676,1,1
1,GO PEPTIDYL AMINO ACID MODIFICATION,0.00065623,0.093972,0.084718,1,1
1,GO G2 DNA DAMAGE CHECKPOINT,0.030383,0.093569,0.10741,1,1
1,GO HEART MORPHOGENESIS,0.018836,0.093436,0.13754,1,1
1,GO NEGATIVE REGULATION OF TRANSPORT,0.0071468,0.093215,0.090313,1,1
1,GO PURINE CONTAINING COMPOUND BIOSYNTHETIC PROCESS,0.036164,0.092595,0.089066,1,1
1,GO PURINE CONTAINING COMPOUND METABOLIC PROCESS,0.016339,0.090739,0.084969,1,1
1,GO CELLULAR RESPONSE TO OXYGEN CONTAINING COMPOUND,0.0030654,0.090629,0.10176,1,1
1,GO LIPID METABOLIC PROCESS,0.013465,0.090616,0.064994,1,1
1,GO NEGATIVE REGULATION OF GROWTH,0.041093,0.090583,0.074688,1,1
1,GO POSITIVE REGULATION OF DNA METABOLIC PROCESS,0.00028792,0.090572,0.10451,1,1
1,GO POSITIVE REGULATION OF INTRACELLULAR PROTEIN TRANSPORT,0.033894,0.090494,0.088325,1,1
1,GO DNA METABOLIC PROCESS,0.00032948,0.090433,0.095284,1,1
1,GO MITOTIC NUCLEAR DIVISION,0.0038387,0.089101,0.10667,1,1
1,GO RESPONSE TO ORGANIC CYCLIC COMPOUND,0.015953,0.088978,0.088637,1,1
1,GO MITOTIC G2 DNA DAMAGE CHECKPOINT,0.041093,0.088072,0.14517,1,1
1,GO GLYCEROPHOSPHOLIPID METABOLIC PROCESS,0.03939,0.088046,0.052093,1,1
1,GO PROTEIN MODIFICATION BY SMALL PROTEIN CONJUGATION,0.00019753,0.087704,0.094827,1,1
1,GO CELLULAR RESPONSE TO HORMONE STIMULUS,0.001986,0.087693,0.10511,1,1
1,GO ANTIMICROBIAL HUMORAL RESPONSE,0.013465,0.087675,0.12865,1,1
1,GO RNA EXPORT FROM NUCLEUS,0.014841,0.08742,0.1188,1,1
1,GO REGULATION OF CELL SHAPE,0.016734,0.087109,0.1521,1,1
1,GO REGULATION OF CENTROSOME CYCLE,0.033166,0.087053,0.095422,1,1
1,GO REGULATION OF MUSCLE CELL DIFFERENTIATION,0.029719,0.08636,0.088331,1,1
1,GO CELLULAR PROTEIN CONTAINING COMPLEX ASSEMBLY,0.00353,0.086264,0.064463,1,1
1,GO CELL CYCLE,0.0034322,0.085642,0.074152,1,1
1,GO PROTEIN MODIFICATION BY SMALL PROTEIN CONJUGATION OR REMOVAL,0.00014418,0.085186,0.095811,1,1
1,GO CARBOHYDRATE METABOLIC PROCESS,0.004408,0.084723,0.075421,1,1
1,GO REGULATION OF ACTIN FILAMENT BASED PROCESS,0.00090094,0.084343,0.14786,1,1
1,GO POSITIVE REGULATION OF HYDROLASE ACTIVITY,0.0042883,0.084109,0.10169,1,1
1,GO NEGATIVE REGULATION OF PROTEASOMAL UBIQUITIN DEPENDENT PROTEIN CATABOLIC PROCESS,0.029068,0.083987,0.081845,1,1
1,GO PROTEIN CONTAINING COMPLEX DISASSEMBLY,0.011326,0.083256,0.071316,1,1
1,GO NEGATIVE REGULATION OF PROTEASOMAL PROTEIN CATABOLIC PROCESS,0.0075304,0.082353,0.075734,1,1
1,GO ANIMAL ORGAN MORPHOGENESIS,0.023205,0.081517,0.099039,1,1
1,GO RESPONSE TO RADIATION,0.0047853,0.081251,0.082213,1,1
1,GO ORGANOPHOSPHATE METABOLIC PROCESS,0.012203,0.079508,0.06525,1,1
1,GO REGULATION OF INTRINSIC APOPTOTIC SIGNALING PATHWAY,0.033166,0.079488,0.082786,1,1
1,GO SPINDLE ASSEMBLY,0.010245,0.078785,0.089603,1,1
1,GO POSITIVE REGULATION OF SIGNALING,0.02843,0.078446,0.069587,1,1
1,GO TRANSMEMBRANE RECEPTOR PROTEIN TYROSINE KINASE SIGNALING PATHWAY,0.0064317,0.078248,0.11349,1,1
1,GO CELLULAR MACROMOLECULE LOCALIZATION,0.00037661,0.077573,0.078478,1,1
1,GO REGULATION OF MACROAUTOPHAGY,0.00079435,0.07732,0.13055,1,1
1,GO DNA TEMPLATED TRANSCRIPTION TERMINATION,0.020205,0.076802,0.11526,1,1
1,GO REGULATION OF INTRACELLULAR PROTEIN TRANSPORT,0.02843,0.076661,0.085266,1,1
1,GO MITOCHONDRION ORGANIZATION,0.0017123,0.076636,0.082978,1,1
1,GO RESPONSE TO TEMPERATURE STIMULUS,0.033166,0.074179,0.081529,1,1
1,GO VITAMIN METABOLIC PROCESS,0.026586,0.073716,0.10658,1,1
1,GO INTRACELLULAR TRANSPORT,0.00049035,0.072534,0.081128,1,1
1,GO RESPONSE TO OXYGEN CONTAINING COMPOUND,0.03939,0.071957,0.073794,1,1
1,GO CELLULAR RESPONSE TO LIGHT STIMULUS,0.010245,0.070289,0.10369,1,1
1,GO TRANSCRIPTION BY RNA POLYMERASE III,0.018398,0.070249,0.07561,1,1
1,GO DNA GEOMETRIC CHANGE,0.055956,0.069823,0.10365,1,1
1,GO POSITIVE REGULATION OF MOLECULAR FUNCTION,0.0025083,0.069076,0.089662,1,1
1,GO REGULATION OF ORGANELLE ORGANIZATION,0.019739,0.068697,0.051409,1,1
1,GO MRNA EXPORT FROM NUCLEUS,0.037747,0.067912,0.089757,1,1
1,GO NEGATIVE REGULATION OF TRANSFERASE ACTIVITY,0.04854,0.064838,0.073677,1,1
1,GO DOUBLE STRAND BREAK REPAIR,0.012508,0.063461,0.09116,1,1
1,GO DNA REPAIR,0.0083534,0.062813,0.078005,1,1
1,GO DNA RECOMBINATION,0.02843,0.060878,0.088485,1,1
1,GO RESPONSE TO ENDOGENOUS STIMULUS,0.012203,0.060807,0.089537,1,1
1,GO CELL CYCLE CHECKPOINT,0.049546,0.059245,0.065995,1,1
1,GO REGULATION OF CYTOSKELETON ORGANIZATION,0.019283,0.05775,0.083183,1,1
1,GO DNA MODIFICATION,0.042857,0.054972,0.070704,1,1
1,GO DNA CATABOLIC PROCESS,0.037747,0.054712,0.060438,1,1
1,GO POSITIVE REGULATION OF CELLULAR BIOSYNTHETIC PROCESS,0.040234,0.052268,0.055236,1,1
1,GO DNA CATABOLIC PROCESS ENDONUCLEOLYTIC,0.05161,0.049955,0.065985,1,1
1,GO CHROMOSOME SEGREGATION,0.054842,0.048147,0.078296,1,1
2,GO ANTIGEN PROCESSING AND PRESENTATION OF ENDOGENOUS PEPTIDE ANTIGEN,0.00081984,1.5054,1.0616,1,1
2,GO ANTIGEN PROCESSING AND PRESENTATION OF ENDOGENOUS ANTIGEN,0.0007696,1.2856,0.86473,1,1
2,GO ETHER BIOSYNTHETIC PROCESS,9.8628e-07,1.2188,0.94324,1,1
2,GO DETOXIFICATION OF INORGANIC COMPOUND,0.0056288,1.0213,0.84327,1,1
2,GO ETHANOL OXIDATION,7.2111e-07,0.97262,0.88425,1,1
2,GO NEGATIVE REGULATION OF MESENCHYMAL CELL APOPTOTIC PROCESS,0.00013917,0.96721,0.7511,1,1
2,GO NEGATIVE REGULATION OF NATURAL KILLER CELL MEDIATED IMMUNITY,0.009256,0.88518,0.54829,1,1
2,GO ANTIGEN PROCESSING AND PRESENTATION VIA MHC CLASS IB,0.00067758,0.87183,0.65941,1,1
2,GO BIOLOGICAL PHASE,1.2454e-05,0.827,0.71904,1,1
2,GO MESENCHYMAL CELL APOPTOTIC PROCESS,6.5149e-05,0.82445,0.72374,1,1
2,GO NEGATIVE REGULATION BY HOST OF VIRAL TRANSCRIPTION,2.9532e-05,0.81815,0.681,1,1
2,GO REGULATION OF GLUCOCORTICOID METABOLIC PROCESS,5.4977e-07,0.8037,0.79231,1,1
2,GO NEGATIVE REGULATION OF INTERLEUKIN 8 PRODUCTION,4.0073e-05,0.799,0.58429,1,1
2,GO POSITIVE REGULATION OF T CELL MEDIATED CYTOTOXICITY,0.00063551,0.78649,0.52802,1,1
2,GO RESPONSE TO INTERLEUKIN 18,1.104e-05,0.78371,0.80785,1,1
2,GO POSITIVE REGULATION OF T HELPER 1 TYPE IMMUNE RESPONSE,2.7578e-07,0.77703,0.68854,1,1
2,GO NEGATIVE REGULATION OF SKELETAL MUSCLE TISSUE DEVELOPMENT,0.00074557,0.75365,0.60603,1,1
2,GO REGULATION OF SYSTEMIC ARTERIAL BLOOD PRESSURE BY RENIN ANGIOTENSIN,1.0184e-05,0.74882,0.63449,1,1
2,GO NEGATIVE REGULATION OF LEUKOCYTE MEDIATED CYTOTOXICITY,0.011612,0.74167,0.46203,1,1
2,GO CELLULAR RESPONSE TO COPPER ION,0.0081404,0.72282,0.50375,1,1
2,GO POSITIVE REGULATION OF KERATINOCYTE DIFFERENTIATION,5.7413e-06,0.72072,0.66202,1,1
2,GO REGULATION OF T HELPER 2 CELL DIFFERENTIATION,0.0010206,0.71623,0.53449,1,1
2,GO PROSTANOID BIOSYNTHETIC PROCESS,1.2308e-06,0.70331,0.619,1,1
2,GO EPITHELIAL CELL PROLIFERATION INVOLVED IN PROSTATE GLAND DEVELOPMENT,8.4205e-05,0.70111,0.6581,1,1
2,GO REGULATION OF T CELL MEDIATED CYTOTOXICITY,0.00047456,0.70096,0.48803,1,1
2,GO NEGATIVE REGULATION OF CELL KILLING,0.0090226,0.69478,0.44608,1,1
2,GO T CELL MEDIATED CYTOTOXICITY,8.1192e-05,0.69382,0.53793,1,1
2,GO CELLULAR RESPONSE TO ZINC ION,0.015203,0.69096,0.52853,1,1
2,GO POSITIVE REGULATION OF T HELPER CELL DIFFERENTIATION,4.6623e-06,0.68144,0.51433,1,1
2,GO REGULATION OF T HELPER 1 TYPE IMMUNE RESPONSE,7.5427e-07,0.67989,0.60528,1,1
2,GO T HELPER 1 CELL DIFFERENTIATION,5.508e-06,0.67495,0.6345,1,1
2,GO REGULATION OF SYSTEMIC ARTERIAL BLOOD PRESSURE BY CIRCULATORY RENIN ANGIOTENSIN,5.2837e-06,0.67163,0.65817,1,1
2,GO PHOSPHATIDYLINOSITOL ACYL CHAIN REMODELING,3.9926e-07,0.67136,0.52705,1,1
2,GO MUCUS SECRETION,0.00026903,0.66447,0.64927,1,1
2,GO BARBED END ACTIN FILAMENT CAPPING,6.4994e-06,0.66368,0.58114,1,1
2,GO REGULATION OF APOPTOTIC PROCESS INVOLVED IN DEVELOPMENT,0.00012074,0.66273,0.56182,1,1
2,GO REGULATION OF UNSATURATED FATTY ACID BIOSYNTHETIC PROCESS,7.6603e-06,0.66265,0.61104,1,1
2,GO POSITIVE REGULATION OF CELL MATURATION,0.00010092,0.66237,0.51745,1,1
2,GO ACTIN FILAMENT SEVERING,0.00024286,0.65998,0.5153,1,1
2,GO TRAIL ACTIVATED APOPTOTIC SIGNALING PATHWAY,0.0011199,0.65048,0.46681,1,1
2,GO INFLAMMATORY RESPONSE TO WOUNDING,7.2754e-05,0.64618,0.57749,1,1
2,GO NEGATIVE REGULATION OF HIPPO SIGNALING,0.00052342,0.63924,0.58472,1,1
2,GO ANTIGEN PROCESSING AND PRESENTATION OF PEPTIDE ANTIGEN VIA MHC CLASS I,0.00010845,0.62532,0.46634,1,1
2,GO IMMUNE RESPONSE TO TUMOR CELL,9.7346e-05,0.62061,0.50242,1,1
2,GO BRANCHING INVOLVED IN LABYRINTHINE LAYER MORPHOGENESIS,6.0504e-05,0.6181,0.70213,1,1
2,GO MYOBLAST MIGRATION,0.0069616,0.61589,0.506,1,1
2,GO POSITIVE REGULATION OF MACROPHAGE ACTIVATION,2.8077e-06,0.61141,0.57587,1,1
2,GO CELLULAR RESPONSE TO ANTIBIOTIC,2.3975e-07,0.6102,0.58745,1,1
2,GO NEGATIVE REGULATION OF T HELPER CELL DIFFERENTIATION,0.00030804,0.60615,0.41645,1,1
2,GO T HELPER 2 CELL DIFFERENTIATION,0.00059588,0.59988,0.46816,1,1
2,GO CYCLOOXYGENASE PATHWAY,0.0041716,0.59711,0.48998,1,1
2,GO REGULATION OF VENTRICULAR CARDIAC MUSCLE CELL ACTION POTENTIAL,1.8521e-05,0.59555,0.58604,1,1
2,GO NEGATIVE REGULATION OF VIRAL ENTRY INTO HOST CELL,0.0022992,0.59403,0.46948,1,1
2,GO POSITIVE REGULATION OF SYSTEMIC ARTERIAL BLOOD PRESSURE,5.4121e-05,0.59384,0.57368,1,1
2,GO LABYRINTHINE LAYER MORPHOGENESIS,0.00014935,0.58485,0.53377,1,1
2,GO ETHER METABOLIC PROCESS,1.104e-05,0.58474,0.49527,1,1
2,GO NEGATIVE REGULATION OF CD4 POSITIVE ALPHA BETA T CELL DIFFERENTIATION,0.00012964,0.58454,0.44686,1,1
2,GO HAIR FOLLICLE MATURATION,2.8077e-06,0.58429,0.52615,1,1
2,GO PROSTATE GLAND GROWTH,1.6455e-05,0.58277,0.62272,1,1
2,GO RETINA VASCULATURE MORPHOGENESIS IN CAMERA TYPE EYE,0.040234,0.58029,0.36474,1,1
2,GO ANTIGEN PROCESSING AND PRESENTATION OF EXOGENOUS PEPTIDE ANTIGEN VIA MHC CLASS I,0.00022676,0.57924,0.45547,1,1
2,GO PROSTANOID METABOLIC PROCESS,4.4712e-06,0.57692,0.52271,1,1
2,GO POSITIVE REGULATION OF INTERLEUKIN 2 PRODUCTION,1.5331e-06,0.5727,0.44674,1,1
2,GO REGULATION OF EXTRACELLULAR MATRIX ASSEMBLY,0.00030804,0.56603,0.45909,1,1
2,GO POSITIVE REGULATION OF EXTRACELLULAR MATRIX ASSEMBLY,0.0001547,0.5639,0.48257,1,1
2,GO REGULATION OF STEROID HORMONE BIOSYNTHETIC PROCESS,0.00026003,0.56331,0.43826,1,1
2,GO RESPONSE TO INTERFERON ALPHA,0.013139,0.56251,0.28267,1,1
2,GO MONOCYTE CHEMOTACTIC PROTEIN 1 PRODUCTION,0.0041716,0.5597,0.40562,1,1
2,GO EPITHELIAL CELL DIFFERENTIATION INVOLVED IN PROSTATE GLAND DEVELOPMENT,0.0071468,0.54879,0.39377,1,1
2,GO OTIC VESICLE DEVELOPMENT,5.6174e-05,0.54762,0.49438,1,1
2,GO CHEMOKINE C X C MOTIF LIGAND 2 PRODUCTION,0.00014418,0.54438,0.42808,1,1
2,GO LYSINE METABOLIC PROCESS,0.00021909,0.54427,0.52111,1,1
2,GO PSEUDOPODIUM ORGANIZATION,0.00018427,0.54161,0.49314,1,1
2,GO LONG CHAIN FATTY ACID BIOSYNTHETIC PROCESS,1.0311e-06,0.54104,0.51568,1,1
2,GO UNSATURATED FATTY ACID BIOSYNTHETIC PROCESS,6.5896e-07,0.54029,0.50175,1,1
2,GO REGULATION OF ASPARTIC TYPE PEPTIDASE ACTIVITY,0.00037661,0.53478,0.51701,1,1
2,GO THROMBIN ACTIVATED RECEPTOR SIGNALING PATHWAY,0.00021167,0.53459,0.44668,1,1
2,GO POSITIVE REGULATION OF MEMBRANE PROTEIN ECTODOMAIN PROTEOLYSIS,0.001662,0.53424,0.36439,1,1
2,GO NEGATIVE REGULATION OF EXTRACELLULAR MATRIX ORGANIZATION,0.0032441,0.53143,0.34126,1,1
2,GO NEGATIVE REGULATION OF VIRAL TRANSCRIPTION,4.2876e-06,0.53083,0.49729,1,1
2,GO T HELPER 1 TYPE IMMUNE RESPONSE,1.0779e-06,0.52289,0.49522,1,1
2,GO REGULATION OF CELLULAR RESPONSE TO OSMOTIC STRESS,1.6455e-05,0.51953,0.5755,1,1
2,GO ZINC ION HOMEOSTASIS,0.0071468,0.51385,0.35525,1,1
2,GO PHOSPHATIDYLCHOLINE CATABOLIC PROCESS,0.00027832,0.51167,0.42703,1,1
2,GO NEGATIVE REGULATION OF B CELL PROLIFERATION,1.6015e-06,0.50989,0.45418,1,1
2,GO DENDRITIC CELL CYTOKINE PRODUCTION,0.00081984,0.5091,0.35871,1,1
2,GO HEPATOCYTE DIFFERENTIATION,0.00026903,0.50864,0.47922,1,1
2,GO NEGATIVE REGULATION OF LIPASE ACTIVITY,0.00022676,0.5033,0.42378,1,1
2,GO REGULATION OF GASTRIC ACID SECRETION,1.6455e-05,0.50273,0.48734,1,1
2,GO TOLL LIKE RECEPTOR 2 SIGNALING PATHWAY,9.389e-05,0.50121,0.5564,1,1
2,GO PROTEIN DNA COMPLEX DISASSEMBLY,0.00034072,0.49779,0.36491,1,1
2,GO GLYCEROL ETHER METABOLIC PROCESS,8.3127e-06,0.49748,0.45719,1,1
2,GO NEGATIVE REGULATION OF EPIDERMAL CELL DIFFERENTIATION,0.0015189,0.48719,0.49569,1,1
2,GO MATURE B CELL DIFFERENTIATION INVOLVED IN IMMUNE RESPONSE,0.00098941,0.48643,0.37082,1,1
2,GO NEGATIVE REGULATION OF CHEMOKINE PRODUCTION,1.9263e-05,0.48444,0.46857,1,1
2,GO REGULATION OF RESPONSE TO TUMOR CELL,8.1192e-05,0.48135,0.36888,1,1
2,GO BUNDLE OF HIS CELL TO PURKINJE MYOCYTE COMMUNICATION,0.00019079,0.48059,0.48747,1,1
2,GO POSITIVE REGULATION OF CD4 POSITIVE ALPHA BETA T CELL ACTIVATION,2.8077e-06,0.47901,0.42664,1,1
2,GO EMBRYONIC SKELETAL JOINT MORPHOGENESIS,0.0040578,0.47685,0.4666,1,1
2,GO BRANCH ELONGATION OF AN EPITHELIUM,0.0060989,0.47543,0.42012,1,1
2,GO REGULATION OF PHOSPHOLIPASE A2 ACTIVITY,0.00018427,0.47213,0.54063,1,1
2,GO MUSCLE ATROPHY,0.0037331,0.46832,0.37007,1,1
2,GO POSITIVE REGULATION OF PROTEIN IMPORT,1.7806e-05,0.46809,0.41503,1,1
2,GO BENZENE CONTAINING COMPOUND METABOLIC PROCESS,8.4205e-05,0.46792,0.40082,1,1
2,GO NEURAL CREST FORMATION,1.349e-05,0.46776,0.42292,1,1
2,GO NEGATIVE REGULATION OF ALPHA BETA T CELL DIFFERENTIATION,0.00026003,0.46656,0.37616,1,1
2,GO REGULATION OF HIPPO SIGNALING,0.043763,0.46427,0.22669,1,1
2,GO TOLERANCE INDUCTION,0.0060989,0.46153,0.34028,1,1
2,GO CARDIOLIPIN METABOLIC PROCESS,0.00012964,0.46114,0.36601,1,1
2,GO REGULATION OF CELL PROLIFERATION INVOLVED IN KIDNEY DEVELOPMENT,0.0019282,0.46104,0.38707,1,1
2,GO REGULATION OF T HELPER CELL DIFFERENTIATION,2.7343e-05,0.45356,0.35724,1,1
2,GO POSITIVE REGULATION OF T CELL MEDIATED IMMUNITY,0.00037661,0.45266,0.33998,1,1
2,GO REGULATION OF KERATINOCYTE DIFFERENTIATION,0.00018427,0.45158,0.44046,1,1
2,GO MICROVILLUS ASSEMBLY,0.0001547,0.4514,0.42248,1,1
2,GO RESPONSE TO INTERFERON BETA,0.016734,0.4508,0.29331,1,1
2,GO IMMUNOLOGICAL SYNAPSE FORMATION,0.00098941,0.45013,0.38732,1,1
2,GO REGULATION OF MONOCYTE DIFFERENTIATION,0.00027832,0.44826,0.39212,1,1
2,GO NEPHRON TUBULE FORMATION,0.0028957,0.44818,0.31059,1,1
2,GO RESPONSE TO COPPER ION,0.018398,0.44757,0.32373,1,1
2,GO INOSITOL TRISPHOSPHATE METABOLIC PROCESS,1.2962e-05,0.44716,0.43722,1,1
2,GO ETHANOL METABOLIC PROCESS,4.2876e-06,0.44613,0.52245,1,1
2,GO REGULATION OF PLASMINOGEN ACTIVATION,0.05161,0.44602,0.32164,1,1
2,GO LEUKOTRIENE BIOSYNTHETIC PROCESS,0.00017796,0.4453,0.42189,1,1
2,GO GLUTATHIONE DERIVATIVE METABOLIC PROCESS,0.00037661,0.44499,0.42706,1,1
2,GO POSITIVE REGULATION OF CD4 POSITIVE ALPHA BETA T CELL DIFFERENTIATION,5.2139e-05,0.44416,0.39271,1,1
2,GO REGULATION OF TYPE 2 IMMUNE RESPONSE,0.00024286,0.44394,0.31663,1,1
2,GO ANTIGEN PROCESSING AND PRESENTATION OF PEPTIDE ANTIGEN,0.00017796,0.4423,0.29176,1,1
2,GO REGULATION OF PSEUDOPODIUM ASSEMBLY,0.0006154,0.44006,0.40278,1,1
2,GO OTIC VESICLE MORPHOGENESIS,0.00037661,0.43886,0.42153,1,1
2,GO REGULATION OF GRANULOCYTE DIFFERENTIATION,0.0022332,0.43843,0.4151,1,1
2,GO ICOSANOID BIOSYNTHETIC PROCESS,4.2876e-06,0.4377,0.43006,1,1
2,GO REGULATION OF CARDIAC MUSCLE CELL ACTION POTENTIAL,1.104e-05,0.43697,0.42542,1,1
2,GO DENDRITIC CELL MIGRATION,1.5201e-05,0.43567,0.39949,1,1
2,GO LIPID DROPLET FORMATION,0.014138,0.43462,0.36832,1,1
2,GO LINOLEIC ACID METABOLIC PROCESS,8.1192e-05,0.43392,0.49982,1,1
2,GO ENTRY OF BACTERIUM INTO HOST CELL,0.0018173,0.43185,0.41357,1,1
2,GO EPITHELIAL CELL CELL ADHESION,0.0001165,0.43141,0.52034,1,1
2,GO SKELETAL MUSCLE TISSUE REGENERATION,1.2454e-05,0.43137,0.36932,1,1
2,GO CYTIDINE TO URIDINE EDITING,0.024288,0.43033,0.38887,1,1
2,GO REGULATION OF NATURAL KILLER CELL MEDIATED IMMUNITY,0.0079323,0.42715,0.27452,1,1
2,GO PHOSPHATIDYLGLYCEROL ACYL CHAIN REMODELING,1.0604e-05,0.42388,0.36831,1,1
2,GO APOPTOTIC PROCESS INVOLVED IN MORPHOGENESIS,2.0833e-05,0.42156,0.43825,1,1
2,GO REGULATION OF GLOMERULAR FILTRATION,0.017969,0.42068,0.34652,1,1
2,GO POSITIVE REGULATION OF SPROUTING ANGIOGENESIS,0.001228,0.42048,0.29311,1,1
2,GO POSITIVE REGULATION OF LAMELLIPODIUM ASSEMBLY,2.4692e-06,0.41888,0.40345,1,1
2,GO PHOSPHATIDYLSERINE ACYL CHAIN REMODELING,3.9418e-06,0.4178,0.3897,1,1
2,GO POSITIVE REGULATION OF CELL MIGRATION INVOLVED IN SPROUTING ANGIOGENESIS,0.0046564,0.4166,0.37787,1,1
2,GO EMBRYONIC PLACENTA MORPHOGENESIS,0.0019282,0.41321,0.39375,1,1
2,GO TETRAPYRROLE BIOSYNTHETIC PROCESS,2.7343e-05,0.41126,0.32383,1,1
2,GO POSITIVE REGULATION OF INTERFERON ALPHA PRODUCTION,4.0073e-05,0.41095,0.36906,1,1
2,GO MONONUCLEAR CELL DIFFERENTIATION,1.2962e-05,0.4109,0.36776,1,1
2,GO CELLULAR RESPONSE TO CADMIUM ION,0.0053338,0.40971,0.34198,1,1
2,GO INFLAMMATORY CELL APOPTOTIC PROCESS,0.0020453,0.40915,0.33678,1,1
2,GO RETINAL METABOLIC PROCESS,0.030383,0.40901,0.28392,1,1
2,GO POSITIVE REGULATION OF MONOCYTE DIFFERENTIATION,0.0024367,0.40856,0.31171,1,1
2,GO PSEUDOURIDINE SYNTHESIS,0.00016595,0.40779,0.33981,1,1
2,GO LEFT RIGHT AXIS SPECIFICATION,0.00014935,0.40752,0.45601,1,1
2,GO TRANSFORMING GROWTH FACTOR BETA1 PRODUCTION,0.00016023,0.40692,0.40904,1,1
2,GO POSITIVE REGULATION OF GONAD DEVELOPMENT,0.0064317,0.40642,0.29103,1,1
2,GO CELLULAR HYPEROSMOTIC RESPONSE,0.022165,0.40594,0.31691,1,1
2,GO POSITIVE REGULATION OF PRODUCTION OF MIRNAS INVOLVED IN GENE SILENCING BY MIRNA,0.019739,0.40544,0.23868,1,1
2,GO PROTEASOMAL UBIQUITIN INDEPENDENT PROTEIN CATABOLIC PROCESS,0.00040247,0.40539,0.3318,1,1
2,GO I KAPPAB PHOSPHORYLATION,0.00027832,0.40469,0.26668,1,1
2,GO RESPONSE TO CADMIUM ION,0.00054072,0.40414,0.31455,1,1
2,GO REGULATION OF T CELL MEDIATED IMMUNITY,0.0006154,0.40363,0.29582,1,1
2,GO NEGATIVE REGULATION OF T CELL DIFFERENTIATION,0.00054072,0.40256,0.26992,1,1
2,GO REGULATION OF PROTEIN IMPORT,9.389e-05,0.40199,0.30224,1,1
2,GO REGULATION OF ACTIN CYTOSKELETON REORGANIZATION,0.00010462,0.40029,0.31953,1,1
2,GO NEGATIVE REGULATION OF ALCOHOL BIOSYNTHETIC PROCESS,0.00025131,0.39978,0.35106,1,1
2,GO POSITIVE REGULATION OF G1 S TRANSITION OF MITOTIC CELL CYCLE,3.1904e-06,0.39783,0.3819,1,1
2,GO ACTIVATION OF NF KAPPAB INDUCING KINASE ACTIVITY,4.8379e-05,0.39768,0.35944,1,1
2,GO ECTODERMAL PLACODE DEVELOPMENT,0.013798,0.39751,0.30458,1,1
2,GO POSITIVE REGULATION OF ADAPTIVE IMMUNE RESPONSE,0.00012512,0.39577,0.30934,1,1
2,GO ENDONUCLEOLYTIC CLEAVAGE INVOLVED IN RRNA PROCESSING,0.0010528,0.39496,0.34653,1,1
2,GO POSITIVE REGULATION OF EPIDERMIS DEVELOPMENT,0.0024367,0.39345,0.3306,1,1
2,GO NEGATIVE REGULATION OF NECROTIC CELL DEATH,0.00063551,0.39103,0.35974,1,1
2,GO POSITIVE REGULATION OF CYTOPLASMIC TRANSLATION,0.00092958,0.39073,0.3414,1,1
2,GO PORE COMPLEX ASSEMBLY,4.2876e-06,0.39017,0.38489,1,1
2,GO NEGATIVE REGULATION OF T CELL RECEPTOR SIGNALING PATHWAY,9.0551e-05,0.38945,0.37701,1,1
2,GO REGULATION OF SYSTEMIC ARTERIAL BLOOD PRESSURE BY HORMONE,3.1888e-05,0.38885,0.39012,1,1
2,GO NEUTROPHIL HOMEOSTASIS,0.0069616,0.38851,0.35244,1,1
2,GO BLOOD VESSEL ENDOTHELIAL CELL PROLIFERATION INVOLVED IN SPROUTING ANGIOGENESIS,0.024288,0.38821,0.24284,1,1
2,GO POSITIVE REGULATION OF MESONEPHROS DEVELOPMENT,0.031748,0.38807,0.23201,1,1
2,GO POSITIVE REGULATION OF LAMELLIPODIUM ORGANIZATION,1.4963e-07,0.38804,0.41069,1,1
2,GO REGULATION OF MESONEPHROS DEVELOPMENT,0.0029794,0.3878,0.29031,1,1
2,GO POSITIVE REGULATION OF CYSTEINE TYPE ENDOPEPTIDASE ACTIVITY INVOLVED IN APOPTOTIC SIGNALING PATHWAY,0.024288,0.38674,0.25958,1,1
2,GO NEUTRAL LIPID BIOSYNTHETIC PROCESS,1.2962e-05,0.38659,0.34151,1,1
2,GO REGULATION OF FC RECEPTOR MEDIATED STIMULATORY SIGNALING PATHWAY,0.00059588,0.38625,0.36174,1,1
2,GO HOMOCYSTEINE METABOLIC PROCESS,0.012508,0.38383,0.2473,1,1
2,GO HEME METABOLIC PROCESS,0.00025131,0.38291,0.33374,1,1
2,GO REGULATION OF RESPONSE TO OSMOTIC STRESS,4.6597e-05,0.3795,0.46054,1,1
2,GO OXYGEN TRANSPORT,0.052669,0.37796,0.35927,1,1
2,GO POSITIVE REGULATION OF ESTABLISHMENT OF PROTEIN LOCALIZATION TO TELOMERE,0.0017123,0.3771,0.2987,1,1
2,GO T CELL MEDIATED IMMUNITY,0.00027832,0.37695,0.30853,1,1
2,GO LIMB BUD FORMATION,0.0041716,0.37637,0.44951,1,1
2,GO PHOSPHATIDYLETHANOLAMINE ACYL CHAIN REMODELING,3.6228e-06,0.37556,0.35611,1,1
2,GO RESPONSE TO TYPE I INTERFERON,0.015574,0.37514,0.24917,1,1
2,GO POSITIVE REGULATION OF CELL KILLING,0.001986,0.37456,0.25527,1,1
2,GO T CELL ACTIVATION INVOLVED IN IMMUNE RESPONSE,3.5759e-05,0.37397,0.32954,1,1
