3,GO CYTOPLASMIC SEQUESTERING OF TRANSCRIPTION FACTOR,0.041093,0.16341,0.1333,1,1
3,GO MITOCHONDRIAL GENE EXPRESSION,0.0046564,0.16254,0.19159,1,1
3,GO REGULATION OF RECEPTOR INTERNALIZATION,0.014486,0.16219,0.099699,1,1
3,GO NEGATIVE REGULATION OF VASCULAR ENDOTHELIAL GROWTH FACTOR RECEPTOR SIGNALING PATHWAY,0.010506,0.16121,0.17084,1,1
3,GO IRES DEPENDENT VIRAL TRANSLATIONAL INITIATION,0.011047,0.1597,0.20058,1,1
3,GO INORGANIC ION IMPORT ACROSS PLASMA MEMBRANE,0.0029794,0.15835,0.14723,1,1
3,GO NUCLEAR PORE ORGANIZATION,0.041093,0.15717,0.11028,1,1
3,GO MITOTIC DNA REPLICATION CHECKPOINT,0.010506,0.15666,0.14296,1,1
3,GO NEGATIVE REGULATION OF PEPTIDE HORMONE SECRETION,0.029068,0.15409,0.1588,1,1
3,GO TELOMERE MAINTENANCE VIA RECOMBINATION,0.012203,0.15294,0.16955,1,1
3,GO PROTEIN DEMETHYLATION,0.037747,0.15217,0.11321,1,1
3,GO MRNA METHYLATION,0.01282,0.15177,0.19339,1,1
3,GO RESPONSE TO OXYGEN GLUCOSE DEPRIVATION,0.011326,0.15121,0.21752,1,1
3,GO RNA SURVEILLANCE,0.033894,0.1503,0.12882,1,1
3,GO REGULATION OF ENDOCYTIC RECYCLING,0.02268,0.14991,0.1987,1,1
3,GO TRANSCRIPTION ELONGATION FROM RNA POLYMERASE I PROMOTER,0.014486,0.14824,0.12566,1,1
3,GO NCRNA METABOLIC PROCESS,0.0029794,0.14765,0.15371,1,1
3,GO REGULATION OF NUCLEOTIDE BIOSYNTHETIC PROCESS,0.041093,0.1475,0.12282,1,1
3,GO CEREBELLAR CORTEX DEVELOPMENT,0.0046564,0.14683,0.19829,1,1
3,GO REGULATION OF TRANSLATIONAL INITIATION,0.00069957,0.1464,0.12066,1,1
3,GO POSITIVE REGULATION OF DNA TEMPLATED TRANSCRIPTION ELONGATION,0.015574,0.14537,0.10928,1,1
3,GO PURINE NUCLEOSIDE MONOPHOSPHATE METABOLIC PROCESS,0.047551,0.14515,0.10055,1,1
3,GO PROTEIN TARGETING,0.007729,0.14409,0.10904,1,1
3,GO TRICARBOXYLIC ACID CYCLE,0.0064317,0.14323,0.14307,1,1
3,GO TELOMERE MAINTENANCE IN RESPONSE TO DNA DAMAGE,0.00026003,0.14301,0.15939,1,1
3,GO POSITIVE REGULATION OF MRNA SPLICING VIA SPLICEOSOME,7.013e-05,0.14268,0.18832,1,1
3,GO PEPTIDE BIOSYNTHETIC PROCESS,0.0054795,0.14261,0.13749,1,1
3,GO PROTEIN DENEDDYLATION,0.033166,0.14066,0.13452,1,1
3,GO CYTOPLASMIC SEQUESTERING OF PROTEIN,0.0053338,0.13936,0.16664,1,1
3,GO PROTEIN HETEROOLIGOMERIZATION,0.0020453,0.13918,0.15842,1,1
3,GO RNA CATABOLIC PROCESS,0.012203,0.13892,0.11055,1,1
3,GO DNA REPLICATION INITIATION,0.0018173,0.13857,0.14311,1,1
3,GO POSITIVE REGULATION OF CARDIOCYTE DIFFERENTIATION,0.036164,0.13815,0.12703,1,1
3,GO REGULATION OF MITOCHONDRIAL GENE EXPRESSION,0.00047456,0.13806,0.24592,1,1
3,GO REPLICATION FORK PROCESSING,0.0040578,0.13801,0.13472,1,1
3,GO REGULATION OF MITOCHONDRIAL FISSION,0.03245,0.13664,0.1133,1,1
3,GO TRANSCRIPTION PREINITIATION COMPLEX ASSEMBLY,0.0042883,0.13658,0.11355,1,1
3,GO REGULATION OF TRANSCRIPTION INITIATION FROM RNA POLYMERASE II PROMOTER,0.0011549,0.13652,0.13207,1,1
3,GO REGULATION OF MRNA POLYADENYLATION,0.0014738,0.13645,0.12815,1,1
3,GO CELLULAR RESPONSE TO GONADOTROPIN STIMULUS,0.043763,0.13544,0.12947,1,1
3,GO PROTEIN LOCALIZATION TO CHROMOSOME TELOMERIC REGION,0.0026572,0.13383,0.1528,1,1
3,GO ARTERY DEVELOPMENT,0.049546,0.13343,0.062324,1,1
3,GO REGULATION OF CELL CYCLE ARREST,0.011047,0.13304,0.088991,1,1
3,GO RNA METHYLATION,0.0039469,0.1329,0.13947,1,1
3,GO DNA REPLICATION CHECKPOINT,0.0041716,0.13282,0.1289,1,1
3,GO REGULATION OF CALCIUM ION DEPENDENT EXOCYTOSIS,0.01282,0.13277,0.23479,1,1
3,GO TRANSCRIPTION INITIATION FROM RNA POLYMERASE I PROMOTER,0.004408,0.13276,0.139,1,1
3,GO LIMBIC SYSTEM DEVELOPMENT,0.04854,0.13163,0.11612,1,1
3,GO REGULATION OF DNA TEMPLATED TRANSCRIPTION INITIATION,0.0016129,0.1315,0.11326,1,1
3,GO AMINO ACID TRANSPORT,0.00016595,0.13054,0.1682,1,1
3,GO POSITIVE REGULATION OF TRANSLATION,0.0090226,0.13023,0.11092,1,1
3,GO CELLULAR PROTEIN COMPLEX DISASSEMBLY,0.0010206,0.12938,0.11393,1,1
3,GO RESPONSE TO AMPHETAMINE,0.045624,0.1275,0.13089,1,1
3,GO REGULATION OF TRANSCRIPTION OF NUCLEOLAR LARGE RRNA BY RNA POLYMERASE I,0.01282,0.12653,0.14995,1,1
3,GO ESTABLISHMENT OF PROTEIN LOCALIZATION TO MEMBRANE,0.0056288,0.12485,0.12084,1,1
3,GO TRNA TRANSPORT,0.007729,0.12413,0.1308,1,1
3,GO NUCLEOTIDE PHOSPHORYLATION,0.0047853,0.12371,0.12014,1,1
3,GO ATP METABOLIC PROCESS,0.0024367,0.12365,0.10989,1,1
3,GO NEGATIVE REGULATION OF CALCIUM ION TRANSPORT,0.02268,0.12358,0.10602,1,1
3,GO REGULATION OF MRNA PROCESSING,0.001228,0.12321,0.10397,1,1
3,GO BASE EXCISION REPAIR,0.017549,0.12253,0.087776,1,1
3,GO MATING,0.033166,0.12237,0.091484,1,1
3,GO SODIUM ION TRANSMEMBRANE TRANSPORT,0.02843,0.12167,0.10248,1,1
3,GO REGULATION OF TRANSCRIPTION BY RNA POLYMERASE III,0.0039469,0.12166,0.10347,1,1
3,GO REGULATION OF PROTEIN TARGETING TO MEMBRANE,0.029719,0.12095,0.11361,1,1
3,GO REGULATION OF TRANSCRIPTION REGULATORY REGION DNA BINDING,0.0075304,0.12071,0.11613,1,1
3,GO RESPONSE TO NITRIC OXIDE,0.0060989,0.11975,0.1029,1,1
3,GO POSITIVE REGULATION OF DNA TEMPLATED TRANSCRIPTION INITIATION,0.042857,0.11906,0.073813,1,1
3,GO TELOMERE MAINTENANCE VIA TELOMERE LENGTHENING,0.014138,0.11894,0.08456,1,1
3,GO REGULATION OF TELOMERE MAINTENANCE,0.0046564,0.1189,0.11692,1,1
3,GO REGULATION OF RNA POLYMERASE II TRANSCRIPTION PREINITIATION COMPLEX ASSEMBLY,0.03939,0.11847,0.11502,1,1
3,GO AMIDE BIOSYNTHETIC PROCESS,0.0087944,0.11847,0.11837,1,1
3,GO NEGATIVE REGULATION OF TELOMERE MAINTENANCE VIA TELOMERE LENGTHENING,0.0050528,0.11797,0.10938,1,1
3,GO SPLICEOSOMAL COMPLEX ASSEMBLY,0.014486,0.11788,0.11892,1,1
3,GO NCRNA EXPORT FROM NUCLEUS,0.033166,0.11753,0.11239,1,1
3,GO REGULATION OF MESENCHYMAL CELL PROLIFERATION,0.053746,0.11627,0.18126,1,1
3,GO NUCLEOBASE CONTAINING SMALL MOLECULE INTERCONVERSION,0.024846,0.11601,0.12444,1,1
3,GO PROTEIN LOCALIZATION TO MITOCHONDRION,0.007729,0.11555,0.076652,1,1
3,GO PROTEIN TETRAMERIZATION,0.00059588,0.11506,0.13276,1,1
3,GO REGULATION OF DNA TEMPLATED TRANSCRIPTION ELONGATION,0.0099891,0.11483,0.10236,1,1
3,GO REGULATION OF REGULATED SECRETORY PATHWAY,0.0013054,0.1146,0.172,1,1
3,GO RESPIRATORY CHAIN COMPLEX IV ASSEMBLY,0.046579,0.1143,0.11196,1,1
3,GO NCRNA 3 END PROCESSING,0.01282,0.11383,0.095253,1,1
3,GO CELLULAR GLUCOSE HOMEOSTASIS,0.0047853,0.11257,0.11194,1,1
3,GO MUSCLE ORGAN MORPHOGENESIS,0.031059,0.11238,0.095715,1,1
3,GO POSITIVE REGULATION OF STRIATED MUSCLE CELL DIFFERENTIATION,0.029068,0.11227,0.098242,1,1
3,GO REGULATION OF RNA EXPORT FROM NUCLEUS,0.022165,0.11169,0.12288,1,1
3,GO CELLULAR RESPONSE TO DRUG,0.0085714,0.11156,0.12578,1,1
3,GO POSITIVE REGULATION OF CELLULAR CARBOHYDRATE METABOLIC PROCESS,0.033166,0.1105,0.076747,1,1
3,GO TELENCEPHALON DEVELOPMENT,0.0028141,0.11012,0.13391,1,1
3,GO TRNA METABOLIC PROCESS,0.0034322,0.10892,0.14407,1,1
3,GO SPERMATID NUCLEUS DIFFERENTIATION,0.036948,0.10884,0.10272,1,1
3,GO RNA 3 END PROCESSING,0.0064317,0.10664,0.082163,1,1
3,GO DNA TEMPLATED TRANSCRIPTION ELONGATION,0.0050528,0.10659,0.091621,1,1
3,GO POSITIVE REGULATION OF CHROMATIN ASSEMBLY OR DISASSEMBLY,0.023741,0.10627,0.11456,1,1
3,GO MRNA 3 END PROCESSING,0.0075304,0.10424,0.078822,1,1
3,GO NEGATIVE REGULATION OF HISTONE METHYLATION,0.018398,0.10337,0.13184,1,1
3,GO G PROTEIN COUPLED RECEPTOR SIGNALING PATHWAY COUPLED TO CYCLIC NUCLEOTIDE SECOND MESSENGER,0.016734,0.1032,0.091181,1,1
3,GO CALCIUM ION TRANSMEMBRANE IMPORT INTO CYTOSOL,0.034637,0.10317,0.086476,1,1
3,GO POSITIVE REGULATION OF TRANSCRIPTION INITIATION FROM RNA POLYMERASE II PROMOTER,0.02843,0.10275,0.079815,1,1
3,GO REGULATION OF CELL CYCLE CHECKPOINT,0.0037331,0.10232,0.09644,1,1
3,GO LEUKOCYTE TETHERING OR ROLLING,0.009256,0.1022,0.12556,1,1
3,GO TELOMERE ORGANIZATION,0.0059384,0.1018,0.092471,1,1
3,GO N TERMINAL PROTEIN AMINO ACID MODIFICATION,0.047551,0.10107,0.0937,1,1
3,GO NUCLEOTIDE EXCISION REPAIR DNA DAMAGE RECOGNITION,0.024288,0.099497,0.10904,1,1
3,GO MRNA METABOLIC PROCESS,0.0014299,0.099475,0.10604,1,1
3,GO TRANSCRIPTION BY RNA POLYMERASE I,0.017969,0.098288,0.11512,1,1
3,GO ESTABLISHMENT OF PROTEIN LOCALIZATION TO ORGANELLE,0.015953,0.09826,0.081023,1,1
3,GO DEOXYRIBONUCLEOTIDE BIOSYNTHETIC PROCESS,0.044685,0.097259,0.12093,1,1
3,GO DNA TEMPLATED TRANSCRIPTION TERMINATION,0.004408,0.096457,0.12148,1,1
3,GO RNA PROCESSING,0.00044439,0.096204,0.11772,1,1
3,GO TERMINATION OF RNA POLYMERASE II TRANSCRIPTION,0.001986,0.096203,0.10604,1,1
3,GO INTERSTRAND CROSS LINK REPAIR,0.0028141,0.095757,0.09109,1,1
3,GO NUCLEOTIDE EXCISION REPAIR DNA INCISION,0.044685,0.095589,0.080866,1,1
3,GO MITOCHONDRIAL GENOME MAINTENANCE,0.041967,0.09449,0.13653,1,1
3,GO RNA SPLICING VIA ENDONUCLEOLYTIC CLEAVAGE AND LIGATION,0.02268,0.093868,0.12209,1,1
3,GO NCRNA TRANSCRIPTION,0.0025083,0.093842,0.09324,1,1
3,GO TRANSCRIPTION BY RNA POLYMERASE III,0.0094949,0.090542,0.090551,1,1
3,GO POSITIVE REGULATION OF TRANSCRIPTION BY RNA POLYMERASE I,0.017137,0.089889,0.14576,1,1
3,GO PHOSPHATE ION TRANSPORT,0.02166,0.089491,0.090965,1,1
3,GO POSITIVE REGULATION OF GENE EXPRESSION EPIGENETIC,0.037747,0.087362,0.086978,1,1
3,GO RNA SPLICING VIA TRANSESTERIFICATION REACTIONS,0.0012662,0.08686,0.10335,1,1
3,GO NEGATIVE REGULATION OF TELOMERE MAINTENANCE,0.025994,0.082868,0.082697,1,1
3,GO PROTEIN HETEROTETRAMERIZATION,0.0050528,0.082708,0.13026,1,1
3,GO NEGATIVE REGULATION OF DNA BINDING,0.044685,0.082305,0.1067,1,1
3,GO POSITIVE REGULATION OF RNA SPLICING,0.044685,0.081949,0.065575,1,1
3,GO MRNA PROCESSING,0.0010859,0.07968,0.091229,1,1
3,GO TRANSCRIPTION ELONGATION FROM RNA POLYMERASE II PROMOTER,0.016339,0.07527,0.067584,1,1
3,GO PROTEIN DNA COMPLEX SUBUNIT ORGANIZATION,0.0056288,0.074586,0.08917,1,1
3,GO RNA SPLICING,0.0023671,0.072933,0.085108,1,1
3,GO TRANSCRIPTION COUPLED NUCLEOTIDE EXCISION REPAIR,0.037747,0.069404,0.071298,1,1
3,GO ORGANIC ACID TRANSMEMBRANE TRANSPORT,0.024846,0.067091,0.096255,1,1
3,GO REGULATION OF MRNA METABOLIC PROCESS,0.02068,0.061768,0.062723,1,1
3,GO NUCLEOTIDE EXCISION REPAIR,0.05161,0.059969,0.059967,1,1
3,GO NEGATIVE REGULATION OF DNA METABOLIC PROCESS,0.037747,0.053063,0.05135,1,1
3,GO CARDIAC VENTRICLE MORPHOGENESIS,0.036164,0.048604,0.11244,1,1
3,GO POSITIVE REGULATION OF MRNA METABOLIC PROCESS,0.038561,0.038589,0.066038,1,1
3,GO METHYLATION,0.033166,0.032322,0.058393,1,1
4,GO ANTIGEN PROCESSING AND PRESENTATION OF ENDOGENOUS PEPTIDE ANTIGEN,0.00019079,1.6395,1.2286,1,1
4,GO ANTIGEN PROCESSING AND PRESENTATION OF ENDOGENOUS ANTIGEN,0.00029782,1.3107,0.97108,1,1
4,GO REGULATION OF DENDRITIC CELL DIFFERENTIATION,0.0021062,1.144,0.82209,1,1
4,GO NERVOUS SYSTEM PROCESS INVOLVED IN REGULATION OF SYSTEMIC ARTERIAL BLOOD PRESSURE,1.1776e-06,0.98529,1.0912,1,1
4,GO MATURE B CELL DIFFERENTIATION INVOLVED IN IMMUNE RESPONSE,1.2454e-05,0.94013,0.65639,1,1
4,GO POSITIVE REGULATION OF HORMONE METABOLIC PROCESS,2.4346e-05,0.89005,0.66802,1,1
4,GO ANTIGEN PROCESSING AND PRESENTATION VIA MHC CLASS IB,0.00025131,0.88801,0.72849,1,1
4,GO SIGNALING RECEPTOR LIGAND PRECURSOR PROCESSING,7.889e-07,0.88248,0.81443,1,1
4,GO REGULATION OF PLASMINOGEN ACTIVATION,0.0022992,0.77947,0.47976,1,1
4,GO NEGATIVE REGULATION OF GLYCOLYTIC PROCESS,7.6603e-06,0.77585,0.66157,1,1
4,GO PROGESTERONE METABOLIC PROCESS,3.1888e-05,0.76646,0.87236,1,1
4,GO POSITIVE REGULATION OF T CELL MEDIATED CYTOTOXICITY,0.00041602,0.76582,0.5488,1,1
4,GO POSITIVE REGULATION OF CELL ADHESION MEDIATED BY INTEGRIN,1.4044e-06,0.75649,0.69385,1,1
4,GO GLYCOSIDE METABOLIC PROCESS,0.00072223,0.75633,0.76785,1,1
4,GO TOLERANCE INDUCTION,0.001228,0.75474,0.58494,1,1
4,GO NEGATIVE REGULATION OF NATURAL KILLER CELL MEDIATED IMMUNITY,0.0037331,0.74921,0.571,1,1
4,GO POSITIVE REGULATION BY SYMBIONT OF ENTRY INTO HOST,8.4205e-05,0.74598,0.6829,1,1
4,GO REGULATION OF VITAMIN METABOLIC PROCESS,1.349e-05,0.74407,0.65166,1,1
4,GO EXTRACELLULAR MATRIX CONSTITUENT SECRETION,9.7346e-05,0.73435,0.66802,1,1
4,GO LIPID DROPLET FORMATION,3.17e-07,0.72388,0.77405,1,1
4,GO HISTAMINE SECRETION,2.7578e-07,0.72337,0.76568,1,1
4,GO REGULATION OF KETONE BIOSYNTHETIC PROCESS,0.00047456,0.71125,0.47508,1,1
4,GO REGULATION OF AMINO ACID IMPORT ACROSS PLASMA MEMBRANE,0.00010462,0.70248,0.5343,1,1
4,GO REGULATION OF SYSTEMIC ARTERIAL BLOOD PRESSURE BY RENIN ANGIOTENSIN,1.5331e-06,0.6893,0.80752,1,1
4,GO HISTAMINE TRANSPORT,2.0829e-07,0.68894,0.73484,1,1
4,GO NEGATIVE REGULATION OF MUSCLE ADAPTATION,0.0038387,0.688,0.55211,1,1
4,GO NEGATIVE REGULATION OF B CELL APOPTOTIC PROCESS,9.4334e-07,0.68318,0.6227,1,1
4,GO MUCUS SECRETION,0.00021167,0.67366,0.5936,1,1
4,GO BRANCHING INVOLVED IN LABYRINTHINE LAYER MORPHOGENESIS,0.0067808,0.66632,0.4427,1,1
4,GO REGULATION OF T CELL MEDIATED CYTOTOXICITY,0.0007696,0.65651,0.48029,1,1
4,GO BRANCHED CHAIN AMINO ACID TRANSPORT,0.00017186,0.65565,0.57282,1,1
4,GO DOPAMINE BIOSYNTHETIC PROCESS,1.7806e-05,0.65554,0.6946,1,1
4,GO RESPONSE TO TYPE I INTERFERON,1.5201e-05,0.65391,0.60966,1,1
4,GO GERMINAL CENTER FORMATION,0.00013433,0.65307,0.5237,1,1
4,GO POSITIVE REGULATION OF STEROID METABOLIC PROCESS,1.2962e-05,0.64631,0.66159,1,1
4,GO NEGATIVE REGULATION OF LEUKOCYTE MEDIATED CYTOTOXICITY,0.0083534,0.64046,0.45957,1,1
4,GO CYTIDINE TO URIDINE EDITING,0.00047456,0.63072,0.59968,1,1
4,GO RESPONSE TO IMMOBILIZATION STRESS,0.00032948,0.62683,0.42283,1,1
4,GO T CELL MEDIATED CYTOTOXICITY,0.0010528,0.6241,0.43116,1,1
4,GO RESPONSE TO INTERFERON BETA,0.00025131,0.62376,0.55155,1,1
4,GO PYRIMIDINE RIBONUCLEOSIDE METABOLIC PROCESS,0.0015653,0.6148,0.42998,1,1
4,GO MATURE B CELL DIFFERENTIATION,3.7145e-05,0.61019,0.44121,1,1
4,GO RENAL ABSORPTION,5.0226e-05,0.60893,0.56118,1,1
4,GO T CELL EXTRAVASATION,0.00038934,0.60292,0.56408,1,1
4,GO CALCIUM INDEPENDENT CELL CELL ADHESION VIA PLASMA MEMBRANE CELL ADHESION MOLECULES,2.1663e-05,0.60185,0.59654,1,1
4,GO INTERFERON GAMMA MEDIATED SIGNALING PATHWAY,0.00011241,0.59911,0.49596,1,1
4,GO FATTY ACID DERIVATIVE CATABOLIC PROCESS,2.2658e-06,0.59804,0.61535,1,1
4,GO RESPONSE TO INTERFERON ALPHA,0.0033369,0.59665,0.33966,1,1
4,GO REGULATION OF TOLERANCE INDUCTION,0.0053338,0.59562,0.46225,1,1
4,GO NEGATIVE REGULATION OF TISSUE REMODELING,3.8131e-07,0.5899,0.62779,1,1
4,GO ANTIGEN PROCESSING AND PRESENTATION OF PEPTIDE ANTIGEN VIA MHC CLASS I,4.4878e-05,0.5861,0.51219,1,1
4,GO DETECTION OF EXTERNAL BIOTIC STIMULUS,2.6902e-06,0.58576,0.60644,1,1
4,GO DETECTION OF MOLECULE OF BACTERIAL ORIGIN,5.7413e-06,0.58341,0.58283,1,1
4,GO TRNA THREONYLCARBAMOYLADENOSINE METABOLIC PROCESS,0.025414,0.58035,0.2881,1,1
4,GO REGULATION OF SUPEROXIDE ANION GENERATION,0.00021909,0.57878,0.57457,1,1
4,GO TOXIN METABOLIC PROCESS,9.0221e-07,0.57472,0.57751,1,1
4,GO DETECTION OF OTHER ORGANISM,2.6307e-05,0.57053,0.56439,1,1
4,GO TERTIARY ALCOHOL METABOLIC PROCESS,0.004408,0.57053,0.60963,1,1
4,GO NEGATIVE REGULATION OF ENDOPLASMIC RETICULUM STRESS INDUCED INTRINSIC APOPTOTIC SIGNALING PATHWAY,3.6414e-07,0.56988,0.59241,1,1
4,GO ANTIGEN PROCESSING AND PRESENTATION OF EXOGENOUS PEPTIDE ANTIGEN VIA MHC CLASS I,5.4121e-05,0.56985,0.52903,1,1
4,GO SIGNAL PEPTIDE PROCESSING,3.0264e-07,0.56665,0.51859,1,1
4,GO QUINONE METABOLIC PROCESS,9.0551e-05,0.56322,0.59681,1,1
4,GO NEGATIVE REGULATION OF INTERLEUKIN 1 BETA PRODUCTION,0.00036427,0.56304,0.46563,1,1
4,GO DENDRITIC CELL DIFFERENTIATION,0.0017123,0.56093,0.40681,1,1
4,GO POSITIVE REGULATION OF MACROPHAGE DIFFERENTIATION,1.349e-05,0.55998,0.58929,1,1
4,GO NEGATIVE REGULATION OF BONE REMODELING,5.753e-07,0.5582,0.60188,1,1
4,GO POSITIVE REGULATION OF OSTEOBLAST PROLIFERATION,6.2367e-06,0.55553,0.52974,1,1
4,GO REGULATION OF HORMONE METABOLIC PROCESS,0.00034072,0.55433,0.3858,1,1
4,GO POSITIVE REGULATION OF CELL MATURATION,2.7343e-05,0.5529,0.50911,1,1
4,GO NEGATIVE REGULATION OF ANION TRANSMEMBRANE TRANSPORT,2.9301e-06,0.55164,0.52287,1,1
4,GO NEGATIVE REGULATION OF CELL KILLING,0.0097392,0.55064,0.39733,1,1
4,GO NEGATIVE REGULATION OF MYOTUBE DIFFERENTIATION,4.5813e-07,0.54811,0.57419,1,1
4,GO REGULATION OF SYSTEMIC ARTERIAL BLOOD PRESSURE BY CIRCULATORY RENIN ANGIOTENSIN,1.4609e-05,0.54704,0.58994,1,1
4,GO RESPONSE TO COLD,1.2366e-07,0.54652,0.49592,1,1
4,GO REGULATION OF FIBRINOLYSIS,0.00016595,0.54275,0.48642,1,1
4,GO KETONE CATABOLIC PROCESS,0.00013917,0.54254,0.4409,1,1
4,GO CELLULAR RESPONSE TO TESTOSTERONE STIMULUS,0.0017123,0.54225,0.41913,1,1
4,GO SPHINGOMYELIN METABOLIC PROCESS,1.2962e-05,0.54197,0.46735,1,1
4,GO RESPONSE TO EPINEPHRINE,0.00026003,0.54178,0.42578,1,1
4,GO O GLYCAN PROCESSING,7.2754e-05,0.54033,0.43144,1,1
4,GO PRIMARY AMINO COMPOUND METABOLIC PROCESS,5.7413e-06,0.53787,0.53877,1,1
4,GO REGULATION OF B CELL APOPTOTIC PROCESS,3.9418e-06,0.53709,0.47915,1,1
4,GO ACTIVATION OF CYSTEINE TYPE ENDOPEPTIDASE ACTIVITY,3.8583e-05,0.53608,0.55573,1,1
4,GO MODULATION BY SYMBIONT OF ENTRY INTO HOST,0.00098941,0.53454,0.37286,1,1
4,GO REGULATION OF VIRAL ENTRY INTO HOST CELL,0.0006154,0.53289,0.392,1,1
4,GO NEGATIVE REGULATION OF B CELL MEDIATED IMMUNITY,0.00023468,0.53059,0.5574,1,1
4,GO SEROTONIN METABOLIC PROCESS,1.4039e-05,0.5302,0.56611,1,1
4,GO FRUCTOSE METABOLIC PROCESS,0.00057693,0.52941,0.54566,1,1
4,GO CATECHOLAMINE BIOSYNTHETIC PROCESS,1.7118e-05,0.52794,0.56779,1,1
4,GO ADHESION OF SYMBIONT TO HOST,0.014486,0.52551,0.33002,1,1
4,GO NEGATIVE REGULATION OF LYMPHOCYTE MEDIATED IMMUNITY,0.00038934,0.52315,0.44381,1,1
4,GO NEGATIVE REGULATION OF LEUKOCYTE MEDIATED IMMUNITY,0.00016595,0.52109,0.39504,1,1
4,GO EOSINOPHIL MIGRATION,0.00019753,0.52013,0.41872,1,1
4,GO REGULATION OF SYSTEMIC ARTERIAL BLOOD PRESSURE BY HORMONE,3.6228e-06,0.51952,0.54478,1,1
4,GO NEGATIVE REGULATION OF ANOIKIS,3.8583e-05,0.51559,0.62467,1,1
4,GO INTESTINAL ABSORPTION,5.0683e-06,0.51544,0.56545,1,1
4,GO CELLULAR RESPONSE TO INTERFERON BETA,9.7346e-05,0.51491,0.41058,1,1
4,GO POSITIVE REGULATION OF TUMOR NECROSIS FACTOR MEDIATED SIGNALING PATHWAY,0.00019753,0.51477,0.38523,1,1
4,GO VERY LOW DENSITY LIPOPROTEIN PARTICLE ASSEMBLY,2.9532e-05,0.51337,0.46534,1,1
4,GO GROWTH HORMONE RECEPTOR SIGNALING PATHWAY VIA JAK STAT,0.00030804,0.5131,0.46527,1,1
4,GO REGULATION OF LIPOPROTEIN METABOLIC PROCESS,0.0028141,0.51132,0.36548,1,1
4,GO ACTIVATION OF JANUS KINASE ACTIVITY,4.4712e-06,0.51091,0.48915,1,1
4,GO POSITIVE REGULATION OF TRANSCRIPTION FROM RNA POLYMERASE II PROMOTER IN RESPONSE TO ENDOPLASMIC RETICULUM STRESS,0.00026003,0.51062,0.44872,1,1
4,GO REGULATION OF ANOIKIS,3.5759e-05,0.50987,0.51943,1,1
4,GO NEGATIVE REGULATION OF VIRAL GENOME REPLICATION,0.00021167,0.50777,0.44811,1,1
4,GO CELLULAR DEFENSE RESPONSE,2.3654e-06,0.50736,0.4523,1,1
4,GO NEGATIVE REGULATION OF SYSTEMIC ARTERIAL BLOOD PRESSURE,1.0184e-05,0.50655,0.48887,1,1
4,GO CELLULAR ALDEHYDE METABOLIC PROCESS,9.7346e-05,0.50422,0.38861,1,1
4,GO NEGATIVE REGULATION OF INTERLEUKIN 1 PRODUCTION,0.00074557,0.50368,0.42269,1,1
4,GO RETINAL METABOLIC PROCESS,0.00023468,0.50162,0.5686,1,1
4,GO REGULATION OF ANION TRANSMEMBRANE TRANSPORT,3.7791e-06,0.49974,0.50299,1,1
4,GO SERINE PHOSPHORYLATION OF STAT PROTEIN,1.104e-05,0.49798,0.41876,1,1
4,GO RETROGRADE TRANS SYNAPTIC SIGNALING,0.0019282,0.49722,0.43035,1,1
4,GO POSITIVE REGULATION OF ENDOPLASMIC RETICULUM UNFOLDED PROTEIN RESPONSE,1.349e-05,0.49511,0.44734,1,1
4,GO CHEMOKINE C X C MOTIF LIGAND 2 PRODUCTION,0.0017123,0.49308,0.40012,1,1
4,GO ACTIN FILAMENT SEVERING,0.00020448,0.49226,0.45175,1,1
4,GO REGULATION OF CD8 POSITIVE ALPHA BETA T CELL ACTIVATION,1.9263e-05,0.49225,0.50472,1,1
4,GO ATF6 MEDIATED UNFOLDED PROTEIN RESPONSE,1.1964e-05,0.49158,0.5992,1,1
4,GO POSITIVE REGULATION OF RENAL SODIUM EXCRETION,0.0013872,0.48856,0.37422,1,1
4,GO REGULATION OF BONE REMODELING,9.4334e-07,0.48769,0.48627,1,1
4,GO RESPONSE TO NITROSATIVE STRESS,0.0013872,0.48767,0.4083,1,1
4,GO PROTEIN DEMANNOSYLATION,2.1702e-06,0.48749,0.47468,1,1
4,GO REGULATION OF TISSUE REMODELING,1.906e-06,0.48624,0.42413,1,1
4,GO POSITIVE REGULATION OF STRIATED MUSCLE CELL APOPTOTIC PROCESS,0.00027832,0.48564,0.59312,1,1
4,GO RESPONSE TO PAIN,4.2876e-06,0.48465,0.46455,1,1
4,GO BASIC AMINO ACID TRANSMEMBRANE TRANSPORT,0.014841,0.48376,0.45215,1,1
4,GO RENAL SYSTEM PROCESS INVOLVED IN REGULATION OF SYSTEMIC ARTERIAL BLOOD PRESSURE,2.0833e-05,0.48323,0.44516,1,1
4,GO RESPONSE TO DIETARY EXCESS,1.2862e-06,0.48098,0.531,1,1
4,GO ACTIN FILAMENT NETWORK FORMATION,0.043763,0.48024,0.2635,1,1
4,GO BONE RESORPTION,6.2985e-07,0.47907,0.46851,1,1
4,GO REGULATION OF WATER LOSS VIA SKIN,0.001986,0.47897,0.36796,1,1
4,GO GALACTOSE METABOLIC PROCESS,8.4205e-05,0.47842,0.5644,1,1
4,GO LONG CHAIN FATTY ACID CATABOLIC PROCESS,0.00029782,0.47755,0.4914,1,1
4,GO MYD88 DEPENDENT TOLL LIKE RECEPTOR SIGNALING PATHWAY,8.2505e-07,0.47377,0.44035,1,1
4,GO INTRINSIC APOPTOTIC SIGNALING PATHWAY IN RESPONSE TO ENDOPLASMIC RETICULUM STRESS,4.3763e-07,0.4733,0.46842,1,1
4,GO REGULATION OF GLOMERULUS DEVELOPMENT,0.00023468,0.47287,0.48179,1,1
4,GO RESPONSE TO STIMULUS INVOLVED IN REGULATION OF MUSCLE ADAPTATION,1.4039e-05,0.47113,0.51442,1,1
4,GO AMMONIUM ION METABOLIC PROCESS,4.2876e-06,0.4705,0.52576,1,1
4,GO REGULATION OF CELL ADHESION MEDIATED BY INTEGRIN,2.0784e-06,0.47038,0.47614,1,1
4,GO POSITIVE REGULATION OF PROTEIN EXIT FROM ENDOPLASMIC RETICULUM,0.00049035,0.47021,0.41942,1,1
4,GO SECONDARY METABOLIC PROCESS,0.00022676,0.46942,0.41931,1,1
4,GO ORGAN OR TISSUE SPECIFIC IMMUNE RESPONSE,6.0504e-05,0.46621,0.40486,1,1
4,GO NEGATIVE REGULATION OF VIRAL ENTRY INTO HOST CELL,0.041093,0.46512,0.24104,1,1
4,GO PLASMINOGEN ACTIVATION,0.00049035,0.46443,0.49411,1,1
4,GO NEGATIVE REGULATION OF HUMORAL IMMUNE RESPONSE,0.0047853,0.46365,0.42824,1,1
4,GO POSITIVE REGULATION OF VASCULAR ASSOCIATED SMOOTH MUSCLE CELL MIGRATION,0.0011549,0.46226,0.43355,1,1
4,GO ZYMOGEN ACTIVATION,1.7806e-05,0.46214,0.48577,1,1
4,GO REGULATION OF PLATELET ACTIVATION,0.00016023,0.46091,0.37134,1,1
4,GO NEGATIVE REGULATION OF RECEPTOR BINDING,0.0020453,0.46003,0.46472,1,1
4,GO NEGATIVE REGULATION OF INNATE IMMUNE RESPONSE,0.00020448,0.45942,0.37653,1,1
4,GO EOSINOPHIL CHEMOTAXIS,0.00021167,0.45856,0.4351,1,1
4,GO REGULATION OF CHOLESTEROL ESTERIFICATION,0.00029782,0.45776,0.58386,1,1
4,GO RESPONSE TO REDOX STATE,0.00010462,0.4565,0.36022,1,1
4,GO REGULATION OF PROTEIN COMPLEX STABILITY,1.9263e-05,0.45339,0.39923,1,1
4,GO RESPONSE TO ACIDIC PH,0.0012662,0.45304,0.33621,1,1
4,GO NEGATIVE REGULATION OF COAGULATION,0.0013457,0.45264,0.36734,1,1
4,GO VASODILATION,2.8077e-06,0.45088,0.5993,1,1
4,GO RESPONSE TO INTERLEUKIN 18,0.020205,0.44998,0.36982,1,1
4,GO STEROID ESTERIFICATION,0.00012074,0.44914,0.54943,1,1
4,GO CELLULAR RESPONSE TO PURINE CONTAINING COMPOUND,0.00011241,0.44534,0.4759,1,1
4,GO REGULATION OF ENDOPLASMIC RETICULUM STRESS INDUCED INTRINSIC APOPTOTIC SIGNALING PATHWAY,6.8936e-07,0.44507,0.49502,1,1
4,GO TOLL LIKE RECEPTOR 2 SIGNALING PATHWAY,0.00011241,0.44485,0.59222,1,1
4,GO REGULATION OF METALLOPEPTIDASE ACTIVITY,0.00098941,0.44414,0.37809,1,1
4,GO POSITIVE REGULATION OF CYTOKINE PRODUCTION INVOLVED IN INFLAMMATORY RESPONSE,7.0571e-06,0.44332,0.39451,1,1
4,GO NEGATIVE REGULATION OF PLATELET ACTIVATION,0.00081984,0.44317,0.3723,1,1
4,GO MACROPHAGE ACTIVATION INVOLVED IN IMMUNE RESPONSE,7.0571e-06,0.44309,0.52089,1,1
4,GO CD8 POSITIVE ALPHA BETA T CELL DIFFERENTIATION,0.0022992,0.44204,0.44082,1,1
4,GO GLYCOLIPID CATABOLIC PROCESS,0.00010462,0.4411,0.49932,1,1
4,GO REGULATION OF HORMONE BIOSYNTHETIC PROCESS,0.010506,0.44101,0.34837,1,1
4,GO POSITIVE REGULATION OF CYSTEINE TYPE ENDOPEPTIDASE ACTIVITY INVOLVED IN APOPTOTIC SIGNALING PATHWAY,0.0011549,0.44036,0.36146,1,1
4,GO REGULATION OF PLATELET AGGREGATION,0.0028141,0.44001,0.34517,1,1
4,GO PHAGOLYSOSOME ASSEMBLY,2.0033e-05,0.43968,0.43461,1,1
4,GO METANEPHRIC GLOMERULUS DEVELOPMENT,0.0010528,0.43959,0.36218,1,1
4,GO LEYDIG CELL DIFFERENTIATION,0.0011199,0.43944,0.45693,1,1
4,GO NAD BIOSYNTHESIS VIA NICOTINAMIDE RIBOSIDE SALVAGE PATHWAY,0.00025131,0.4388,0.3721,1,1
4,GO CELLULAR RESPONSE TO DEXAMETHASONE STIMULUS,0.0015189,0.43848,0.32371,1,1
4,GO REGULATION OF NEURON MATURATION,0.00024286,0.43841,0.35539,1,1
4,GO INSEMINATION,8.7323e-05,0.43836,0.41126,1,1
4,GO NEGATIVE REGULATION OF FATTY ACID BIOSYNTHETIC PROCESS,0.0059384,0.4382,0.31847,1,1
4,GO LIVER MORPHOGENESIS,7.2754e-05,0.43779,0.40448,1,1
4,GO POSITIVE REGULATION OF FATTY ACID OXIDATION,6.7728e-06,0.43736,0.48482,1,1
4,GO POSITIVE REGULATION OF MACROPHAGE DERIVED FOAM CELL DIFFERENTIATION,0.0001165,0.43712,0.37338,1,1
4,GO CELL ADHESION MEDIATED BY INTEGRIN,3.0689e-05,0.43705,0.42363,1,1
4,GO NONRIBOSOMAL PEPTIDE BIOSYNTHETIC PROCESS,3.8583e-05,0.43678,0.4599,1,1
4,GO FATTY ACID BETA OXIDATION USING ACYL COA OXIDASE,0.00030804,0.43652,0.40584,1,1
4,GO NEGATIVE REGULATION OF CYTOKINE BIOSYNTHETIC PROCESS,1.1964e-05,0.43605,0.4444,1,1
4,GO REGULATION OF TRANSMISSION OF NERVE IMPULSE,0.00069957,0.4352,0.38626,1,1
4,GO INTESTINAL LIPID ABSORPTION,1.9263e-05,0.43461,0.59141,1,1
4,GO POSITIVE REGULATION OF STEROID BIOSYNTHETIC PROCESS,1.7118e-05,0.43409,0.64355,1,1
4,GO POSITIVE REGULATION OF NATURAL KILLER CELL MEDIATED IMMUNITY,2.8077e-06,0.43393,0.34499,1,1
4,GO POSITIVE REGULATION OF CAMP MEDIATED SIGNALING,1.8521e-05,0.43262,0.41688,1,1
4,GO SUPEROXIDE ANION GENERATION,0.00012512,0.43076,0.44281,1,1
4,GO CELLULAR RESPONSE TO FATTY ACID,4.1617e-05,0.43061,0.37173,1,1
4,GO POSITIVE REGULATION OF TYPE I INTERFERON MEDIATED SIGNALING PATHWAY,8.1192e-05,0.43023,0.38334,1,1
4,GO REGULATION OF LIPOPOLYSACCHARIDE MEDIATED SIGNALING PATHWAY,4.4878e-05,0.42981,0.42314,1,1
4,GO NEGATIVE REGULATION OF LIPID BIOSYNTHETIC PROCESS,0.00013917,0.42835,0.32935,1,1
4,GO POSITIVE REGULATION OF ENDOPLASMIC RETICULUM STRESS INDUCED INTRINSIC APOPTOTIC SIGNALING PATHWAY,0.0094949,0.42765,0.2724,1,1
4,GO PROTEIN DEGLYCOSYLATION,6.7728e-06,0.4275,0.44457,1,1
4,GO BASIC AMINO ACID TRANSPORT,0.0030654,0.42711,0.42717,1,1
4,GO REGULATION OF SUPEROXIDE METABOLIC PROCESS,0.0001165,0.42694,0.36929,1,1
4,GO NEGATIVE REGULATION OF VIRAL LIFE CYCLE,0.00059588,0.42637,0.34202,1,1
4,GO POTASSIUM ION EXPORT ACROSS PLASMA MEMBRANE,0.0017123,0.42594,0.37661,1,1
4,GO POSITIVE REGULATION OF NEUTROPHIL MIGRATION,1.4609e-05,0.42576,0.36783,1,1
4,GO NEGATIVE REGULATION OF MULTICELLULAR ORGANISM GROWTH,0.0018173,0.42564,0.37341,1,1
4,GO REGULATION OF SYSTEMIC ARTERIAL BLOOD PRESSURE,6.0198e-07,0.42523,0.3534,1,1
