5,GO REGULATION OF KERATINOCYTE DIFFERENTIATION,0.00040247,0.37799,0.36402,1,1
5,GO REGULATION OF T CELL MEDIATED CYTOTOXICITY,0.0087944,0.37785,0.27534,1,1
5,GO POSITIVE REGULATION OF VASCULAR ENDOTHELIAL GROWTH FACTOR RECEPTOR SIGNALING PATHWAY,0.00026003,0.37697,0.37309,1,1
5,GO REGULATION OF EPITHELIAL CELL DIFFERENTIATION,4.1112e-06,0.37517,0.32368,1,1
5,GO CERAMIDE CATABOLIC PROCESS,0.046579,0.37505,0.19681,1,1
5,GO SKIN MORPHOGENESIS,0.0090226,0.37494,0.28966,1,1
5,GO CELLULAR RESPONSE TO NUTRIENT,1.8521e-05,0.3749,0.35633,1,1
5,GO MATURE B CELL DIFFERENTIATION,0.045624,0.37445,0.23175,1,1
5,GO NEURONAL STEM CELL POPULATION MAINTENANCE,0.00021167,0.3741,0.33209,1,1
5,GO REGULATION OF AMPA RECEPTOR ACTIVITY,0.015574,0.37391,0.29237,1,1
5,GO PROSTATE GLAND DEVELOPMENT,4.4878e-05,0.37381,0.32675,1,1
5,GO LYMPHOID PROGENITOR CELL DIFFERENTIATION,0.00017186,0.37366,0.35981,1,1
5,GO NEGATIVE REGULATION OF T CELL PROLIFERATION,4.3218e-05,0.37366,0.30329,1,1
5,GO REGULATION OF EPIDERMAL GROWTH FACTOR ACTIVATED RECEPTOR ACTIVITY,0.0006154,0.37347,0.27113,1,1
5,GO COLLAGEN ACTIVATED TYROSINE KINASE RECEPTOR SIGNALING PATHWAY,0.0053338,0.3734,0.45306,1,1
5,GO REGULATION OF EPITHELIAL TO MESENCHYMAL TRANSITION,2.5308e-05,0.37336,0.33395,1,1
5,GO SECONDARY PALATE DEVELOPMENT,2.0833e-05,0.37313,0.36706,1,1
5,GO NEGATIVE REGULATION OF LYMPHOCYTE DIFFERENTIATION,5.4121e-05,0.37289,0.32841,1,1
5,GO GLOMERULAR BASEMENT MEMBRANE DEVELOPMENT,0.018398,0.37286,0.29564,1,1
5,GO MESENCHYMAL CELL APOPTOTIC PROCESS,0.0037331,0.37247,0.26162,1,1
5,GO BASEMENT MEMBRANE ORGANIZATION,0.0027346,0.37233,0.33292,1,1
5,GO TERPENOID BIOSYNTHETIC PROCESS,0.0013872,0.37221,0.3073,1,1
5,GO LUNG ALVEOLUS DEVELOPMENT,0.00012074,0.37163,0.31203,1,1
5,GO REGULATION OF TYPE B PANCREATIC CELL PROLIFERATION,0.00081984,0.37105,0.38726,1,1
5,GO HEPARAN SULFATE PROTEOGLYCAN METABOLIC PROCESS,8.1192e-05,0.37102,0.35297,1,1
5,GO SEMAPHORIN PLEXIN SIGNALING PATHWAY INVOLVED IN NEURON PROJECTION GUIDANCE,0.0053338,0.3687,0.35985,1,1
5,GO MINERALOCORTICOID METABOLIC PROCESS,0.036164,0.36869,0.22881,1,1
5,GO NEGATIVE REGULATION OF INNATE IMMUNE RESPONSE,0.00030804,0.3686,0.32454,1,1
5,GO POSITIVE REGULATION OF VASCULAR ENDOTHELIAL GROWTH FACTOR PRODUCTION,8.3127e-06,0.36798,0.34564,1,1
5,GO POSITIVE REGULATION OF HISTONE DEACETYLATION,0.00087311,0.3679,0.30172,1,1
5,GO REGULATION OF FATTY ACID OXIDATION,3.8583e-05,0.36789,0.29828,1,1
5,GO POSITIVE REGULATION OF NUCLEOTIDE METABOLIC PROCESS,5.508e-06,0.36784,0.3069,1,1
5,GO POSITIVE REGULATION OF MACROPHAGE CHEMOTAXIS,3.3132e-05,0.3677,0.38276,1,1
5,GO CELL DIFFERENTIATION INVOLVED IN EMBRYONIC PLACENTA DEVELOPMENT,0.00055855,0.36653,0.41866,1,1
5,GO CRANIAL NERVE DEVELOPMENT,9.3916e-06,0.36617,0.34257,1,1
5,GO FUCOSE METABOLIC PROCESS,0.0030654,0.36614,0.24419,1,1
5,GO REGULATION OF BMP SIGNALING PATHWAY,0.00010845,0.36541,0.2873,1,1
5,GO ASTROCYTE ACTIVATION,0.00059588,0.36483,0.31585,1,1
5,GO POSITIVE REGULATION OF CILIUM MOVEMENT,2.6307e-05,0.36483,0.34181,1,1
5,GO NEGATIVE REGULATION OF EPITHELIAL CELL PROLIFERATION,1.349e-05,0.36278,0.31022,1,1
5,GO REGULATION OF GTP BINDING,0.0037331,0.36272,0.28104,1,1
5,GO REGULATION OF EPIDERMIS DEVELOPMENT,1.9263e-05,0.36246,0.3735,1,1
5,GO RESPONSE TO COLD,0.00026003,0.36201,0.28753,1,1
5,GO PHARYNGEAL SYSTEM DEVELOPMENT,0.00057693,0.36189,0.33396,1,1
5,GO CELLULAR RESPONSE TO CORTICOSTEROID STIMULUS,0.00017186,0.36174,0.28213,1,1
5,GO ENDOTHELIAL CELL APOPTOTIC PROCESS,0.00069957,0.36128,0.26893,1,1
5,GO REGULATION OF MONOCYTE CHEMOTAXIS,0.00047456,0.36104,0.31063,1,1
5,GO SHORT TERM MEMORY,0.033894,0.36093,0.22061,1,1
5,GO EPITHELIAL CELL MATURATION,0.00084609,0.36085,0.33354,1,1
5,GO NEGATIVE REGULATION OF TRANSCRIPTION FROM RNA POLYMERASE II PROMOTER IN RESPONSE TO STRESS,0.00034072,0.36052,0.30835,1,1
5,GO BROWN FAT CELL DIFFERENTIATION,3.6414e-07,0.36035,0.38124,1,1
5,GO MYELIN MAINTENANCE,6.7596e-05,0.36001,0.39505,1,1
5,GO LIVER MORPHOGENESIS,1.9263e-05,0.35981,0.47838,1,1
5,GO NEGATIVE REGULATION OF T CELL DIFFERENTIATION,9.389e-05,0.35939,0.35187,1,1
5,GO MESONEPHRIC TUBULE MORPHOGENESIS,2.4346e-05,0.35861,0.28844,1,1
5,GO REGULATION OF CGMP MEDIATED SIGNALING,0.0024367,0.3583,0.32979,1,1
5,GO MAMMARY GLAND MORPHOGENESIS,7.547e-05,0.35823,0.32361,1,1
5,GO ENERGY HOMEOSTASIS,1.104e-05,0.35819,0.34519,1,1
5,GO REGULATION OF HAIR FOLLICLE DEVELOPMENT,0.00032948,0.35782,0.31686,1,1
5,GO ANTIBACTERIAL HUMORAL RESPONSE,3.6228e-06,0.35773,0.39986,1,1
5,GO PLATELET DERIVED GROWTH FACTOR RECEPTOR BETA SIGNALING PATHWAY,0.0085714,0.35767,0.27211,1,1
5,GO POSITIVE REGULATION OF CELL CELL ADHESION MEDIATED BY CADHERIN,0.013798,0.35758,0.28351,1,1
5,GO POSITIVE REGULATION OF VASCULAR ASSOCIATED SMOOTH MUSCLE CELL MIGRATION,0.0025083,0.357,0.36158,1,1
5,GO AUTONOMIC NERVOUS SYSTEM DEVELOPMENT,2.8077e-06,0.35675,0.37276,1,1
5,GO NEGATIVE REGULATION OF EPITHELIAL TO MESENCHYMAL TRANSITION,0.00063551,0.35605,0.31354,1,1
5,GO NEGATIVE REGULATION OF LEUKOCYTE APOPTOTIC PROCESS,3.8583e-05,0.35603,0.30565,1,1
5,GO NEGATIVE REGULATION OF INTERLEUKIN 1 PRODUCTION,0.0040578,0.35592,0.25685,1,1
5,GO AXIS ELONGATION,6.2786e-05,0.35576,0.32168,1,1
5,GO POSITIVE REGULATION OF WOUND HEALING,2.2524e-05,0.35564,0.38825,1,1
5,GO NEGATIVE REGULATION OF NEURAL PRECURSOR CELL PROLIFERATION,1.1964e-05,0.35502,0.39758,1,1
5,GO CELLULAR SODIUM ION HOMEOSTASIS,0.00032948,0.35463,0.43253,1,1
5,GO ACTIVATION OF ADENYLATE CYCLASE ACTIVITY,0.0030654,0.35399,0.22391,1,1
5,GO NEGATIVE REGULATION OF AUTOPHAGOSOME ASSEMBLY,0.00041602,0.35398,0.3426,1,1
5,GO RETINOIC ACID METABOLIC PROCESS,2.0033e-05,0.35379,0.3869,1,1
5,GO STEROID HORMONE SECRETION,0.0001547,0.35364,0.3232,1,1
5,GO GANGLION DEVELOPMENT,0.0081404,0.35347,0.36738,1,1
5,GO POTASSIUM ION EXPORT ACROSS PLASMA MEMBRANE,0.013139,0.35278,0.32475,1,1
5,GO MEMBRANE RAFT ORGANIZATION,0.0090226,0.3526,0.28158,1,1
5,GO REGULATION OF CD4 POSITIVE ALPHA BETA T CELL ACTIVATION,9.7346e-05,0.3523,0.24397,1,1
5,GO NEGATIVE REGULATION OF LEUKOCYTE CELL CELL ADHESION,3.7145e-05,0.35224,0.30202,1,1
5,GO REGULATION OF FIBROBLAST GROWTH FACTOR RECEPTOR SIGNALING PATHWAY,0.00011241,0.35216,0.41723,1,1
5,GO NEUROTROPHIN TRK RECEPTOR SIGNALING PATHWAY,5.6174e-05,0.35133,0.29136,1,1
5,GO POSITIVE REGULATION OF CELL SUBSTRATE JUNCTION ORGANIZATION,0.00072223,0.35096,0.27016,1,1
5,GO REGULATION OF GLYCOGEN METABOLIC PROCESS,5.508e-06,0.35093,0.30867,1,1
5,GO ENTRY OF BACTERIUM INTO HOST CELL,0.035393,0.35084,0.32044,1,1
5,GO POSITIVE REGULATION OF NEUTROPHIL MIGRATION,0.00074557,0.35074,0.2462,1,1
5,GO CEREBELLAR PURKINJE CELL LAYER MORPHOGENESIS,0.00042998,0.34977,0.32365,1,1
5,GO NEGATIVE REGULATION OF RESPONSE TO BIOTIC STIMULUS,0.00021167,0.34962,0.27291,1,1
5,GO NEGATIVE REGULATION OF CARTILAGE DEVELOPMENT,0.0013054,0.34962,0.28955,1,1
5,GO DENDRITIC CELL DIFFERENTIATION,0.0013054,0.34931,0.24752,1,1
5,GO POSITIVE REGULATION OF LEUKOCYTE CHEMOTAXIS,3.0576e-06,0.34928,0.30077,1,1
5,GO POSITIVE REGULATION OF GLIAL CELL PROLIFERATION,0.001986,0.34922,0.31971,1,1
5,GO NEUROMUSCULAR SYNAPTIC TRANSMISSION,0.0029794,0.34899,0.31046,1,1
5,GO TRACHEA DEVELOPMENT,0.00029782,0.34776,0.35314,1,1
5,GO REGULATION OF NATURAL KILLER CELL MEDIATED IMMUNITY,0.0013457,0.34775,0.24725,1,1
5,GO ESTABLISHMENT OF EPITHELIAL CELL APICAL BASAL POLARITY,0.0085714,0.34762,0.2592,1,1
5,GO SUPEROXIDE ANION GENERATION,0.00019753,0.34749,0.33544,1,1
5,GO ENDOTHELIAL CELL DEVELOPMENT,1.5816e-05,0.34738,0.28282,1,1
5,GO CELL MIGRATION IN HINDBRAIN,0.00014418,0.34684,0.37512,1,1
5,GO REGULATION OF INFLAMMATORY RESPONSE TO ANTIGENIC STIMULUS,4.4878e-05,0.3467,0.30779,1,1
5,GO MITRAL VALVE DEVELOPMENT,0.0013872,0.3467,0.28602,1,1
5,GO POSITIVE REGULATION OF CREB TRANSCRIPTION FACTOR ACTIVITY,0.0011199,0.34657,0.28096,1,1
5,GO DENDRITIC CELL MIGRATION,0.020205,0.3464,0.22889,1,1
5,GO EMBRYONIC HEMOPOIESIS,4.1112e-06,0.3462,0.3231,1,1
5,GO REGULATION OF SODIUM ION TRANSMEMBRANE TRANSPORTER ACTIVITY,0.00021909,0.34588,0.29532,1,1
5,GO POSITIVE REGULATION OF MYOBLAST DIFFERENTIATION,0.0066042,0.34587,0.28057,1,1
5,GO LIPID DROPLET ORGANIZATION,0.00027832,0.34573,0.28802,1,1
5,GO NEGATIVE REGULATION OF VASCULAR PERMEABILITY,0.027803,0.34564,0.21498,1,1
5,GO RESPONSE TO POTASSIUM ION,0.00084609,0.3456,0.30062,1,1
5,GO REGULATION OF EPITHELIAL CELL APOPTOTIC PROCESS,0.00016023,0.3452,0.3007,1,1
5,GO REGULATION OF CARDIAC MUSCLE CELL MEMBRANE REPOLARIZATION,0.007729,0.34458,0.24338,1,1
5,GO INTERLEUKIN 13 PRODUCTION,0.0014299,0.34435,0.31507,1,1
5,GO CD8 POSITIVE ALPHA BETA T CELL DIFFERENTIATION,1.7806e-05,0.34411,0.42992,1,1
5,GO PHAGOCYTOSIS RECOGNITION,0.009256,0.34384,0.20944,1,1
5,GO DETECTION OF STIMULUS INVOLVED IN SENSORY PERCEPTION OF PAIN,7.013e-05,0.34342,0.41933,1,1
5,GO NEGATIVE REGULATION OF MESENCHYMAL CELL APOPTOTIC PROCESS,0.0028141,0.34324,0.25813,1,1
5,GO SEQUESTERING OF EXTRACELLULAR LIGAND FROM RECEPTOR,0.0016129,0.34291,0.33838,1,1
5,GO REGULATION OF LEUKOCYTE CHEMOTAXIS,7.9801e-06,0.34255,0.29527,1,1
5,GO HIGH DENSITY LIPOPROTEIN PARTICLE ASSEMBLY,0.00028792,0.34252,0.30065,1,1
5,GO NEGATIVE REGULATION OF CELL CELL ADHESION,3.3287e-06,0.34232,0.32757,1,1
5,GO AXON ENSHEATHMENT IN CENTRAL NERVOUS SYSTEM,0.0018173,0.34225,0.24028,1,1
5,GO SERTOLI CELL DIFFERENTIATION,0.00017186,0.3419,0.37991,1,1
5,GO REGULATION OF TRANSCRIPTION FROM RNA POLYMERASE II PROMOTER IN RESPONSE TO OXIDATIVE STRESS,0.0015189,0.34186,0.27873,1,1
5,GO POSITIVE REGULATION OF MESENCHYMAL CELL PROLIFERATION,0.0017123,0.3416,0.31493,1,1
5,GO REGULATION OF NATURAL KILLER CELL DIFFERENTIATION,5.9841e-06,0.34145,0.40057,1,1
5,GO RESPONSE TO MACROPHAGE COLONY STIMULATING FACTOR,0.00057693,0.34095,0.28253,1,1
5,GO POSITIVE REGULATION OF MONOCYTE CHEMOTAXIS,7.2754e-05,0.3408,0.3621,1,1
5,GO RESPONSE TO TUMOR CELL,0.013798,0.34075,0.24251,1,1
5,GO AMINOGLYCAN CATABOLIC PROCESS,0.0013054,0.34068,0.27131,1,1
5,GO RESPONSE TO THYROID HORMONE,0.0031536,0.3404,0.29467,1,1
5,GO MICROVILLUS ORGANIZATION,0.0083534,0.34039,0.25068,1,1
5,GO POSITIVE REGULATION OF CELL SUBSTRATE ADHESION,0.00040247,0.34012,0.26206,1,1
5,GO NEGATIVE REGULATION OF BMP SIGNALING PATHWAY,0.00054072,0.34001,0.25813,1,1
5,GO REGULATION OF INTEGRIN MEDIATED SIGNALING PATHWAY,0.0030654,0.33939,0.3307,1,1
5,GO ENDOTHELIUM DEVELOPMENT,2.4692e-06,0.33937,0.29702,1,1
5,GO REGULATION OF FAT CELL DIFFERENTIATION,5.4977e-07,0.33891,0.30533,1,1
5,GO ANATOMICAL STRUCTURE ARRANGEMENT,0.00019753,0.33883,0.33874,1,1
5,GO POSTSYNAPSE ASSEMBLY,0.0066042,0.33865,0.36873,1,1
5,GO SERTOLI CELL DEVELOPMENT,5.6174e-05,0.33852,0.41786,1,1
5,GO NEGATIVE REGULATION OF ERYTHROCYTE DIFFERENTIATION,0.00047456,0.33849,0.36015,1,1
5,GO UTERINE SMOOTH MUSCLE CONTRACTION,0.001228,0.33812,0.42245,1,1
5,GO POSITIVE REGULATION OF PROTEIN MATURATION,0.00092958,0.338,0.28599,1,1
5,GO NEGATIVE REGULATION OF LEUKOCYTE PROLIFERATION,7.8282e-05,0.33792,0.26373,1,1
5,GO EXOCRINE SYSTEM DEVELOPMENT,5.8301e-05,0.33777,0.33286,1,1
5,GO RESPONSE TO INTERFERON GAMMA,0.0007696,0.33772,0.32518,1,1
5,GO MORPHOGENESIS OF A BRANCHING STRUCTURE,5.7413e-06,0.33761,0.27672,1,1
5,GO POSITIVE REGULATION OF CAMP MEDIATED SIGNALING,0.0056288,0.33759,0.24419,1,1
5,GO RESPONSE TO UV B,0.0022992,0.33738,0.28066,1,1
5,GO REGULATION OF PSEUDOPODIUM ASSEMBLY,0.0028141,0.33649,0.28763,1,1
5,GO PLASMA MEMBRANE PHOSPHOLIPID SCRAMBLING,0.0022992,0.33646,0.37444,1,1
5,GO EMBRYONIC PLACENTA DEVELOPMENT,2.1702e-06,0.3363,0.35456,1,1
5,GO REGULATION OF GRANULOCYTE CHEMOTAXIS,0.00063551,0.33612,0.23009,1,1
5,GO CGMP METABOLIC PROCESS,0.0059384,0.33602,0.2655,1,1
5,GO VASCULAR ASSOCIATED SMOOTH MUSCLE CELL DIFFERENTIATION,7.013e-05,0.33596,0.35701,1,1
5,GO PROGRAMMED CELL DEATH INVOLVED IN CELL DEVELOPMENT,5.6174e-05,0.33481,0.44,1,1
5,GO REGULATION OF LYMPHOCYTE CHEMOTAXIS,0.00021909,0.33464,0.31205,1,1
5,GO INNER EAR AUDITORY RECEPTOR CELL DIFFERENTIATION,8.1192e-05,0.33452,0.40446,1,1
5,GO ASYMMETRIC CELL DIVISION,0.0060989,0.33444,0.25701,1,1
5,GO MECHANORECEPTOR DIFFERENTIATION,4.8612e-06,0.33439,0.39216,1,1
5,GO VASCULAR ENDOTHELIAL GROWTH FACTOR SIGNALING PATHWAY,0.0064317,0.33433,0.24367,1,1
5,GO REGULATION OF DEFENSE RESPONSE TO VIRUS BY HOST,0.0036303,0.33432,0.2447,1,1
5,GO NEGATIVE REGULATION OF RHO PROTEIN SIGNAL TRANSDUCTION,0.00010462,0.33415,0.30412,1,1
5,GO REGULATION OF CELLULAR RESPONSE TO GROWTH FACTOR STIMULUS,2.7343e-05,0.33398,0.26467,1,1
5,GO LINOLEIC ACID METABOLIC PROCESS,0.0049174,0.33385,0.26218,1,1
5,GO NEURAL CREST CELL MIGRATION,0.015953,0.33337,0.25487,1,1
5,GO CARDIAC ATRIUM MORPHOGENESIS,0.0028141,0.33333,0.23279,1,1
5,GO NEGATIVE REGULATION OF CELL ADHESION,1.9904e-06,0.33312,0.29315,1,1
5,GO PSEUDOPODIUM ORGANIZATION,0.0016129,0.33277,0.3661,1,1
5,GO INOSITOL PHOSPHATE MEDIATED SIGNALING,2.2658e-06,0.33272,0.29567,1,1
5,GO FAT CELL DIFFERENTIATION,3.0264e-07,0.33267,0.28463,1,1
5,GO PRO B CELL DIFFERENTIATION,0.0022332,0.33258,0.26971,1,1
5,GO EPITHELIAL CELL APOPTOTIC PROCESS,2.7343e-05,0.33249,0.29196,1,1
5,GO REGULATION OF VASCULAR ASSOCIATED SMOOTH MUSCLE CELL DIFFERENTIATION,0.0012662,0.3321,0.36575,1,1
5,GO GLIAL CELL DEVELOPMENT,1.1776e-06,0.33196,0.31294,1,1
5,GO NEPHRON MORPHOGENESIS,6.2367e-06,0.3318,0.26927,1,1
5,GO REGULATION OF PROTEIN LOCALIZATION TO ENDOSOME,0.00012512,0.33099,0.35113,1,1
5,GO RESPIRATORY SYSTEM DEVELOPMENT,1.0311e-06,0.33072,0.3021,1,1
5,GO SMOOTH MUSCLE CELL MIGRATION,7.8282e-05,0.33059,0.32703,1,1
5,GO REGULATION OF COAGULATION,0.0022992,0.33044,0.24058,1,1
5,GO MORPHOGENESIS OF AN EPITHELIAL FOLD,5.8301e-05,0.33031,0.34139,1,1
5,GO KERATINOCYTE PROLIFERATION,0.0017123,0.33021,0.26192,1,1
5,GO MAMMARY GLAND DUCT MORPHOGENESIS,0.00092958,0.33001,0.26275,1,1
5,GO REGULATION OF ANOIKIS,0.0013457,0.33001,0.34667,1,1
5,GO REGULATION OF SIGNALING RECEPTOR ACTIVITY,1.9263e-05,0.32989,0.25844,1,1
5,GO CARDIAC CONDUCTION SYSTEM DEVELOPMENT,0.001662,0.32981,0.33754,1,1
5,GO DETECTION OF MECHANICAL STIMULUS INVOLVED IN SENSORY PERCEPTION OF PAIN,0.02166,0.3298,0.30863,1,1
5,GO REGULATION OF ACUTE INFLAMMATORY RESPONSE,0.0001165,0.32962,0.27535,1,1
5,GO NEGATIVE REGULATION OF REGULATED SECRETORY PATHWAY,0.00018427,0.32947,0.29282,1,1
5,GO ODONTOGENESIS,0.0001547,0.32931,0.2773,1,1
5,GO SPHINGOSINE BIOSYNTHETIC PROCESS,0.011904,0.32921,0.19104,1,1
5,GO HEART TRABECULA FORMATION,0.00010462,0.32908,0.341,1,1
5,GO GLIAL CELL MIGRATION,0.00027832,0.3288,0.2452,1,1
5,GO WHITE FAT CELL DIFFERENTIATION,2.0833e-05,0.32867,0.32586,1,1
5,GO POST EMBRYONIC ANIMAL ORGAN DEVELOPMENT,0.0018173,0.32831,0.31322,1,1
5,GO REGULATION OF POSITIVE CHEMOTAXIS,4.6623e-06,0.32708,0.37816,1,1
5,GO NEGATIVE REGULATION OF CYTOKINE BIOSYNTHETIC PROCESS,0.0030654,0.32705,0.24077,1,1
5,GO POSITIVE REGULATION OF SIGNALING RECEPTOR ACTIVITY,1.6455e-05,0.32638,0.35996,1,1
5,GO REGULATION OF NEUROTRANSMITTER UPTAKE,0.0047853,0.32619,0.23991,1,1
5,GO POSITIVE REGULATION OF ENDOTHELIAL CELL DIFFERENTIATION,0.00067758,0.32611,0.29455,1,1
5,GO POSITIVE REGULATION OF CELL MATURATION,0.030383,0.32495,0.21314,1,1
5,GO REGULATION OF ENDOTHELIAL CELL DIFFERENTIATION,2.9532e-05,0.32493,0.30299,1,1
5,GO REGULATION OF RESPIRATORY GASEOUS EXCHANGE BY NERVOUS SYSTEM PROCESS,0.0054795,0.32491,0.25544,1,1
5,GO POSITIVE REGULATION OF MYOTUBE DIFFERENTIATION,0.00027832,0.32481,0.29369,1,1
5,GO CELLULAR RESPONSE TO RETINOIC ACID,0.0031536,0.32475,0.24881,1,1
5,GO REGULATION OF CD4 POSITIVE ALPHA BETA T CELL DIFFERENTIATION,0.00040247,0.32458,0.22166,1,1
5,GO PREPULSE INHIBITION,0.012508,0.32439,0.36465,1,1
5,GO POSITIVE REGULATION OF ENDOTHELIAL CELL PROLIFERATION,3.6228e-06,0.32433,0.30368,1,1
5,GO RESPONSE TO AXON INJURY,0.00021909,0.32401,0.26102,1,1
5,GO CELLULAR RESPONSE TO SALT STRESS,0.047551,0.32354,0.17867,1,1
5,GO NEGATIVE REGULATION OF CYTOSOLIC CALCIUM ION CONCENTRATION,0.0024367,0.32351,0.28239,1,1
5,GO DETECTION OF BIOTIC STIMULUS,0.00040247,0.32347,0.33197,1,1
5,GO COCHLEA DEVELOPMENT,4.3218e-05,0.32329,0.3188,1,1
5,GO NEGATIVE REGULATION OF ASTROCYTE DIFFERENTIATION,2.6307e-05,0.32312,0.31531,1,1
5,GO NEGATIVE REGULATION OF CELLULAR RESPONSE TO GROWTH FACTOR STIMULUS,6.2786e-05,0.32309,0.26192,1,1
5,GO PROTEIN OXIDATION,0.030383,0.32266,0.22035,1,1
5,GO POSITIVE REGULATION OF SMOOTH MUSCLE CELL MIGRATION,9.7346e-05,0.32243,0.34973,1,1
5,GO POSITIVE REGULATION OF T CELL APOPTOTIC PROCESS,0.016339,0.32238,0.29139,1,1
5,GO POSITIVE REGULATION OF CHROMATIN BINDING,0.00038934,0.32206,0.26399,1,1
5,GO EPIDERMIS MORPHOGENESIS,8.7323e-05,0.3219,0.3039,1,1
5,GO REGULATION OF TRANSMISSION OF NERVE IMPULSE,0.001662,0.32186,0.22929,1,1
5,GO GLUCOCORTICOID BIOSYNTHETIC PROCESS,0.0029794,0.32184,0.26169,1,1
5,GO MAST CELL ACTIVATION,1.7806e-05,0.32179,0.2875,1,1
5,GO VASCULAR WOUND HEALING,0.00010092,0.32151,0.39794,1,1
5,GO NEGATIVE REGULATION OF B CELL APOPTOTIC PROCESS,0.025994,0.32111,0.25295,1,1
5,GO INNER EAR RECEPTOR CELL STEREOCILIUM ORGANIZATION,5.7413e-06,0.32107,0.39061,1,1
5,GO POSITIVE REGULATION OF CHEMOTAXIS,7.6603e-06,0.32082,0.29046,1,1
5,GO NEGATIVE REGULATION OF MUSCLE HYPERTROPHY,0.0010528,0.32074,0.27214,1,1
5,GO ATRIAL SEPTUM MORPHOGENESIS,0.045624,0.32064,0.26487,1,1
5,GO REGULATION OF VIRAL LIFE CYCLE,0.0064317,0.31987,0.24345,1,1
5,GO ALPHA BETA T CELL ACTIVATION INVOLVED IN IMMUNE RESPONSE,0.0015189,0.31974,0.20365,1,1
5,GO LEUKOTRIENE METABOLIC PROCESS,0.0014299,0.31875,0.25386,1,1
5,GO ACTIN CROSSLINK FORMATION,0.00054072,0.31858,0.26675,1,1
5,GO POSITIVE REGULATION OF PROTEIN DEACETYLATION,0.0013457,0.31846,0.25274,1,1
5,GO IMMUNOLOGICAL SYNAPSE FORMATION,0.031748,0.31836,0.31236,1,1
5,GO BRANCHING MORPHOGENESIS OF AN EPITHELIAL TUBE,9.3916e-06,0.31828,0.27048,1,1
5,GO METANEPHRIC EPITHELIUM DEVELOPMENT,0.0040578,0.31818,0.27803,1,1
5,GO REGULATION OF LONG TERM SYNAPTIC POTENTIATION,0.00041602,0.31804,0.28608,1,1
5,GO KIDNEY MORPHOGENESIS,3.4728e-06,0.318,0.27633,1,1
5,GO POSITIVE REGULATION OF OSTEOBLAST PROLIFERATION,0.02268,0.31781,0.23909,1,1
5,GO REGULATION OF POSTSYNAPTIC NEUROTRANSMITTER RECEPTOR ACTIVITY,0.0094949,0.31771,0.43847,1,1
5,GO POSITIVE REGULATION OF BIOMINERALIZATION,4.0073e-05,0.31727,0.31744,1,1
5,GO RESPONSE TO ACETYLCHOLINE,0.00026903,0.31722,0.32884,1,1
5,GO EPITHELIAL CELL DEVELOPMENT,9.0221e-07,0.31721,0.2899,1,1
5,GO ODONTOGENESIS OF DENTIN CONTAINING TOOTH,3.5759e-05,0.31659,0.30059,1,1
5,GO TONGUE MORPHOGENESIS,0.0017641,0.31639,0.46769,1,1
5,GO RECEPTOR CLUSTERING,0.00026003,0.31598,0.24677,1,1
5,GO TISSUE REGENERATION,0.00029782,0.31588,0.26214,1,1
5,GO POLARIZED EPITHELIAL CELL DIFFERENTIATION,0.00081984,0.31586,0.26493,1,1
5,GO ENGULFMENT OF APOPTOTIC CELL,0.00023468,0.3157,0.30771,1,1
5,GO SEQUESTERING OF ACTIN MONOMERS,0.0047853,0.31527,0.32922,1,1
5,GO KETONE CATABOLIC PROCESS,0.011326,0.31474,0.30876,1,1
5,GO ASTROCYTE DIFFERENTIATION,1.4039e-05,0.31471,0.31334,1,1
5,GO REGULATION OF RESPONSE TO WOUNDING,6.5149e-05,0.31462,0.26761,1,1
5,GO EPITHELIAL CELL PROLIFERATION,2.1702e-06,0.31447,0.28905,1,1
5,GO REGULATION OF POLYSACCHARIDE METABOLIC PROCESS,1.9263e-05,0.31437,0.26653,1,1
5,GO NEGATIVE REGULATION OF CELL SUBSTRATE JUNCTION ORGANIZATION,0.00065623,0.3143,0.29364,1,1
5,GO HEPARAN SULFATE PROTEOGLYCAN BIOSYNTHETIC PROCESS,0.001662,0.31424,0.25704,1,1
5,GO POSITIVE REGULATION OF CALCINEURIN MEDIATED SIGNALING,0.0051916,0.31414,0.24026,1,1
5,GO NEGATIVE REGULATION OF ACTIVATED T CELL PROLIFERATION,0.0015189,0.31413,0.30908,1,1
5,GO REGULATION OF NEUROTRANSMITTER RECEPTOR ACTIVITY,0.0015653,0.31397,0.28379,1,1
5,GO REGULATION OF SODIUM ION TRANSPORT,2.5308e-05,0.31383,0.26031,1,1
5,GO NEGATIVE REGULATION OF SYSTEMIC ARTERIAL BLOOD PRESSURE,0.014138,0.31305,0.2709,1,1
5,GO DENDRITIC CELL CYTOKINE PRODUCTION,0.0045306,0.31281,0.34148,1,1
5,GO DIGESTIVE SYSTEM DEVELOPMENT,5.2533e-07,0.31254,0.29447,1,1
5,GO NEGATIVE REGULATION OF SMOOTH MUSCLE CELL MIGRATION,0.0010528,0.31252,0.30497,1,1
5,GO REGULATION OF KERATINOCYTE PROLIFERATION,0.0019282,0.31228,0.27248,1,1
5,GO PLACENTA BLOOD VESSEL DEVELOPMENT,0.00010462,0.31218,0.26714,1,1
5,GO ENDOTHELIAL CELL PROLIFERATION,1.5201e-05,0.31206,0.28286,1,1
5,GO NEGATIVE REGULATION OF LYMPHOCYTE ACTIVATION,0.0001547,0.31202,0.2595,1,1
5,GO MAST CELL MEDIATED IMMUNITY,0.00021167,0.31176,0.26967,1,1
5,GO MEMBRANE BIOGENESIS,8.1192e-05,0.31144,0.31273,1,1
5,GO ESTABLISHMENT OF PLANAR POLARITY OF EMBRYONIC EPITHELIUM,0.00050664,0.31143,0.32543,1,1
5,GO METANEPHROS MORPHOGENESIS,0.00012074,0.31137,0.29044,1,1
5,GO REGULATION OF CARDIAC CONDUCTION,0.00013917,0.31135,0.25676,1,1
5,GO REGULATION OF ODONTOGENESIS OF DENTIN CONTAINING TOOTH,0.0045306,0.31123,0.46679,1,1
5,GO OLIGODENDROCYTE DIFFERENTIATION,7.889e-07,0.31107,0.31337,1,1
5,GO NEGATIVE REGULATION OF ATP METABOLIC PROCESS,0.0020453,0.31057,0.23375,1,1
5,GO WNT SIGNALING PATHWAY INVOLVED IN MIDBRAIN DOPAMINERGIC NEURON DIFFERENTIATION,0.0015189,0.31047,0.27537,1,1
5,GO REGULATION OF CELLULAR RESPONSE TO TRANSFORMING GROWTH FACTOR BETA STIMULUS,3.7145e-05,0.31042,0.25568,1,1
5,GO REGULATION OF CELL MATRIX ADHESION,1.8521e-05,0.31032,0.29391,1,1
5,GO NEGATIVE REGULATION OF I KAPPAB KINASE NF KAPPAB SIGNALING,0.00017186,0.31027,0.23576,1,1
5,GO FUSION OF SPERM TO EGG PLASMA MEMBRANE INVOLVED IN SINGLE FERTILIZATION,0.0038387,0.31009,0.35495,1,1
5,GO POSITIVE REGULATION OF STEROID BIOSYNTHETIC PROCESS,0.049546,0.30978,0.16897,1,1
5,GO CELLULAR RESPONSE TO LOW DENSITY LIPOPROTEIN PARTICLE STIMULUS,0.0022992,0.30952,0.24734,1,1
5,GO EMBRYONIC DIGIT MORPHOGENESIS,0.00095906,0.30933,0.19848,1,1
5,GO SKIN EPIDERMIS DEVELOPMENT,7.6603e-06,0.30915,0.25621,1,1
5,GO CARDIAC ATRIUM DEVELOPMENT,0.0020453,0.30895,0.21529,1,1
5,GO REGULATION OF GONAD DEVELOPMENT,0.00090094,0.30895,0.27904,1,1
5,GO PARAXIAL MESODERM DEVELOPMENT,0.016734,0.30893,0.24623,1,1
5,GO NOREPINEPHRINE SECRETION,0.0081404,0.30884,0.28776,1,1
5,GO COLLAGEN ACTIVATED SIGNALING PATHWAY,0.013465,0.30867,0.34322,1,1
5,GO TOXIN METABOLIC PROCESS,0.050569,0.30836,0.21543,1,1
5,GO ACUTE INFLAMMATORY RESPONSE,6.5149e-05,0.30833,0.28318,1,1
5,GO PYRIMIDINE NUCLEOSIDE CATABOLIC PROCESS,0.016734,0.30818,0.18368,1,1
5,GO PRIMARY AMINO COMPOUND METABOLIC PROCESS,0.001986,0.30815,0.35834,1,1
5,GO ATRIAL SEPTUM DEVELOPMENT,0.013139,0.30769,0.24455,1,1
5,GO NEGATIVE REGULATION OF LEUKOCYTE DIFFERENTIATION,5.0226e-05,0.30732,0.2614,1,1
5,GO POSTSYNAPTIC SIGNAL TRANSDUCTION,7.013e-05,0.30653,0.30201,1,1
5,GO NEGATIVE REGULATION OF MYOBLAST DIFFERENTIATION,0.00024286,0.30634,0.33352,1,1
5,GO REGULATION OF CELL SUBSTRATE ADHESION,5.0226e-05,0.30589,0.26601,1,1
5,GO REGULATION OF NON CANONICAL WNT SIGNALING PATHWAY,0.001872,0.30519,0.2081,1,1
5,GO REGULATION OF WATER LOSS VIA SKIN,0.0028141,0.30517,0.43214,1,1
5,GO POSITIVE REGULATION OF EMBRYONIC DEVELOPMENT,0.00013433,0.30498,0.27798,1,1
5,GO REGULATION OF MONONUCLEAR CELL MIGRATION,0.0014299,0.30491,0.21243,1,1
5,GO SPINAL CORD PATTERNING,0.0021062,0.30404,0.34002,1,1
5,GO POSITIVE REGULATION OF COAGULATION,0.00052342,0.30363,0.28474,1,1
5,GO CHROMATIN MEDIATED MAINTENANCE OF TRANSCRIPTION,0.0064317,0.30353,0.21601,1,1
5,GO ESTABLISHMENT OR MAINTENANCE OF TRANSMEMBRANE ELECTROCHEMICAL GRADIENT,3.0689e-05,0.30352,0.28625,1,1
5,GO SYNAPTIC TRANSMISSION CHOLINERGIC,0.00055855,0.30336,0.29689,1,1
5,GO HINDLIMB MORPHOGENESIS,0.00026003,0.30332,0.29976,1,1
5,GO SEX DETERMINATION,0.00012964,0.30329,0.33227,1,1
5,GO EPITHELIAL CELL CELL ADHESION,0.004408,0.30321,0.32582,1,1
5,GO HYDROGEN PEROXIDE BIOSYNTHETIC PROCESS,0.0011199,0.30309,0.32335,1,1
5,GO GLIAL CELL DIFFERENTIATION,7.5427e-07,0.30308,0.28535,1,1
5,GO NEGATIVE REGULATION OF ENDOTHELIAL CELL APOPTOTIC PROCESS,0.019283,0.30282,0.18293,1,1
5,GO RENAL TUBULE DEVELOPMENT,5.4121e-05,0.30202,0.24403,1,1
5,GO POSITIVE REGULATION OF GLIOGENESIS,7.2111e-07,0.30191,0.2994,1,1
5,GO POSITIVE REGULATION OF AMINO ACID TRANSPORT,0.038561,0.30184,0.24163,1,1
5,GO BRANCHING INVOLVED IN PROSTATE GLAND MORPHOGENESIS,0.0049174,0.30137,0.32531,1,1
5,GO POSITIVE REGULATION OF EPITHELIAL CELL APOPTOTIC PROCESS,0.00012512,0.30137,0.26745,1,1
5,GO CALCINEURIN MEDIATED SIGNALING,1.3441e-06,0.30134,0.29052,1,1
5,GO EPITHELIAL CELL FATE COMMITMENT,0.0006154,0.30111,0.49362,1,1
5,GO CHONDROCYTE DIFFERENTIATION INVOLVED IN ENDOCHONDRAL BONE MORPHOGENESIS,0.0023671,0.30093,0.2963,1,1
5,GO POSITIVE REGULATION OF ANIMAL ORGAN MORPHOGENESIS,0.00023468,0.30089,0.26187,1,1
5,GO AV NODE CELL TO BUNDLE OF HIS CELL COMMUNICATION,0.0023671,0.30072,0.35504,1,1
5,GO REGULATION OF WOUND HEALING,0.00040247,0.30072,0.25928,1,1
5,GO POSITIVE REGULATION OF VASCULAR ASSOCIATED SMOOTH MUSCLE CELL PROLIFERATION,0.0090226,0.30071,0.19291,1,1
5,GO POSITIVE REGULATION OF CELL JUNCTION ASSEMBLY,0.0001547,0.30053,0.24331,1,1
5,GO POSITIVE REGULATION OF VASCULAR ENDOTHELIAL CELL PROLIFERATION,0.00019753,0.30013,0.34168,1,1
5,GO CELL CELL ADHESION MEDIATED BY CADHERIN,0.00087311,0.3001,0.26026,1,1
5,GO NEGATIVE REGULATION OF RECEPTOR BINDING,0.0010528,0.3,0.32138,1,1
5,GO DEFENSE RESPONSE TO VIRUS,0.0030654,0.29986,0.22974,1,1
5,GO ACUTE INFLAMMATORY RESPONSE TO ANTIGENIC STIMULUS,0.00010092,0.29971,0.30869,1,1
5,GO REGULATION OF CELL SUBSTRATE JUNCTION ORGANIZATION,0.00045924,0.29933,0.22452,1,1
5,GO NEURON PROJECTION REGENERATION,0.00012074,0.29911,0.26441,1,1
5,GO POSITIVE REGULATION OF TRANSPORTER ACTIVITY,0.00044439,0.29891,0.20969,1,1
5,GO SYNCYTIUM FORMATION,0.00079435,0.2989,0.25629,1,1
5,GO NEGATIVE REGULATION OF VASCULAR ASSOCIATED SMOOTH MUSCLE CELL PROLIFERATION,0.0021062,0.29883,0.26566,1,1
5,GO EMBRYONIC SKELETAL JOINT DEVELOPMENT,0.0075304,0.29864,0.29417,1,1
5,GO NEGATIVE REGULATION OF MAP KINASE ACTIVITY,0.0021689,0.29848,0.22541,1,1
5,GO SODIUM ION IMPORT ACROSS PLASMA MEMBRANE,0.0020453,0.29848,0.23767,1,1
5,GO REGULATION OF MEMBRANE REPOLARIZATION,0.0049174,0.29813,0.2364,1,1
5,GO DORSAL AORTA DEVELOPMENT,0.0023671,0.29799,0.28648,1,1
5,GO REGULATION OF ALPHA BETA T CELL ACTIVATION,0.00029782,0.29788,0.20962,1,1
5,GO TOLL LIKE RECEPTOR 4 SIGNALING PATHWAY,0.0046564,0.29775,0.2302,1,1
